url;title;authors;abstract;subject
https://arxiv.org/abs/1606.04854;Disordered Field Theory in $d=0$ and Distributional Zeta-Function; B. F. Svaiter,  N. F. Svaiter;"  Recently we introduced a new technique for computing the average free energy of a system with quenched randomness. The basic tool of this technique is a distributional zeta-function. The distributional zeta-function is a complex function whose derivative at the origin yields the average free energy of the system as the sum of two contributions: the first one is a series in which all the integer moments of the partition function of the model contribute; the second one, which can not be written as a series of the integer moments, can be made as small as desired. In this paper we present a mathematical rigorous proof that the average free energy of one disordered $\lambda\varphi^{4}$ model defined in a zero-dimensional space can be obtained using the distributional zeta-function technique. We obtain an analytic expression for the average free energy of the model. ";"Mathematical Physics (math-ph); Statistical Mechanics (cond-mat.stat-mech)"
https://arxiv.org/abs/1606.05078;Solution of the Kirchhoff-Plateau problem; Giulio G. Giusteri,  Luca Lussardi,  Eliot Fried;  The Kirchhoff-Plateau problem concerns the equilibrium shapes of a system in which a flexible filament in the form of a closed loop is spanned by a liquid film, with the filament being modeled as a Kirchhoff rod and the action of the spanning surface being solely due to surface tension. We establish the existence of an equilibrium shape that minimizes the total energy of the system under the physical constraint of non-interpenetration of matter, but allowing for points on the surface of the bounding loop to come into contact. In our treatment, the bounding loop retains a finite cross-sectional thickness and a nonvanishing volume, while the liquid film is represented by a set with finite two-dimensional Hausdorff measure. Moreover, the region where the liquid film touches the surface of the bounding loop is not prescribed a priori. Our mathematical results substantiate the physical relevance of the chosen model. Indeed, no matter how strong is the competition between surface tension and the elastic response of the filament, the system is always able to adjust to achieve a configuration that complies with the physical constraints encountered in experiments. ;"Mathematical Physics (math-ph); Analysis of PDEs (math.AP)"
https://arxiv.org/abs/1606.05091;Curvature and geodesic instabilities in a geometrical approach to the  planar three-body problem; Govind S. Krishnaswami,  Himalaya Senapati;  The Maupertuis principle allows us to regard classical trajectories as reparametrized geodesics of the Jacobi-Maupertuis (JM) metric on configuration space. We study this geodesic reformulation of the planar three-body problem with both Newtonian and attractive inverse-square potentials. The associated JM metrics possess translation and rotation isometries in addition to scaling isometries for the inverse-square potential with zero energy E. The geodesic flow on the full configuration space $C^3$ (with collision points excluded) leads to corresponding flows on its Riemannian quotients: the center of mass configuration space $C^2$ and shape space $R^3$ (as well as $S^3$ and the shape sphere $S^2$ for the inverse-square potential when E = 0). The corresponding Riemannian submersions are described explicitly in `Hopf' coordinates which are particularly adapted to the isometries. For equal masses subject to inverse-square potentials, Montgomery shows that the zero-energy `pair of pants' JM metric on the shape sphere is geodesically complete and has negative gaussian curvature except at Lagrange points. We extend this to a proof of boundedness and strict negativity of scalar curvatures everywhere on $C^2, R^3$ & $S^3$ with collision points removed. Sectional curvatures are also found to be largely negative, indicating widespread geodesic instabilities. We obtain asymptotic metrics near collisions, show that scalar curvatures have finite limits and observe that the geodesic reformulation `regularizes' pairwise and triple collisions on $C^2$ and its quotients for arbitrary masses and allowed energies. For the Newtonian potential with equal masses and E=0, we find that the scalar curvature on $C^2$ is strictly negative though it could have either sign on $R^3$. However, unlike for the inverse-square potential, geodesics can encounter curvature singularities at collisions in finite geodesic time. ;"Mathematical Physics (math-ph); Dynamical Systems (math.DS); Chaotic Dynamics (nlin.CD)"
https://arxiv.org/abs/1606.05222;On point interactions realised as Ter-Martirosyan-Skornyakov  Hamiltonians; Alessandro Michelangeli,  Andrea Ottolini;"  For quantum systems of zero-range interaction we discuss the mathematical scheme within which modelling the two-body interaction by means of the physically relevant ultra-violet asymptotics known as the ""Ter-Martirosyan-Skornyakov condition"" gives rise to a self-adjoint realisation of the corresponding Hamiltonian. This is done within the self-adjoint extension scheme of Krein, Visik, and Birman. We show that the Ter-Martirosyan-Skornyakov asymptotics is a condition of self-adjointness only when is imposed in suitable functional spaces, and not just as a pointwise asymptotics, and we discuss the consequences of this fact on a model of two identical fermions and a third particle of different nature. ";Mathematical Physics (math-ph)
https://arxiv.org/abs/1606.05508;A class of asymmetric gapped Hamiltonians on quantum spin chains and its  characterization III; Yoshiko Ogata;  In this paper, we consider classification problem of asymmetric gapped Hamiltonians, which are given as the non-degenerate part of the Hamiltonians introduced in [O1]. We consider the $C^1$-classification, which takes into account the effect of boundaries. We show that the left and right degeneracies of edge ground states are the complete invariant. As a corollary, we consider the bulk-classification problem. We study Hamiltonians that1.are given by translation invariant finite range interactions, 2.are gapped in the bulk, 3.are frustration-free, 4.have uniformly bounded ground state degeneracy on finite intervals, and 5.have a unique bulk ground state. We show that for the bulk-classification, any such Hamiltonians are equivalent. ;"Mathematical Physics (math-ph); Statistical Mechanics (cond-mat.stat-mech); Quantum Physics (quant-ph)"
https://arxiv.org/abs/1606.05569;Entanglement of four-qubit systems: a geometric atlas with polynomial  compass II (the tame world); Frédéric Holweck,  Jean-Garbriel Luque,  Jean-Yves Thibon;  We propose a new approach to the geometry of the four-qubit entanglement classes depending on parameters. More precisely, we use invariant theory and algebraic geometry to describe various stratifications of the Hilbert space by SLOCC invariant algebraic varieties. The normal forms of the four-qubit classification of Verstraete {\em et al.} are interpreted as dense subsets of components of the dual variety of the set of separable states and an algorithm based on the invariants/covariants of the four-qubit quantum states is proposed to identify a state with a SLOCC equivalent normal form (up to qubits permutation). ;"Mathematical Physics (math-ph); Algebraic Geometry (math.AG); Quantum Physics (quant-ph)"
https://arxiv.org/abs/1606.05574;An algebraic approach to a charged particle in an uniform magnetic field; D. Ojeda Guillén,  M. Salazar-Ramírez,  R. D. Mota,  V. D. Granados;  We study the problem of a charged particle in a uniform magnetic field with two different gauges, known as Landau and symmetric gauges. By using a similarity transformation in terms of the displacement operator we show that, for the Landau gauge, the eigenfunctions for this problem are the harmonic oscillator number coherent states. In the symmetric gauge, we calculate the $SU(1,1)$ Perelomov number coherent states for this problem in cylindrical coordinates in a closed form. Finally, we show that these Perelomov number coherent states are related to the harmonic oscillator number coherent states by the contraction of the $SU(1,1)$ group to the Heisenberg-Weyl group. ;Mathematical Physics (math-ph)
https://arxiv.org/abs/1606.05581;2d Fu-Kane-Mele invariant as Wess-Zumino action of the sewing matrix; Krzysztof Gawedzki;  We show that the Fu-Kane-Mele invariant of the 2d time-reversal-invariant crystalline insulators is equal to the properly normalized Wess-Zumino action of the so-called sewing matrix field defined on the Brillouin torus. Applied to 3d, the result permits a direct proof of the known relation between the strong Fu-Kane-Mele invariant and the Chern-Simons action of the non-Abelian Berry connection on the bundle of valence states. ;"Mathematical Physics (math-ph); Other Condensed Matter (cond-mat.other)"
https://arxiv.org/abs/1606.05618;Density of States under non-local interactions II. Simplified  polynomially screened interactions; Victor Chulaevsky;  Following [5], we analyze regularity properties of single-site probability distributions of the random potential and of the Integrated Density of States (IDS) in the Anderson models with infinite-range interactions. In the present work, we study in detail a class of polynomially decaying interaction potentials of rather artificial (piecewise-constant) form, and give a complete proof of infinite smoothness of the IDS in an arbitrarily large finite domain subject to the fluctuations of the entire, infinite random environment. A variant of this result, based as in [5] on the harmonic analysis of probability measures, results in a proof of spectral and dynamical Anderson localization in the considered models. ;Mathematical Physics (math-ph)
https://arxiv.org/abs/1606.06000;An induced real quaternion spherical ensemble of random matrices; Anthony Mays,  Anita Ponsaing;"  We study the induced spherical ensemble of non-Hermitian matrices with real quaternion entries (considering each quaternion as a $2\times 2$ complex matrix). We define the ensemble by the matrix probability distribution function that is proportional to $$\frac{\det (\mathbf{G} \mathbf{G}^{\dagger})^{2 L}} {\det(1_N+ \mathbf{G} \mathbf{G}^{\dagger})^{2(n+N+L)}}.$$ These matrices can also be constructed via a procedure called `inducing', using a product of a Wishart matrix (with parameters $n,N$) and a rectangular Ginibre matrix of size $(N+L)\times N$. The inducing procedure imposes a repulsion of eigenvalues from $0$ and $\infty$ in the complex plane, with the effect that in the limit of large matrix dimension, they lie in an annulus whose inner and outer radii depend on the relative size of $L$, $n$ and $N$. By using functional differentiation of a generalized partition function, we make use of skew-orthogonal polynomials to find expressions for the eigenvalue $m$-point correlation functions, and in particular the eigenvalue density (given by $m=1$). We find the scaled limits of the density in the bulk (away from the real line) as well as near the inner and outer annular radii, in the four regimes corresponding to large or small values of $n$ and $L$. After a stereographic projection the density is uniform on a spherical annulus, except for a depletion of eigenvalues on a great circle corresponding to the real axis (as expected for a real quaternion ensemble). We also form a conjecture for the behaviour of the density near the real line based on analogous results in the $\beta=1$ and $\beta=2$ ensembles; we support our conjecture with data from Monte Carlo simulations of a large number of matrices drawn from the $\beta=4$ induced spherical ensemble. ";"Mathematical Physics (math-ph); Probability (math.PR)"
https://arxiv.org/abs/1606.06144;On the elliptic $\mathfrak{gl}_2$ solid-on-solid model: functional  relations and determinants; W. Galleas;  In this work we study an elliptic solid-on-solid model with domain-wall boundaries having the elliptic quantum group $\mathcal{E}_{p, \gamma}[\widehat{\mathfrak{gl}_2}]$ as its underlying symmetry algebra. We elaborate on results previously presented by the author and extend our analysis to include continuous families of single determinantal representations for the model's partition function. Interestingly, our families of representations are parameterized by two continuous complex variables which can be arbitrarily chosen without affecting the partition function. ;"Mathematical Physics (math-ph); Statistical Mechanics (cond-mat.stat-mech); High Energy Physics - Theory (hep-th); Exactly Solvable and Integrable Systems (nlin.SI)"
https://arxiv.org/abs/1606.06180;Semi-classical resonances associated with a periodic orbit of hyperbolic  type; Hanen Louati,  Michel Rouleux;"  We consider in this Note resonances for a $h$-Pseudo-Differential Operator $H(x,hD_x;h)$ on $L^2(M)$ induced by a periodic orbit of hyperbolic type, as arises for Schr\""odinger operator with AC Stark effect when $M={\bf R}^n$, or the geodesic flow on an axially symmetric manifold $M$, extending Poincar\'e example of Lagrangian systems with 2 degrees of freedom. We generalize the framework of [G\'eSj], in the sense that we allow for hyperbolic and elliptic eigenvalues of Poincar\'e map, and look for so-called semi-excited resonances with imaginary part of magnitude $-h\log h$, or $h^s$, with $0<s<1$. ";Mathematical Physics (math-ph)
https://arxiv.org/abs/1606.06319;Parafermions in the tau-2 model II; Helen Au-Yang,  Jacques H.H. Perk;"  Many years ago Baxter introduced an inhomogeneous two-dimensional classical spin model, now called the $\tau_2(t)$ model with free boundary conditions, and he specialized the resulting quantum spin-chain Hamiltonian in a special limit to a simple clock Hamiltonian. Recently, Fendley showed that this clock Hamiltonian can be expressed in terms of free ""parafermions."" Baxter followed this up by showing that this construction generalizes to the more general $\tau_2(t)$ model, provided some conjectures hold. In this paper, we will compare the different notations and approaches enabling us to express the Hamiltonians in terms of projection operators as introduced by Fendley. By examining the properties of the raising operators, we are then able to prove the last unproven conjecture in Baxter's paper left in our previous paper. Thus the eigenvectors can all be written in terms of these raising operators. ";Mathematical Physics (math-ph)
https://arxiv.org/abs/1606.06442;Conjugation Properties of Tensor Product and Fusion Coefficients; Robert Coquereaux,  Jean-Bernard Zuber;  We review some recent results on properties of tensor product and fusion coefficients under complex conjugation of one of the factors. Some of these results have been proven, some others are conjectures awaiting a proof, one of them involving hitherto unnoticed observations on ordinary representation theory of finite simple groups of Lie type ;"Mathematical Physics (math-ph); High Energy Physics - Theory (hep-th); Quantum Algebra (math.QA); Representation Theory (math.RT)"
https://arxiv.org/abs/1606.06474;Born-Jordan and Weyl Quantizations of the 2D Anisotropic Harmonic  Oscillator; Giovanni Rastelli;  We apply the Born-Jordan and Weyl quantization formulas for polynomials in canonical coordinates to the constants of motion of some examples of the superintegrable 2D anisotropic harmonic oscillator. Our aim is to study the behaviour of the algebra of the constants of motion after the different quantization procedures. In the examples considered, we have that the Weyl formula always preserves the original superintegrable structure of the system, while the Born-Jordan formula, when producing different operators than the Weyl's one, does not. ;"Mathematical Physics (math-ph); Quantum Physics (quant-ph)"
https://arxiv.org/abs/1606.06712;Open intersection numbers and free fields; Alexander Alexandrov;  A complete set of the Virasoro and W-constraints for the Kontsevich-Penner model, which conjecturally describes intersections on moduli spaces of open curves, was derived in our previous work. Here we show that these constraints can be described in terms of free bosonic fields with twisted boundary conditions, which gives a modification of the well-known construction of the $W^{(3)}$ algebra in conformal field theory. This description is natural from the point of view of the spectral curve description, and should serve as a new important ingredient of the topological recursion/Givental decomposition. ;"Mathematical Physics (math-ph); High Energy Physics - Theory (hep-th); Combinatorics (math.CO); Exactly Solvable and Integrable Systems (nlin.SI)"
https://arxiv.org/abs/1606.06727;Force-Free Foliations; Geoffrey Compère,  Samuel E. Gralla,  Alexandru Lupsasca;  Electromagnetic field configurations with vanishing Lorentz force density are known as force-free and appear in terrestrial, space, and astrophysical plasmas. We explore a general method for finding such configurations based on formulating equations for the field lines rather than the field itself. The basic object becomes a foliation of spacetime or, in the stationary axisymmetric case, of the half-plane. We use this approach to find some new stationary and axisymmetric solutions, one of which could represent a rotating plasma vortex near a magnetic null point. ;"Mathematical Physics (math-ph); High Energy Astrophysical Phenomena (astro-ph.HE); General Relativity and Quantum Cosmology (gr-qc)"
https://arxiv.org/abs/1606.06759;A special structure of the scattering operator and infrared divergences  in quantum electrodynamics; Lev Sakhnovich;  We assume that the unperturbed operators $A_0$ are known. Then, the fact that the scattering operators $S$ and the unperturbed operators $A_0$ are pairwise permutable provides some important information about the structure of the scattering operators. Using this information and the ideas from the theory of generalized wave operators, we present a new approach to the divergence problems in quantum electrodynamics. We show that the so called infrared divergences appeared because the deviations of the initial and final waves from the free waves were not taken into account. ;"Mathematical Physics (math-ph); Spectral Theory (math.SP); Quantum Physics (quant-ph)"
https://arxiv.org/abs/1606.06917;The open XXX spin chain in the SoV framework: scalar product of separate  states; N. Kitanine,  J. M. Maillet,  G. Niccoli,  V. Terras;  We consider the XXX open spin-1/2 chain with the most general non-diagonal boundary terms, that we solve by means of the quantum separation of variables (SoV) approach. We compute the scalar products of separate states, a class of states which notably contains all the eigenstates of the model. As usual for models solved by SoV, these scalar products can be expressed as some determinants with a non-trivial dependance in terms of the inhomogeneity parameters that have to be introduced for the method to be applicable. We show that these determinants can be transformed into alternative ones in which the homogeneous limit can easily be taken. These new representations can be considered as generalizations of the well-known determinant representation for the scalar products of the Bethe states of the periodic chain. In the particular case where a constraint is applied on the boundary parameters, such that the transfer matrix spectrum and eigenstates can be characterized in terms of polynomial solutions of a usual T-Q equation, the scalar product that we compute here corresponds to the scalar product between two off-shell Bethe-type states. If in addition one of the states is an eigenstate, the determinant representation can be simplified, hence leading in this boundary case to direct analogues of algebraic Bethe ansatz determinant representations of the scalar products for the periodic chain. ;"Mathematical Physics (math-ph); Statistical Mechanics (cond-mat.stat-mech); High Energy Physics - Theory (hep-th); Exactly Solvable and Integrable Systems (nlin.SI)"
https://arxiv.org/abs/1606.06983;Higher-order Airy scaling in deformed Dyck paths; Nils Haug,  Adri Olde Daalhuis,  Thomas Prellberg;  We introduce a deformed version of Dyck paths (DDP), where additional to the steps allowed for Dyck paths, 'jumps' orthogonal to the preferred direction of the path are permitted. We consider the generating function of DDP, weighted with respect to their half-length, area and number of jumps. This represents the first example of an exactly solvable lattice path model showing a higher-order multicritical point. Applying the generalized method of steepest descents, we see that the associated two-variable scaling function is given by the logarithmic derivative of a generalized (higher-order) Airy integral. ;"Mathematical Physics (math-ph); Statistical Mechanics (cond-mat.stat-mech)"
https://arxiv.org/abs/1606.07053;Uniform Distribution of Eigenstates on a Torus with Two Point Scatterers; Nadav Yesha;  We study the Laplacian perturbed by two delta potentials on a two-dimensional flat torus. There are two types of eigenfunctions for this operator: old, or unperturbed eigenfunctions which are eigenfunctions of the standard Laplacian, and new, perturbed eigenfunctions which are affected by the scatterers. We prove that along a density one sequence, the new eigenfunctions are uniformly distributed in configuration space, provided that the difference of the scattering points is Diophantine. ;"Mathematical Physics (math-ph); Analysis of PDEs (math.AP); Number Theory (math.NT); Chaotic Dynamics (nlin.CD)"
https://arxiv.org/abs/1606.07273;Asymptotic spectral analysis in colliding leaky quantum layers; Sylwia Kondej,  David Krejcirik;  We consider the Schroedinger operator with a complex delta interaction supported by two parallel hypersurfaces in the Euclidean space of any dimension. We analyse spectral properties of the system in the limit when the distance between the hypersurfaces tends to zero. We establish the norm-resolvent convergence to a limiting operator and derive first-order corrections for the corresponding eigenvalues. ;"Mathematical Physics (math-ph); Analysis of PDEs (math.AP); Spectral Theory (math.SP); Quantum Physics (quant-ph)"
https://arxiv.org/abs/1606.07278;Generations of solvable discrete-time dynamical systems; Oksana Bihun,  Francesco Calogero;  A technique is introduced which allows to generate -- starting from any solvable discrete-time dynamical system involving N time-dependent variables -- new, generally nonlinear, generations of discrete-time dynamical systems, also involving N time-dependent variables and being as well solvable by algebraic operations (essentially by finding the N zeros of explicitly known polynomials of degree N). The dynamical systems constructed using this technique may also feature large numbers of arbitrary constants, and they need not be autonomous. The solvable character of these models allows to identify special cases with remarkable time evolutions: for instance, isochronous or asymptotically isochronous discrete-time dynamical systems. The technique is illustrated by a few examples. ;"Mathematical Physics (math-ph); Dynamical Systems (math.DS)"
https://arxiv.org/abs/1606.07290;On a kinetic equation in weak turbulence theory for the nonlinear  Schrödinger equation; A.H.M. Kierkels;"  The results from J. Stat. Phys. 159:668-712 & 163:1350-1393, on a quadratic kinetic equation in the analysis of the long time asymptotics of weak turbulence theory for the nonlinear Schr\""odinger equation, are summarized and placed in context. Additionally, two conjectures on self-similar solutions are presented, and backed with consistency analysis and numerics. ";Mathematical Physics (math-ph)
https://arxiv.org/abs/1606.07355;The ionization conjecture in Thomas-Fermi-Dirac-von Weizsäcker theory; Rupert L. Frank,  Phan Thành Nam,  Hanne Van Den Bosch;"  We prove that in Thomas-Fermi-Dirac-von Weizs\""acker theory, a nucleus of charge $Z>0$ can bind at most $Z+C$ electrons, where $C$ is a universal constant. This result is obtained through a comparison with Thomas-Fermi theory which, as a by-product, gives bounds on the screened nuclear potential and the radius of the minimizer. A key ingredient of the proof is a novel technique to control the particles in the exterior region, which also applies to the liquid drop model with a nuclear background potential. ";"Mathematical Physics (math-ph); Analysis of PDEs (math.AP)"
https://arxiv.org/abs/1606.07469;On singular generalized Berwald spacetimes and the equivalence principle; Ricardo Gallego Torromé;  The notion of singular generalized Finsler spacetime and singular generalized Berwald spacetime are introduced and their relevance for the description of classical gravity discussed. A method to construct examples of such generalized Berwald spacetimes is sketched. The method is applied at two different levels of generality. First, a class of flat, singular generalized Berwald spacetimes is obtained. Then in an attempt of further generalization, a class of non-flat generalized Berwald spacetimes is presented and the associated Einstein field equations are discussed. In this context, an argument in favour of a small value of the cosmological constant is given. The physical significance of the models is briefly discussed in the last section. ;"Mathematical Physics (math-ph); General Relativity and Quantum Cosmology (gr-qc)"
