url;title;authors;abstract;subject
https://arxiv.org/abs/1111.4734;Analytical solutions of the $D$-dimensional Schrödinger equation  with the Woods-Saxon potential for arbitrary $l$ state; V. H. Badalov,  H. I. Ahmadov;"  In this work, the analytical solution of the hyper-radial Schr\""{o}dinger equation for the spherical Woods-Saxon potential in D dimensions is presented. In our calculations, we have applied the Nikiforov-Uvarov method by using the Pekeris approximation to the centrifugal potential for arbitrary $l$ states. The bound state energy eigenvalues and corresponding eigenfunctions are obtained for various values of $n$ and $l$ quantum numbers. ";Mathematical Physics (math-ph)
https://arxiv.org/abs/1111.4735;Rate of Convergence Towards Semi-Relativistic Hartree Dynamics; Ji Oon Lee;"  We consider the semi-relativistic system of $N$ gravitating Bosons with gravitation constant $G$. The time evolution of the system is described by the relativistic dispersion law, and we assume the mean-field scaling of the interaction where $N \to \infty$ and $G \to 0$ while $GN = \lambda$ fixed. In the super-critical regime of large $\lambda$, we introduce the regularized interaction where the cutoff vanishes as $N \to \infty$. We show that the difference between the many-body semi-relativistic Schr\""{o}dinger dynamics and the corresponding semi-relativistic Hartree dynamics is at most of order $N^{-1}$ for all $\lambda$, i.e., the result covers the sub-critical regime and the super-critical regime. The $N$ dependence of the bound is optimal. ";Mathematical Physics (math-ph)
https://arxiv.org/abs/1111.4788;Stable configuration of a molecule as spontaneous symmetry breaking; Vladimir Damljanovic;  In a molecule subjected to no external fields, motion of nuclei is governed by a function V of nuclear coordinates. This function (potential energy) is a sum of two terms: Coulomb repulsion between nuclei and the electronic effective potential E which results from the Born-Oppenheimer approximation. In this paper we have presented a group of coordinate transformations which are the symmetries of functions E and V. We showed that the formula for dynamical representation, which has fundamental importance in the symmetry analysis of normal modes of a molecule, follows from these symmetries. In addition, we proved that every molecule has at least one normal mode belonging to the totally symmetric (and therefore Raman-active) irreducible representation of the point group of that molecule. Next, we used symmetries of V and E to analyze possible shapes of some molecule types. We applied both Abud-Sartori-Michel theorem and symmetry adapted expansion of the electronic effective potential around united atom. Finally, we derived an approximate relation which predicts order of magnitude of the vibration frequency from the bond length in a diatomic molecule. ;Mathematical Physics (math-ph)
https://arxiv.org/abs/1111.4812;Segre maps and entanglement for multipartite systems of  indistinguishable particles; Janusz Grabowski,  Marek Kus,  Giuseppe Marmo;  We elaborate the concept of entanglement for multipartite system with bosonic and fermionic constituents and its generalization to systems with arbitrary parastatistics. The entanglement is characterized in terms of generalized Segre maps, supplementing thus an algebraic approach to the problem by a more geometric point of view. ;"Mathematical Physics (math-ph); Quantum Physics (quant-ph)"
https://arxiv.org/abs/1111.4980;Diffusion Scattering of Waves is a Model of Subquantum Level?; E. M. Beniaminov;  In the paper, we discuss the studies of mathematical models of diffusion scattering of waves in the phase space, and relation of these models with quantum mechanics. In the previous works it is shown that in these models of classical scattering process of waves, the quantum mechanical description arises as the asymptotics after a small time. In this respect, the proposed models can be considered as examples in which the quantum descriptions arise as approximate ones for certain hypothetical reality. The deviation between the proposed models and the quantum ones can arise, for example, for processes with rapidly changing potential function. Under its action the diffusion scattering process of waves will go out from the states described by quantum mechanics. In the paper it is shown that the proposed models of diffusion scattering of waves possess the property of gauge invariance. This implies that they are described similarly in all inertial coordinate systems, i.e., they are invariant under the Galileo transformations. We propose a program of further research. ;"Mathematical Physics (math-ph); Quantum Physics (quant-ph)"
https://arxiv.org/abs/1111.4998;Optical Geometry of the Kerr Space-time; Cameron Bloomer;  We pursue a geometrical approach to gravitational lensing theory. We present a survey of the background theory of General Relativity, including particular properties of the Schwarzschild and Kerr solutions. Next we outline a proof of the Gauss Bonnet theorem and its applications to surfaces in optical geometry, as developed by G. W. Gibbons and M. C. Werner. Finally, we attempt to extend this geometrical approach to the axially symmetric Kerr spacetime, and arrive at an expression for the gravitational deflection angle in the equatorial plane. ;"Mathematical Physics (math-ph); General Relativity and Quantum Cosmology (gr-qc); Differential Geometry (math.DG); Geometric Topology (math.GT)"
https://arxiv.org/abs/1111.5056;Fundamentals of Geometrothermodynamics; Hernando Quevedo,  Maria N. Quevedo;  We present the basic mathematical elements of geometrothermodynamics which is a formalism developed to describe in an invariant way the thermodynamic properties of a given thermodynamic system in terms of geometric structures. First, in order to represent the first law of thermodynamics and the general Legendre transformations in an invariant way, we define the phase manifold as a Legendre invariant Riemannian manifold with a contact structure. The equilibrium manifold is defined by using a harmonic map which includes the specification of the fundamental equation of the thermodynamic system. Quasi-static thermodynamic processes are shown to correspond to geodesics of the equilibrium manifold which preserve the laws of thermodynamics. We study in detail the equilibrium manifold of the ideal gas and the van der Waals gas as concrete examples of the application of geometrothermodynamics. ;"Mathematical Physics (math-ph); General Relativity and Quantum Cosmology (gr-qc)"
https://arxiv.org/abs/1111.5067;A Geometric Method to Investigate Prolongation Structures for  Differential Systems With Applications to Integrable Systems; Paul Bracken;  A type of prolongation structure for several general systems is discussed. They are based on a set of one-forms in which the underlying structure group of the integrability condition corresponds to the Lie-algebra of SL (2,R), O(3), or SU(3). Each will be considered in turn and the latter two systems represent larger 3by3 cases. This geometric approach is applied to all three of these systems to obatin prolongation structures explicitly. In both 3by3 cases the prolongation structure is reduced to the situation of three smaller 2by2 problems. Many types of conservation laws can be obtained at different stages of the development, and at the end, a single result is developed to show how this can be done. ;Mathematical Physics (math-ph)
https://arxiv.org/abs/1111.5130;Batalin-Vilkovisky formalism in locally covariant field theory; Katarzyna Rejzner;  The present work contains a complete formulation of the Batalin-Vilkovisky (BV) formalism in the framework of locally covariant field theory. In the first part of the thesis the classical theory is investigated with a particular focus on the infinite dimensional character of the underlying structures. It is shown that the use of infinite dimensional differential geometry allows for a conceptually clear and elegant formulation. The construction of the BV complex is performed in a fully covariant way and we also generalize the BV framework to a more abstract level, using functors and natural transformations. In this setting we construct the BV complex for classical gravity. This allows us to give a homological interpretation to the notion of diffeomorphism invariant physical quantities in general relativity. The second part of the thesis concerns the quantum theory. We provide a framework for the BV quantization that doesn't rely on the path integral formalism, but is completely formulated within perturbative algebraic quantum field theory. To make such a formulation possible we first prove that the renormalized time-ordered product can be understood as a binary operation on a suitable domain. Using this result we prove the associativity of this product and provide a consistent framework for the renormalized BV structures. In particular the renormalized quantum master equation and the renormalized quantum BV operator are defined. To give a precise meaning to theses objects we make a use of the master Ward identity, which is an important structure in causal perturbation theory. ;"Mathematical Physics (math-ph); High Energy Physics - Theory (hep-th)"
https://arxiv.org/abs/1111.5164;Massless, String Localized Quantum Fields for Any Helicity; M. Plaschke,  J. Yngvason;  For any massless, irreducible representation of the covering of the proper, orthochronous Poincar\'e group we construct covariant, free quantum fields that generate the representation space from the vacuum and are localized in semi-infinite strings in the sense of commutation or anti-commutation of the field operators at space-like separation of the strings. ;Mathematical Physics (math-ph)
https://arxiv.org/abs/1111.5181;Asymptotics of Selberg-like integrals by lattice path counting; Marcel Novaes;  We obtain explicit expressions for positive integer moments of the probability density of eigenvalues of the Jacobi and Laguerre random matrix ensembles, in the asymptotic regime of large dimension. These densities are closely related to the Selberg and Selberg-like multidimensional integrals. Our method of solution is combinatorial: it consists in the enumeration of certain classes of lattice paths associated to the solution of recurrence relations. ;"Mathematical Physics (math-ph); Chaotic Dynamics (nlin.CD)"
https://arxiv.org/abs/1111.5182;Analytical Solution of Second Stokes Problem on Behavior of Gas over  Oscillation Surface. Part II: Mathematical Apparatus for Solving of Problem; V. A. Akimova,  A. V. Latyshev,  A. A. Yushkanov;  In the present work the mathematical apparatus necessary for solving of second Stokes problem is developed. Second Stokes problem is the problem about behavior of rarefied gas filling half-space. A plane, limiting half-space, makes harmonious oscillations in this plane. At the heart of the analytical decision the homogeneous Riemann boundary value problem lays. The decision of homogeneous Riemann problem is function, factorizing problem. Integral representations for factorizing function is deduced. With the help of factorizing function the factorization formula for dispersion function is proved. Zero of dispersion function are searched by means of the factorization formula of dispersion function. ;Mathematical Physics (math-ph)
https://arxiv.org/abs/1111.5222;Deriving the Rosenfeld Functional from the Virial Expansion; Stephan Korden;  In this article we replace the semi-heuristic derivation of the Rosenfeld functional of hard convex particles with the systematic calculation of Mayer clusters. It is shown that each cluster integral further decomposes into diagrams of intersection patterns that we classify by their loop number. This extends the virial expansion of the free-energy by an expansion in the loop order, with the Rosenfeld functional as its leading contribution. Rosenfeld's weight functions follow then from the derivation of the intersection probability by generalizing the equation of Blaschke, Santalo, and Chern. It is found that the 0-loop order can be derived exactly and reproduces the Rosenfeld functional. We further discuss the influence of particle dimensions, topologies, and geometries on the mathematical structure of the calculation. ;"Mathematical Physics (math-ph); Soft Condensed Matter (cond-mat.soft); Statistical Mechanics (cond-mat.stat-mech)"
https://arxiv.org/abs/1111.5249;Inverse scattering approach for massive Thirring models with integrable  type-II defects; A.R. Aguirre (IFT-UNESP, Sao Paulo);  We discuss the integrability of the Bosonic and Grassmannian massive Thirring models in the presence of defects through the inverse scattering approach. We present a general method to compute the generating functions of modified conserved quantities for any integrable field equation associated to the m x m spectral linear problem. We apply the method to derive in particular the defect contributions for the number of occupation, energy and momentum of the massive Thirring models. ;"Mathematical Physics (math-ph); High Energy Physics - Theory (hep-th); Exactly Solvable and Integrable Systems (nlin.SI)"
https://arxiv.org/abs/1111.5257;Quantumness and Entanglement Witnesses; Paolo Facchi,  Saverio Pascazio,  Vlatko Vedral,  Kazuya Yuasa;  We analyze the recently introduced notion of quantumness witness and compare it to that of entanglement witness. We show that any entanglement witness is also a quantumness witness. We then consider some physically relevant examples and explicitly construct some witnesses. ;"Mathematical Physics (math-ph); Quantum Physics (quant-ph)"
https://arxiv.org/abs/1111.5270;On a new unified geometric description of gravity and electromagnetism; Nicoleta Voicu;  In a previous paper, we have introduced a new unified description of the main equations of the gravitational and of the electromagnetic field, in terms of tidal tensors and connections on the tangent bundle TM of the space-time manifold. In the present work, we relate these equations to variational procedures on the tangent bundle. The Ricci scalar of the proposed connection is dynamically equivalent to the usual Einstein-Maxwell Lagrangian. Also, in order to be able to perform these variational procedures, we find an appropriate completion of the metric tensor (from the base manifold) up to a metric structure on TM. ;"Mathematical Physics (math-ph); General Relativity and Quantum Cosmology (gr-qc); Differential Geometry (math.DG)"
https://arxiv.org/abs/1111.5298;Twist of fractional oscillations; Aleksander Stanislavsky;  Using the method of the Laplace transform, we consider fractional oscillations. They are obtained by the time-clock randomization of ordinary harmonic vibrations. In contrast to sine and cosine, the functions describing the fractional oscillations exhibit a finite number of damped oscillations with an algebraic decay. Their fractional differential equation is derived. ;Mathematical Physics (math-ph)
https://arxiv.org/abs/1111.5490;Hamiltonian formulation of a simple theory of the teleparallel geometry; Andrzej Okolow,  Jedrzej Swiezewski;  A theory of cotetrad fields on a four-dimensional manifold is considered. Its configuration space coincides with that of the Teleparallel Equivalent of General Relativity but its dynamics is much simpler. We carry out the Legendre transformation and derive a Hamiltonian and a constraint algebra. ;"Mathematical Physics (math-ph); General Relativity and Quantum Cosmology (gr-qc)"
https://arxiv.org/abs/1111.5492;Central limit theorem for fluctuations of linear eigenvalue statistics  of large random graphs. Diluted regime; Maria Shcherbina,  Brunello Tirozzi;"  We study the linear eigenvalue statistics of large random graphs in the regimes when the mean number of edges for each vertex tends to infinity. We prove that for a rather wide class of test functions the fluctuations of linear eigenvalue statistics converges in distribution to a Gaussian random variable with zero mean and variance which coincides with ""non gaussian"" part of the Wigner ensemble variance. ";"Mathematical Physics (math-ph); Probability (math.PR)"
https://arxiv.org/abs/1111.5540;START in a five-dimensional conformal domain; Arkadiusz Jadczyk;  In this paper we give a brief review of the pseudo-Riemannian geometry of the five-dimensional homogeneous space for the conformal group O(4,2). Its topology is described and its relation to the conformally compactified Minkowski space is described. Its metric is calculated using a generalized half-space representation. Compactification via Lie-sphere geometry is outlined. Possible applications to Jaime Keller's START theory may follow by using its predecessor - the 5-optics of Yu. B. Rumer. The point of view of Rumer is given extensively in the last section of the paper. Keywords. Kaluza,Klein, Rumer, conformal symmetry, hyperbolic space, START, fifth dimension, action coordinate, 5-optics ;"Mathematical Physics (math-ph); General Relativity and Quantum Cosmology (gr-qc)"
https://arxiv.org/abs/1111.5552;Absolutely continuous spectrum of a typical Schrödinger operator with  a slowly decaying potential; Oleg Safronov;"  We consider a family of multi-dimensional Schr\""odinger operators $-\Delta+t V$ with a real $t$. The potential $V$ in our model decays at infinity in a special way, so that it satisfies a certain integral condition. We prove that the absolutely continuous spectrum of this operator covers the interval $[0,\infty)$ for almost every $t$. ";"Mathematical Physics (math-ph); Spectral Theory (math.SP)"
https://arxiv.org/abs/1111.5565;Discrete Determinants and the Gel'fand-Yaglom formula; J. S. Dowker;  I present a partly pedagogic discussion of the Gel'fand-Yaglom formula for the functional determinant of a one-dimensional, second order difference operator, in the simplest settings. The formula is a textbook one in discrete Sturm-Liouville theory and orthogonal polynomials. A two by two matrix approach is developed and applied to Robin boundary conditions. Euler-Rayleigh sums of eigenvalues are computed. A delta potential is introduced as a simple, non-trivial example and extended, in an appendix, to the general case. The continuum limit is considered in a non--rigorous way and a rough comparison with zeta regularised values is made. Vacuum energies are also considered in the free case. Chebyshev polynomials act as free propagators and their properties are developed using the two-matrix formulation, which has some advantages and appears to be novel. A trace formula, rather than a determinant one, is derived for the Gel'fand-Yaglom function. ;"Mathematical Physics (math-ph); General Relativity and Quantum Cosmology (gr-qc); High Energy Physics - Theory (hep-th); Spectral Theory (math.SP)"
https://arxiv.org/abs/1111.5569;On The Harmonic Oscillator Group; Raquel M. Lopez,  Sergei K. Suslov,  Jose M. Vega-Guzman;  We discuss the maximum kinematical invariance group of the quantum harmonic oscillator from a view point of the Ermakov-type system. A six parameter family of the square integrable oscillator wave functions, which seems cannot be obtained by the standard separation of variables, is presented as an example. The invariance group of generalized driven harmonic oscillator is shown to be isomorphic to the corresponding Schroedinger group of the free particle. ;Mathematical Physics (math-ph)
https://arxiv.org/abs/1111.5685;A Topos Model for Loop Quantum Gravity; Tore Dahlen;  One of the main motivations behind so-called topos physics, as developed by Chris Isham and Andreas Doering [4-7], is to provide a framework for new theories of quantum gravity. In this article we do not search for such theories, but ask instead how one of the known candidates for a final theory, loop quantum gravity (LQG), fits into the topos-theoretical approach. In the construction to follow, we apply the 'Bohrification' method developed by Heunen, Landsman and Spitters [10, 11] to the C*-algebra version of LQG introduced by Christian Fleischhack [9]. We then bring together LQG results and methods from topos physics in a proof of the non-sobriety of the external state space S of the Bohrified LQG theory, and show that the construction obeys the standard requirements of diffeomorphism and gauge invariance. ;"Mathematical Physics (math-ph); General Relativity and Quantum Cosmology (gr-qc)"
https://arxiv.org/abs/1111.5755;On the causality of electrodynamics and the Aharonov-Bohm effect; Richard Kowar;  This paper presents a \emph{non-instant field model} for electrodynamics that permits a causal explanation of the \emph{Aharonov-Bohm effect} and a \emph{covariant quantization} of the respective Maxwell equations via the \emph{Gupta-Bleuler method}. Our model satisfies the following \emph{correspondence principle}: if $A^\mu$, $\vE$, $\vB$ denote the four potential, the electric field and the magnetic field of the non-instant field model, then the respective classical quantities are $\A[A^\mu]$, $\A[\vE]$, $\A[\vB]$, where $\A$ is a covariant time averaging operator. Here $\A[A^\mu]$ is interpreted as the best possible measurement of the four potential $A^\mu$. Although the Lorentz condition is not satisfied for $A^\mu$, it is satisfied for $\A[A^\mu]$. The latter fact means that the Lorentz condition does not hold for the quantized field but for its expectation value (cf. \emph{Gupta-Bleuler method} of quantization). Finally, we derive the energy conservation law of our field model and show that the field energy is quantized. ;"Mathematical Physics (math-ph); Quantum Physics (quant-ph)"
https://arxiv.org/abs/1111.5771;Tropical curves and integrable piecewise linear maps; Rei Inoue,  Shinsuke Iwao;"  We present applications of tropical geometry to some integrable piecewise-linear maps, based on the lecture given by one of the authors (R. I.) at the workshop ""Tropical Geometry and Integrable Systems"" (University of Glasgow, July 2011), and on some new results obtained afterward. After a brief review on tropical curve theory, we study the spectral curves and the isolevel sets of the tropical periodic Toda lattice and the periodic Box-ball system. ";"Mathematical Physics (math-ph); Algebraic Geometry (math.AG); Exactly Solvable and Integrable Systems (nlin.SI)"
https://arxiv.org/abs/1111.5794;Classical Helium Atom with Radiation Reaction; G. Camelio,  A. Carati,  L. Galgani;  We study a classical model of Helium atom in which, in addition to the Coulomb forces, the radiation reaction forces are taken into account. This modification brings in the model a new qualitative feature of a global character. Indeed, as pointed out by Dirac, in any model of classical electrodynamics of point particles involving radiation reaction one has to eliminate, from the a priori conceivable solutions of the problem, those corresponding to the emission of an infinite amount of energy. We show that the Dirac prescription solves a problem of inconsistency plaguing all available models which neglect radiation reaction, namely, the fact that in all such models most initial data lead to a spontaneous breakdown of the atom. A further modification is that the system thus acquires a peculiar form of dissipation. In particular, this makes attractive an invariant manifold of special physical interest, the zero--dipole manifold, that corresponds to motions in which no energy is radiated away (in the dipole approximation). We finally study numerically the invariant measure naturally induced by the time--evolution on such a manifold, and this corresponds to studying the formation process of the atom. Indications are given that such a measure may be singular with respect to that of Lebesgue. ;Mathematical Physics (math-ph)
https://arxiv.org/abs/1111.5841;The system of three three-dimensional charged quantum particles:  asymptotic behavior of the eigenfunctions of the continuous spectrum at  infinity (II); V. S. Buslaev,  S. B. Levin;  To our knowledge there are no complete results expressed in terms of eigenfunctions (even not strictly proved mathematically) related to the system of three or more charged quantum particles. For the system of the three such identical particles we suggest the asymptotic formula describing the behavior of eigenfunctions at infinity in configuration space. ;Mathematical Physics (math-ph)
