url;title;authors;abstract;subject
https://arxiv.org/abs/1111.0170;Book review: Stability of Matter in Quantum Mechanics, by Elliott H.  Lieb and Robert Seiringer; Jan Philip Solovej;  Review of Stability of Matter in Quantum Mechanics, by Elliott H. Lieb and Robert Seiringer, Cambridge University Press, Cambridge, 2010, xv+293 pp, ISBN 978-0-521-19118-0. ;Mathematical Physics (math-ph)
https://arxiv.org/abs/1111.0280;Generating Functionals and Lagrangian PDEs; Joris Vankerschaver,  Cuicui Liao,  Melvin Leok;  We introduce the concept of Type-I/II generating functionals defined on the space of boundary data of a Lagrangian field theory. On the Lagrangian side, we define an analogue of Jacobi's solution to the Hamilton-Jacobi equation for field theories, and we show that by taking variational derivatives of this functional, we obtain an isotropic submanifold of the space of Cauchy data, described by the so-called multisymplectic form formula. We also define a Hamiltonian analogue of Jacobi's solution, and we show that this functional is a Type-II generating functional. We finish the paper by defining a similar framework of generating functions for discrete field theories, and we show that for the linear wave equation, we recover the multisymplectic conservation law of Bridges. ;Mathematical Physics (math-ph)
https://arxiv.org/abs/1111.0392;On Distribution of Zeros of Some Quazipolynoms; H. I. Ahmadov;  In this paper we investigate distribution of zeros for only quasipolynom and obtain exactly lower-bound for their modulus. ;Mathematical Physics (math-ph)
https://arxiv.org/abs/1111.0490;Data Set Models and Exponential Families in Statistical Physics and  Beyond; Jan Naudts,  Ben Anthonis;  The exponential family of models is defined in a general setting, not relying on probability theory. Some results of information geometry are shown to remain valid. Exponential families both of classical and of quantum mechanical statistical physics fit into the new formalism. Other less obvious applications are predicted. For instance, quantum states can be modeled as points in a classical phase space and the resulting model belongs to the exponential family. ;Mathematical Physics (math-ph)
https://arxiv.org/abs/1111.0598;Exact solutions for the 2d one component plasma; Timothy D. Andersen;  The 2d one component gas of pointlike charges in a uniform neutralizing background interacting with a logarithmic potential is a common model for plasmas. In its classical equilibrium statistics at fixed temperature (canonical ensemble) it is formally related to certain types of random matrices with Gaussian distribution and complex eigenvalues. In this paper, I present an exact integration of this ensemble for $N$ such particles (or alternatively $N\times N$ matrices) for all even non-negative temperatures, a significant open problem in statistical physics for several decades. I achieve this exact integration via an exact integration of a related ensemble, the two-dimensional Selberg integral. ;Mathematical Physics (math-ph)
https://arxiv.org/abs/1111.0643;Spectral determinants and zeta functions of Schrödinger operators on  metric graphs; J. M. Harrison,  K. Kirsten,  C. Texier;"  A derivation of the spectral determinant of the Schr\""odinger operator on a metric graph is presented where the local matching conditions at the vertices are of the general form classified according to the scheme of Kostrykin and Schrader. To formulate the spectral determinant we first derive the spectral zeta function of the Schr\""odinger operator using an appropriate secular equation. The result obtained for the spectral determinant is along the lines of the recent conjecture. ";"Mathematical Physics (math-ph); High Energy Physics - Theory (hep-th)"
https://arxiv.org/abs/1111.0656;Algebraic spectral gaps; Amaury Mouchet (LMPT);"  For the one-dimensional Schr\""odinger equation, some real intervals with no eigenvalues (the spectral gaps) may be obtained rather systematically with a method proposed by H. Giacomini and A. Mouchet in 2007. The present article provides some alternative formulation of this method, suggests some possible generalizations and extensively discusses the higher-dimensional case. ";"Mathematical Physics (math-ph); Spectral Theory (math.SP); Quantum Physics (quant-ph)"
https://arxiv.org/abs/1111.0659;Exact solution to the 1d one component Coulomb gas at fixed energy; Timothy D. Andersen;  The one dimensional one component plasma has applications to one dimensional particle systems with logarithmic interactions such as charges in a single channel wire or vortex filaments in a fluid convection stream. The exact integral of this plasma in the canonical ensemble with a gaussian confining potential has already been computed. In this paper, I compute the exact volume of the phase space of the plasma of N particles at fixed energy without a confining potential using a microcanonical ensemble and show that, as in the two-dimensional case, it has negative temperature states, suggesting that one dimensional turbulence can occur from vortex/electron clustering. ;Mathematical Physics (math-ph)
https://arxiv.org/abs/1111.0726;Integrable magnetic geodesic flows on Lie groups; Alexey A. Magazev,  Igor V. Shirokov,  Yuriy Y. Yurevich;  Right-invariant geodesic flows on manifolds of Lie groups associated with 2-cocycles of corresponding Lie algebras are discussed. Algebra of integrals of motion for magnetic geodesic flows is considered and necessary and sufficient condition of integrability in quadratures is formulated. Canonic forms for 2-cocycles of all 4-dimensional Lie algebras are given and integrable cases among them are separated. ;Mathematical Physics (math-ph)
https://arxiv.org/abs/1111.0751;Continuous Limits of Classical Repeated Interaction Systems; Julien Deschamps;"  We consider the physical model of a classical mechanical system (called ""small system"") undergoing repeated interactions with a chain of identical small pieces (called ""environment""). This physical setup constitutes an advantageous way of implementing dissipation for classical systems, it is at the same time Hamiltonian and Markovian. This kind of model has already been studied in the context of quantum mechanical systems, where it was shown to give rise to quantum Langevin equations in the limit of continuous time interactions ([2]), but it has never been considered for classical mechanical systems yet. The aim of this article is to compute the continuous limit of repeated interactions for classical systems and to prove that they give rise to particular stochastic differential equations in the limit. In particular we recover the usual Langevin equations associated to the action of heat baths. In order to obtain these results, we consider the discrete-time dynamical system induced by Hamilton's equations and the repeated interactions. We embed it into a continuous-time dynamical system and we compute the limit when the time step goes to 0. This way we obtain a discrete-time approximation of stochastic differential equation, considered as a deterministic dynamical system on the Wiener space, which is not exactly of the usual Euler scheme type. We prove the Lp and almost sure convergence of this scheme. We end up with applications to concrete physical exemples such as a charged particule in an uniform electric field or a harmonic interaction. We obtain the usual Langevin equation for the action of a heat bath when considering a damped harmonic oscillator as the small system. ";"Mathematical Physics (math-ph); Probability (math.PR)"
https://arxiv.org/abs/1111.0757;Angular momentum decomposition of the three-dimensional Wigner harmonic  oscillator; Gilles Regniers,  Joris Van der Jeugt;  In the Wigner framework, one abandons the assumption that the usual canonical commutation relations are necessarily valid. Instead, the compatibility of Hamilton's equations and the Heisenberg equations are the starting point, and no further assumptions are made about how the position and momentum operators commute. Wigner quantization leads to new classes of solutions, and representations of Lie superalgebras are needed to describe them. For the n-dimensional Wigner harmonic oscillator, solutions are known in terms of the Lie superalgebras osp(1|2n) and gl(1|n). For n=3N, the question arises as to how the angular momentum decomposition of representations of these Lie superalgebras is computed. We construct generating functions for the angular momentum decomposition of specific series of representations of osp(1|6N) and gl(1|3N), with N=1 and N=2. This problem can be completely solved for N=1. However, for N=2 only some classes of representations allow executable computations ;"Mathematical Physics (math-ph); Quantum Physics (quant-ph)"
https://arxiv.org/abs/1111.0777;Generalised Elliptic Functions; Matthew England,  Chris Athorne;  We consider multiply periodic functions, sometimes called Abelian functions, defined with respect to the period matrices associated with classes of algebraic curves. We realise them as generalisations of the Weierstras P-function using two different approaches. These functions arise naturally as solutions to some of the important equations of mathematical physics and their differential equations, addition formulae, and applications have all been recent topics of study. The first approach discussed sees the functions defined as logarithmic derivatives of the sigma-function, a modified Riemann theta-function. We can make use of known properties of the sigma function to derive power series expansions and in turn the properties mentioned above. This approach has been extended to a wide range of non hyperelliptic and higher genus curves and an overview of recent results is given. The second approach defines the functions algebraically, after first modifying the curve into its equivariant form. This approach allows the use of representation theory to derive a range of results at lower computational cost. We discuss the development of this theory for hyperelliptic curves and how it may be extended in the future. ;"Mathematical Physics (math-ph); Algebraic Geometry (math.AG); Representation Theory (math.RT)"
https://arxiv.org/abs/1111.0787;On the energy-momentum spectrum of a homogeneous Fermi gas; Jan Dereziński,  Krzysztof A. Meissner,  Marcin Napiórkowski;  We consider translation invariant quantum systems in thermodynamic limit. We argue that their energy-momentum spectra should have shapes consistent with effective models involving quasiparticles. Our main example is second quantized homogeneous interacting Fermi gas in a large cubic box with periodic boundary conditions, at zero temperature. We expect that its energy-momentum spectrum has a positive energy gap and a positive critical velocity. ;Mathematical Physics (math-ph)
https://arxiv.org/abs/1111.0827;A Study about the Supersymmetry in the context of Quantum Mechanics; Fabricio Marques;  In this work we present an introduction to Supersymmetry in the context of 1-dimensional Quantum Mechanics. For that purpose we develop the concept of hamiltonians factorization using the simple harmonic oscillator as an example, we introduce the supersymmetric oscilator and, next, we generalize these concepts to introduce the fundamentals of Supersymmetric Quantum Mechanics. We also discuss useful tools to solve problems in Quantum Mechanics which are intrinsecally related to Supersymmetry as hierarchy of hamiltonians and shape invariance. We present two approximation methods which will be specially useful: the well known Variational Method and the Logarithmic Perturbation Theory, the latter being closely related to the concepts of superpotentials and hierarchy of hamiltonians. Finally, we present problems related to superpotentials which are monomials in even powers of the x coordinate multiplied by the sign function epsilon(x), which seems to be a new class of problems in Supersymmetric Quantum Mechanics. ;Mathematical Physics (math-ph)
https://arxiv.org/abs/1111.0861;Invariant-based approach to symmetry class detection; Nicolas Auffray (MSME),  Boris Kolev (LATP),  Michel Petitot (LIFL);  In this paper, the problem of the identification of the symmetry class of a given tensor is asked. Contrary to classical approaches which are based on the spectral properties of the linear operator describing the elasticity, our setting is based on the invariants of the irreducible tensors appearing in the harmonic decomposition of the elasticity tensor [Forte-Vianello, 1996]. To that aim we first introduce a geometrical description of the space of elasticity tensors. This framework is used to derive invariant-based conditions that characterize symmetry classes. For low order symmetry classes, such conditions are given on a triplet of quadratic forms extracted from the harmonic decomposition of the elasticity tensor $C$, meanwhile for higher-order classes conditions are provided in terms of elements of $H^{4}$, the higher irreducible space in the decomposition of $C$. Proceeding in such a way some well known conditions appearing in the Mehrabadi-Cowin theorem for the existence of a symmetry plane are retrieved, and a set of algebraic relations on polynomial invariants characterizing the orthotropic, trigonal, tetragonal, transverse isotropic and cubic symmetry classes are provided. Using a genericity assumption on the elasticity tensor under study, an algorithm to identify the symmetry class of a large set of tensors is finally provided. ;"Mathematical Physics (math-ph); Classical Physics (physics.class-ph)"
https://arxiv.org/abs/1111.0886;Formalism of operators for Laguerre-Gauss modes; A. L. F. da Silva,  A. T. B. Celeste,  M. Pazetti,  C. E. F. Lopes;  In this work apply the algebra of operators of quantum mechanics in the Helmholtz wave equation in cylindrical coordinates in paraxial approximation to describe the raising and lowering operators for the Laguerre-Gauss modes. ;Mathematical Physics (math-ph)
https://arxiv.org/abs/1111.1005;On detection of quasiclassical states; Michał Oszmaniec,  Marek Kuś;  We give a criterion of classicality for mixed states in terms of expectation values of a quantum observable. Using group representation theory we identify all cases when the criterion can be computed exactly in terms of the spectrum of a single operator. ;"Mathematical Physics (math-ph); Quantum Physics (quant-ph)"
https://arxiv.org/abs/1111.1050;Unified derivation of exact solutions for a class of quasi-exactly  solvable models; Davids Agboola,  Yao-Zhong Zhang;  We present a unified treatment of exact solutions for a class of four quantum mechanical models, namely the singular anharmonic potential, the generalized quantum isotonic oscillator, the soft-core Coulomb potential, and the non-polynomially modified oscillator. We show that all four cases are reducible to the same basic ordinary differential equation, which is quasi-exactly solvable. A systematic and closed form solution to the basic equation is obtained via the Bethe ansatz method. Using the result, general exact expressions for the energies and the allowed potential parameters are given explicitly for each of the four cases in terms of the roots of a set of algebraic equations. A hidden $sl(2)$ algebraic structure is also discovered in these models. ;"Mathematical Physics (math-ph); Exactly Solvable and Integrable Systems (nlin.SI); Quantum Physics (quant-ph)"
https://arxiv.org/abs/1111.1159;Geometric spectral inversion for singular potentials; Richard L. Hall,  Wolfgang Lucha;  The function E = F(v) expresses the dependence of a discrete eigenvalue E of the Schroedinger Hamiltonian H = -\Delta + vf(r) on the coupling parameter v. We use envelope theory to generate a functional sequence \{f^{[k]}(r)\} to reconstruct f(r) from F(v) starting from a seed potential f^{[0]}(r). In the power-law or log cases the inversion can be effected analytically and is complete in just two steps. In other cases convergence is observed numerically. To provide concrete illustrations of the inversion method it is first applied to the Hulth\'en potential, and it is then used to invert spectral data generated by singular potentials with shapes of the form f(r) = -a/r + b\sgn(q)r^q and f(r) = -a/r + b\ln(r), a, b > 0. For the class of attractive central potentials with shapes f(r) = g(r)/r, with g(0)< 0 and g'(r)\ge 0, we prove that the ground-state energy curve F(v) determines f(r) uniquely. ;"Mathematical Physics (math-ph); High Energy Physics - Theory (hep-th); Quantum Physics (quant-ph)"
https://arxiv.org/abs/1111.1213;Simple models exhibiting spontaneous symmetry breakdown in classical and  non-relativistic quantum mechanics; R. Munoz,  A. Garcia-Quiroz,  Ernesto Lopez-Chavez,  Encarnacion Salinas-Hernandez;  First, the properties of a classical model of spontaneous symmetry breakdown are analyzed. Then, the pros and cons of some pedagogical non-relativistic quantum-mechanical models, also used to illustrate spontaneous symmetry breakdown, are discussed. Finally, a simple quantum-mechanical toy model (a spinor on the line, with a spin-dependent interaction) is presented, that exhibits the spontaneous breaking of an internal symmetry. ;"Mathematical Physics (math-ph); High Energy Physics - Theory (hep-th)"
https://arxiv.org/abs/1111.1245;Some Results for the Primitive Equations with Physical Boundary  Conditions; Lawrence Christopher Evans,  Robert Gastler;  In this paper we consider the (simplified) 3-dimensional primitive equations with \emph{physical boundary conditions}. We show that the equations with constant forcing have a bounded absorbing ball in the $H^1$-norm and that a solution to the unforced equations has its $H^1$-norm decay to 0. From this, we argue that there exists an invariant measure (on $H^1$) for the equations under random kick-forcing. ;"Mathematical Physics (math-ph); Dynamical Systems (math.DS)"
https://arxiv.org/abs/1111.1265;Saturated-Unsaturated flow in a Compressible Leaky-unconfined Aquifer; Phoolendra K. Mishra,  Velimir V. Vessilinov,  Kristopher L. Kuhlman;  An analytical solution is developed for three-dimensional flow towards a partially penetrating large-diameter well in an unconfined aquifer bounded below by an aquitard of finite or semi-infinite extent. The analytical solution is derived using Laplace and Hankel transforms, then inverted numerically. Existing solutions for flow in leaky unconfined aquifers neglect the unsaturated zone following an assumption of instantaneous drainage assumption due to Neuman [1972]. We extend the theory of leakage in unconfined aquifers by (1) including water flow and storage in the unsaturated zone above the water table, and (2) allowing the finite-diameter pumping well to partially penetrate the aquifer. The investigation of model-predicted results shows that leakage from an underlying aquitard leads to significant departure from the unconfined solution without leakage. The investigation of dimensionless time-drawdown relationships shows that the aquitard drawdown also depends on unsaturated zone properties and the pumping-well wellbore storage effects. ;"Mathematical Physics (math-ph); Fluid Dynamics (physics.flu-dyn)"
https://arxiv.org/abs/1111.1350;Spectral density asymptotics for Gaussian and Laguerre $β$-ensembles  in the exponentially small region; Peter J. Forrester;  The first two terms in the large $N$ asymptotic expansion of the $\beta$ moment of the characteristic polynomial for the Gaussian and Laguerre $\beta$-ensembles are calculated. This is used to compute the asymptotic expansion of the spectral density in these ensembles, in the exponentially small region outside the leading support, up to terms $o(1)$ . The leading form of the right tail of the distribution of the largest eigenvalue is given by the density in this regime. It is demonstrated that there is a scaling from this, to the right tail asymptotics for the distribution of the largest eigenvalue at the soft edge. ;Mathematical Physics (math-ph)
https://arxiv.org/abs/1111.1377;Symmetries, Integrability and Exact Solutions for Nonlinear Systems; Rodica Cimpoiasu,  Radu Constantinescu;  The paper intends to offer a general overview on what the concept of integrability means for a nonlinear dynamical system and how the symmetry method can be applied for approaching it. After a general part where key problems as direct and indirect symmetry method or optimal system of solutions are tackled out, in the second part of the lecture two concrete models of nonlinear dynamical systems are effectively studied in order to illustrate how the procedure is working out. The two models are the 2D Ricci flow model coming from the general relativity and the 2D convective-diffusion equation . Part of the results, especially concerning the optimal systems of solutions, are new ones. Keywords: Lie symmetries, invariants, similarity reduction. ;Mathematical Physics (math-ph)
https://arxiv.org/abs/1111.1435;Tidal tensors in the description of gravity and electromagnetism;" Nicoleta Voicu (""Transilvania"" University of Brasov, Romania)";  In 2008-2009, F. Costa and C. Herdeiro proposed a new gravito-electromagnetic analogy, based on tidal tensors. We show that connections on the tangent bundle of the space-time manifold can help not only in finding a covnenient geometrization of their ideas, but also a common mathematical description of the main equations of gravity and electromagnetism. ;"Mathematical Physics (math-ph); General Relativity and Quantum Cosmology (gr-qc); Differential Geometry (math.DG)"
https://arxiv.org/abs/1111.1439;$λ$-symmetries and Jacobi Last Multiplier; M. C. Nucci,  D. Levi;  We show that $\lambda$-symmetries can be algorithmically obtained by using the Jacobi last multiplier. Several examples are provided. ;"Mathematical Physics (math-ph); Dynamical Systems (math.DS)"
https://arxiv.org/abs/1111.1456;Generalized evolutionary equations with imposed symmetries; Rodica Cimpoiasu,  Radu Constantinescu;"  The paper proposes an algorithm which could identify a general class of pdes describing dynamical systems with similar symmetries. The way that will be followed starts from a given group of symmetries, the determination of the invariants and, then, of the compatible equations of evolution. The algorithm will be exemplified by two classes of equations which describe the Fokker-Planck model and the ""backward"" Kolgomorov one. ";"Mathematical Physics (math-ph); Analysis of PDEs (math.AP)"
https://arxiv.org/abs/1111.1460;Curved String Topology and Tangential Fukaya Categories; Daniel Pomerleano;  Given a simply connected manifold M such that its cochain algebra, C^\star(M), is a pure Sullivan dga, this paper considers curved deformations of the algebra C_\star({\Omega}M) and consider when the category of curved modules over these algebras becomes fully dualizable. For simple manifolds, like products of spheres, we are able to give an explicit criterion for when the resulting category of curved modules is smooth, proper and CY and thus gives rise to a TQFT. We give Floer theoretic interpretations of these theories for projective spaces and their products, which involve defining a Fukaya category which counts holomorphic disks with prescribed tangencies to a divisor. ;"Mathematical Physics (math-ph); Category Theory (math.CT)"
https://arxiv.org/abs/1111.1463;Determinant and Weyl anomaly of Dirac operator: a holographic derivation; Rodrigo Aros,  Danilo E Diaz;"  We present a holographic formula relating functional determinants: the fermion determinant in the one-loop effective action of bulk spinors in an asymptotically locally AdS background, and the determinant of the two-point function of the dual operator at the conformal boundary. The formula originates from AdS/CFT heuristics that map a quantum contribution in the bulk partition function to a subleading large-N contribution in the boundary partition function. We use this holographic picture to address questions in spectral theory and conformal geometry. As an instance, we compute the type-A Weyl anomaly and the determinant of the iterated Dirac operator on round spheres, express the latter in terms of Barnes' multiple gamma function and gain insight into a conjecture by B\""ar and Schopka. ";"Mathematical Physics (math-ph); General Relativity and Quantum Cosmology (gr-qc); High Energy Physics - Theory (hep-th)"
https://arxiv.org/abs/1111.1487;SO(4) Re-revisited; Kazuyuki Fujii (Yokohama City University);  In this note an explicit expression of $\exp A\ (A\in so(4))$ is given in terms of the magic matrix by Makhlin. ;"Mathematical Physics (math-ph); Quantum Physics (quant-ph)"
https://arxiv.org/abs/1111.1505;Enhanced Wegner and Minami estimates and eigenvalue statistics of random  Anderson models at spectral edges; François Germinet (AGM),  Frédéric Klopp (IMJ);"  We consider the discrete Anderson model and prove enhanced Wegner and Minami estimates where the interval length is replaced by the IDS computed on the interval. We use these estimates to improve on the description of finite volume eigenvalues and eigenfunctions obtained in a previous paper. As a consequence of the improved description of eigenvalues and eigenfunctions, we revisit a number of results on the spectral statistics in the localized regime and extend their domain of validity, namely : - the local spectral statistics for the unfolded eigenvalues; - the local asymptotic ergodicity of the unfolded eigenvalues; In dimension 1, for the standard Anderson model, the improvement enables us to obtain the local spectral statistics at band edge, that is in the Lifshitz tail regime. In higher dimensions, this works for modified Anderson models. ";Mathematical Physics (math-ph)
