url;title;authors;abstract;subject
https://arxiv.org/abs/1512.06453;$γ$-soft $^{146}$Ba and the role of non-axial shapes at N ~ 90; A. J. Mitchell,  C. J. Lister,  E. A. McCutchan,  M. Albers,  A. D. Ayangeakaa,  P. F. Bertone,  M. P. Carpenter,  C. J. Chiara,  P. Chowdhury,  J. A. Clark,  P. Copp,  H. M. David,  A. Y. Deo,  B. DiGiovine,  N. D'Olympia,  R. Dungan,  R. D. Harding,  J. Harker,  S. S. Hota,  R. V. F. Janssens,  F. G. Kondev,  S. H. Liu,  A. V. Ramayya,  J. Rissanen,  G. Savard,  D. Seweryniak,  R. Shearman,  A. A. Sonzogni,  S. L. Tabor,  W. B. Walters,  E. Wang,  S. Zhu;  Low-spin states in the neutron-rich, N = 90 nuclide $^{146}$Ba were populated following $\beta$-decay of $^{146}$Cs, with the goal of clarifying the development of deformation in Ba isotopes through delineation of their non-yrast structures. Fission fragments of $^{146}$Cs were extracted from a 1.7-Ci $^{252}$Cf source and mass-selected using the CARIBU facility. Low-energy ions were deposited at the center of a box of thin $\beta$ detectors, surrounded by a high-efficiency HPGe array. The new $^{146}$Ba decay scheme now contains 31 excited levels extending up to ~2.5 MeV excitation energy, double what was previously known. These data are compared to predictions from the Interacting Boson Approximation (IBA) model. It appears that the abrupt shape change found at N = 90 in Sm and Gd is much more gradual in Ba and Ce, due to an enhanced role of the $\gamma$ degree of freedom. ;Nuclear Experiment (nucl-ex)
https://arxiv.org/abs/1512.06555;Shedding New Light on Kaon-Nucleon/Nuclei Interaction and Its  Astrophysical Implications with the AMADEUS Experiment at DAFNE; A. Scordo,  M. Bazzi,  G. Bellotti,  C. Berucci,  D. Bosnar,  A.M. Bragadireanu,  A. Clozza,  M. Cargnelli,  C. Curceanu,  A. Dawood Butt,  R. Del Grande,  L. Fabbietti,  C. Fiorini,  F. Ghio,  C. Guaraldo,  M. Iliescu,  P. Levi Sandri,  J. Marton,  D. Pietreanu,  K. Piscicchia,  H. Shi,  D. Sirghi,  F. Sirghi,  I. Tucakovic,  O. Vazquez Doce,  W. Wiedmann,  J. Zmeskal;  The AMADEUS experiment deals with the investigation of the low-energy kaon-nuclei hadronic interaction at the DA{\Phi}NE collider at LNF-INFN, which is fundamental to respond longstanding questions in the non-perturbative QCD strangeness sector. The antikaon-nucleon potential is investigated searching for signals from possible bound kaonic clusters, which would open the possibility for the formation of cold dense baryonic matter. The confirmation of this scenario may imply a fundamental role of strangeness in astrophysics. AMADEUS step 0 consisted in the reanalysis of 2004/2005 KLOE dataset, exploiting K- absorptions in H, 4He, 9Be and 12C in the setup materials. In this paper, together with a review on the multi-nucleon K- absorption and the particle identification procedure, the first results on the {\Sigma}0-p channel will be presented including a statistical analysis on the possible accomodation of a deeply bound state ;Nuclear Experiment (nucl-ex)
https://arxiv.org/abs/1610.00263;Observation of charge-dependent azimuthal correlations in pPb collisions  and its implication for the search for the chiral magnetic effect; CMS Collaboration;  Charge-dependent azimuthal particle correlations with respect to the second-order event plane in pPb and PbPb collisions at a nucleon-nucleon center-of-mass energy of 5.02 TeV have been studied with the CMS experiment at the LHC. The measurement is performed with a three-particle correlation technique, using two particles with the same or opposite charge within the pseudorapidity range abs(eta) < 2.4, and a third particle measured in the hadron forward calorimeters (4.4 < abs(eta) < 5). The observed differences between the same and opposite sign correlations, as functions of multiplicity and eta gap between the two charged particles, are of similar magnitude in pPb and PbPb collisions at the same multiplicities. These results pose a challenge for the interpretation of charge-dependent azimuthal correlations in heavy ion collisions in terms of the chiral magnetic effect. ;"Nuclear Experiment (nucl-ex); High Energy Physics - Experiment (hep-ex)"
https://arxiv.org/abs/1610.00400;Spectrum and Structure of Excited Baryons with CLAS; Volker D. Burkert;  In this contribution we discuss recent results in light quark baryon spectroscopy involving CLAS data and higher level analysis results from the partial wave analysis by the Bonn-Gatchina group. New baryon states were discovered largely based on the open strangeness production channels $\gamma p \to K^+ \Lambda$ and $\gamma p \to K^+ \Sigma^0$. The data illustrate the great potential of the kaon-hyperon channel in the discovery of higher mass baryon resonances in s-channel production. Other channels with discovery potential, such as $\gamma p \to p \omega$ and $\gamma p \to \phi p$ are also discussed. In the second part I will demonstrate on data the sensitivity of meson electroproduction to expose the active degrees of freedom underlying resonance transitions as a function of the probed distance scale. For several of the prominent excited states in the lower mass range the short distance behavior is described by a core of three dressed-quarks with running quark mass, and meson-baryon contributions make up significant parts of the excitation strength at large distances. Finally, an outlook is given of baryon resonance physics at the 12 GeV CEBAF electron accelerator. ;"Nuclear Experiment (nucl-ex); High Energy Physics - Experiment (hep-ex); High Energy Physics - Lattice (hep-lat); High Energy Physics - Phenomenology (hep-ph)"
https://arxiv.org/abs/1610.00482;Two-particle correlations in azimuthal angle and pseudorapidity in  inelastic p+p interactions at the CERN Super Proton Synchrotron;" <!-- function toggleAuthorList(whichLayer,toggleThis) {   var elem, vis, tempToggle;   tempToggle=toggleThis;   if( document.getElementById ) // standard       elem = document.getElementById( whichLayer );   else if( document.all ) // old msie versions       elem = document.all[whichLayer];   else if( document.layers ) // nn4       elem = document.layers[whichLayer];   vis = elem.style;   // if the style.display value is blank we try to figure it out here   if(vis.display==''&&elem.offsetWidth!=undefined&&elem.offsetHeight!=undefined)     vis.display = (elem.offsetWidth!=0&&elem.offsetHeight!=0)?'inline':'none';   vis.display = (vis.display==''||vis.display=='inline')?'none':'inline';    // toggle link inner text   status = vis.display;   if(status=='none'){       document.getElementById('toggle').innerHTML = tempToggle + "")"";       document.getElementById('toggle').title = ""Show Entire Author List"";   }   else if(status=='inline'){       document.getElementById('toggle').innerHTML = ""(collapse list)"";       document.getElementById('toggle').title = ""Collapse Author List"";   } }  //-->  NA61/SHINE Collaboration:  A. Aduszkiewicz,  Y. Ali,  E. Andronov,  T. Anticic,  N. Antoniou,  B. Baatar,  F. Bay,  A. Blondel,  M. Bogomilov,  A. Brandin,  A. Bravar,  J. Brzychczyk,  S.A. Bunyatov,  O. Busygina,  P. Christakoglou,  M. Cirkovic,  T. Czopowicz,  A. Damyanova,  N. Davis,  H. Dembinski,  M. Deveaux,  F. Diakonos,  S. Di Luise,  W. Dominik,  J. Dumarchez,  R. Engel,  A. Ereditato,  G.A. Feofilov,  Z. Fodor,  A. Garibov,  M. Gazdzicki,  M. Golubeva,  K. Grebieszkow,  A. Grzeszczuk,  F. Guber,  A. Haesler,  T. Hasegawa,  A.E. Herve,  M. Hierholzer,  J. Hylen,  S. Igolkin,  A. Ivashkin,  S.R. Johnson,  K. Kadija,  A. Kapoyannis,  E. Kaptur,  M. Kielbowicz,  J. Kisiel,  N. Knezevic,  T. Kobayashi,  V.I. Kolesnikov,  D. Kolev,  V.P. Kondratiev,  A. Korzenev,  V. Kovalenko,  K. Kowalik,  S. Kowalski,  M. Koziel,  A. Krasnoperov,  M. Kuich,  A. Kurepin,  D. Larsen,  A. Laszlo,  M. Lewicki,  B. Lundberg,  V.V. Lyubushkin,  M. Mackowiak-Pawlowska,  B. Maksiak,  A.I. Malakhov,  D. Manic,  A. Marchionni,  A. Marcinek,  A.D. Marino,  K. Marton,  H.-J. Mathes,  T. Matulewicz,  V. Matveev,  G.L. Melkumov,  A. Merzlaya,  B. Messerly,  G.B. Mills,  S. Morozov,  S. Mrowczynski,  Y. Nagai,  T. Nakadaira,  M. Naskret,  M. Nirkko,  K. Nishikawa,  V. Ozvenchuk,  A.D. Panagiotou,  V. Paolone,  M. Pavin,  O. Petukhov,  C. Pistillo,  R. Planeta,  B.A. Popov,  M. Posiadala,  S. Pulawski,  J. Puzovic,  R. Rameika,  W. Rauch,  M. Ravonel,  A. Redij,  R. Renfordt,  E. Richter-Was,  A. Robert,  D. Rohrich,  E. Rondio,  M. Roth,  A. Rubbia,  B.T. Rumberger,  A. Rustamov,  M. Rybczynski,  A. Rybicki,  A. Sadovsky,  K. Sakashita,  R. Sarnecki,  K. Schmidt,  T. Sekiguchi,  I. Selyuzhenkov,  A. Seryakov,  P. Seyboth,  D. Sgalaberna,  M. Shibata,  M. Slodkowski,  P. Staszel,  G. Stefanek,  J. Stepaniak,  H. Strobele,  T. Susa,  M. Szuba,  M. Tada,  A. Taranenko,  A. Tefelska,  D. Tefelski,  V. Tereshchenko,  R. Tsenov,  L. Turko,  R. Ulrich,  M. Unger,  M. Vassiliou,  D. Veberic,  V.V. Vechernin,  G. Vesztergombi,  L. Vinogradov,  M. Walewski,  A. Wickremasinghe,  A. Wilczek,  Z. Wlodarczyk,  A. Wojtaszek-Szwarc,  O. Wyszynski,  L. Zambelli,  E.D. Zimmerman,  R. Zwaska  et al. (94 additional authors not shown) You must enabled JavaScript to view entire author list. ";  Results on two-particle $\Delta\eta\Delta\phi$ correlations in inelastic p+p interactions at 20, 31, 40, 80, and 158~GeV/c are presented. The measurements were performed using the large acceptance NA61/SHINE hadron spectrometer at the CERN Super Proton Synchrotron. The data show structures which can be attributed mainly to effects of resonance decays, momentum conservation, and quantum statistics. The results are compared with the EPOS and UrQMD models. ;Nuclear Experiment (nucl-ex)
https://arxiv.org/abs/1610.00483;Improved Direct Measurement of the 64.5 keV Resonance Strength in the  17O(p,a)14N Reaction at LUNA; C.G. Bruno,  D.A. Scott,  M. Aliotta,  A. Formicola,  A. Best,  A. Boeltzig,  D. Bemmerer,  C. Broggini,  A. Caciolli,  F. Cavanna,  G.F. Ciani,  P. Corvisiero,  T. Davinson,  R. Depalo,  A. Di Leva,  Z. Elekes,  F. Ferraro,  Zs. Fueloep,  G. Gervino,  A. Guglielmetti,  C. Gustavino,  Gy. Gyurky,  G. Imbriani,  M. Junker,  R. Menegazzo,  V. Mossa,  F.R. Pantaleo,  D. Piatti,  P. Prati,  E. Somorjai,  O. Straniero,  F. Strieder,  T. Szucks,  M.P. Takacs,  D. Trezzi (LUNA Collaboration);  The $^{17}$O(p,$\alpha$)$^{14}$N reaction plays a key role in various astrophysical scenarios, from asymptotic giant branch stars to classical novae. It affects the synthesis of rare isotopes such as $^{17}$O and $^{18}$F, which can provide constraints on astrophysical models. A new direct determination of the $E_{\rm R}~=~64.5$~keV resonance strength performed at the Laboratory for Underground Nuclear Astrophysics accelerator has led to the most accurate value to date, $\omega\gamma = 10.0 \pm 1.4_{\rm stat} \pm 0.7_{\rm syst}$~neV, thanks to a significant background reduction underground and generally improved experimental conditions. The (bare) proton partial width of the corresponding state at $E_{\rm x} = 5672$~keV in $^{18}$F is $\Gamma_{\rm p} = 35 \pm 5_{\rm stat} \pm 3_{\rm syst}$~neV. This width is about a factor of 2 higher than previously estimated thus leading to a factor of 2 increase in the $^{17}$O(p,$\alpha$)$^{14}$N reaction rate at astrophysical temperatures relevant to shell hydrogen-burning in red giant and asymptotic giant branch stars. The new rate implies lower $^{17}$O/$^{16}$O ratios, with important implications on the interpretation of astrophysical observables from these stars. ;Nuclear Experiment (nucl-ex)
https://arxiv.org/abs/1610.00509;Unbound states in $^{12}$C populated by $γ$-decay of the  $(J^π,T) = (2^+,1)$ 16.11 MeV state; K. L. Laursen,  H. O. U. Fynbo,  O. S. Kirsebom,  K. S. Madsøll,  K. Riisager;  The reaction $^{11}\textrm{B}+p$ has been used to populate the $(J^\pi,T) = (2^+,1)$ state at an excitation energy of 16.11 MeV in $^{12}$C. $\gamma$-decay to unbound states in $^{12}$C are identified from analysis of the decay of the populated daughter states. Due to a new technique, $\gamma$-decay to the 10.8 MeV 1$^-$ state is observed for the first time, and transitions to the 9.64 MeV (3$^-$) and 12.71 MeV (1$^+$) are confirmed. Unresolved transitions to natural parity strength at 10 MeV and 11.5-13 MeV are also observed. For all transitions partial widths are deduced ;Nuclear Experiment (nucl-ex)
https://arxiv.org/abs/1610.00528;Activation cross sections of proton induced nuclear reactions on  palladium up to 80 MeV; F. Tárkányi,  F. Ditrói\,  S. Takács,  J. Csikai,  A. Hermanne,  S. Uddin,  M. Baba;  Activation cross sections of proton induced nuclear reactions on palladium were measured up to 80 MeV by using the stacked foil irradiation technique and gamma ray spectrometry. The beam intensity, the incident energy and the energy degradation were controlled by a method based on flux constancy via normalization to the excitation functions of monitor reactions measured in parallel. Excitation functions for direct and cumulative cross-sections were measured for the production of ${}^{104m,104g,105}$${}^{g,106m,110m}$Ag, ${}^{100,101}$Pd, ${}^{99m,99g,100,}$${}^{101m}$${}^{,101g,102m,102g,105}$Rh and ${}^{103,}$${}^{97}$Ru radioisotopes. The cross section data were compared with the theoretical predictions of TENDL-2014 and -2015 libraries. For practical applications thick target yields were derived from the measured excitation functions. Application in the field of medical radionuclide production is shortly discussed. ;"Nuclear Experiment (nucl-ex); Medical Physics (physics.med-ph)"
https://arxiv.org/abs/1610.00534;Spin dipole nuclear matrix elements for double beta decay nuclei by  charge-exchange reactions; H. Ejiri,  D. Frekers;  Spin dipole (SD) strengths for double beta-decay (DBD) nuclei were studied experimentally for the first time by using measured cross sections of (3He,t) charge exchange reactions (CERs). Then SD nuclear matrix elements (NMEs) for low-lying 2- states were derived from the experimental SD strengths by referring to the experimental GT (Gamow-Teller) and F (Fermi) strengths. They are consistent with the empirical SD NMEs based on the quasi-particle model with the empirical effective SD coupling constant. The CERs are used to evaluate the SD NME, which is associated with one of the major components of the neutrino-less DBD NME. ;"Nuclear Experiment (nucl-ex); Nuclear Theory (nucl-th)"
https://arxiv.org/abs/1610.00603;Measurement of Elastic pp Scattering at $\sqrt{s}$ = 8 TeV in the  Coulomb-Nuclear Interference Region - Determination of the $ρ$-Parameter  and the Total Cross-Section;" <!-- function toggleAuthorList(whichLayer,toggleThis) {   var elem, vis, tempToggle;   tempToggle=toggleThis;   if( document.getElementById ) // standard       elem = document.getElementById( whichLayer );   else if( document.all ) // old msie versions       elem = document.all[whichLayer];   else if( document.layers ) // nn4       elem = document.layers[whichLayer];   vis = elem.style;   // if the style.display value is blank we try to figure it out here   if(vis.display==''&&elem.offsetWidth!=undefined&&elem.offsetHeight!=undefined)     vis.display = (elem.offsetWidth!=0&&elem.offsetHeight!=0)?'inline':'none';   vis.display = (vis.display==''||vis.display=='inline')?'none':'inline';    // toggle link inner text   status = vis.display;   if(status=='none'){       document.getElementById('toggle').innerHTML = tempToggle + "")"";       document.getElementById('toggle').title = ""Show Entire Author List"";   }   else if(status=='inline'){       document.getElementById('toggle').innerHTML = ""(collapse list)"";       document.getElementById('toggle').title = ""Collapse Author List"";   } }  //-->  TOTEM Collaboration:  G. Antchev,  P. Aspell,  I. Atanassov,  V. Avati,  J. Baechler,  V. Berardi,  M. Berretti,  E. Bossini,  U. Bottigli,  M. Bozzo,  P. Broulím,  H. Burkhardt,  A. Buzzo,  F. S. Cafagna,  C. E. Campanella,  M. G. Catanesi,  M. Csanád,  T. Csörgő,  M. Deile,  F. De Leonardis,  A. D'Orazio,  M. Doubek,  K. Eggert,  V. Eremin,  F. Ferro,  A. Fiergolski,  F. Garcia,  V. Georgiev,  S. Giani,  L. Grzanka,  C. Guaragnella,  J. Hammerbauer,  J. Heino,  A. Karev,  J. Kašpar,  J. Kopal,  V. Kundrát,  S. Lami,  G. Latino,  R. Lauhakangas,  R. Linhart,  E. Lippmaa,  J. Lippmaa,  M. V. Lokajíček,  L. Losurdo,  M. Lo Vetere,  F. Lucas Rodríguez,  M. Macrí,  A. Mercadante,  N. Minafra,  S. Minutoli,  T. Naaranoja,  F. Nemes,  H. Niewiadomski,  E. Oliveri,  F. Oljemark,  R. Orava,  M. Oriunno,  K. Österberg,  P. Palazzi,  L. Paločko,  V. Passaro,  Z. Peroutka,  V. Petruzzelli,  T. Politi,  J. Procházka,  F. Prudenzano,  M. Quinto,  E. Radermacher,  E. Radicioni,  F. Ravotti,  S. Redaelli,  E. Robutti,  L. Ropelewski,  G. Ruggiero,  H. Saarikko,  B. Salvachua,  A. Scribano,  J. Smajek,  W. Snoeys,  J. Sziklai,  C. Taylor,  N. Turini,  V. Vacek,  G. Valentino,  J. Welti,  J. Wenninger,  P. Wyszkowski,  K. Zielinski  et al. (31 additional authors not shown) You must enabled JavaScript to view entire author list. ";  The TOTEM experiment at the CERN LHC has measured elastic proton-proton scattering at the centre-of-mass energy $\sqrt{s}$ = 8 TeV and four-momentum transfers squared, |t|, from 6 x $10^{-4}$ GeV$^2$ to 0.2 GeV$^2$. Near the lower end of the |t|-interval the differential cross-section is sensitive to the interference between the hadronic and the electromagnetic scattering amplitudes. This article presents the elastic cross-section measurement and the constraints it imposes on the functional forms of the modulus and phase of the hadronic elastic amplitude. The data exclude the traditional Simplified West and Yennie interference formula that requires a constant phase and a purely exponential modulus of the hadronic amplitude. For parametrisations of the hadronic modulus with second- or third-order polynomials in the exponent, the data are compatible with hadronic phase functions giving either central or peripheral behaviour in the impact parameter picture of elastic scattering. In both cases, the $\rho$-parameter is found to be 0.12 $\pm$ 0.03. The results for the total hadronic cross-section are $\sigma_{tot}$ = (102.9 $\pm$ 2.3) mb and (103.0 $\pm$ 2.3) mb for central and peripheral phase formulations, respectively. Both are consistent with previous TOTEM measurements. ;"Nuclear Experiment (nucl-ex); High Energy Physics - Experiment (hep-ex); High Energy Physics - Phenomenology (hep-ph)"
https://arxiv.org/abs/1610.00613;Suppression and azimuthal anisotropy of prompt and nonprompt J/psi  production in PbPb collisions at sqrt(s[NN]) = 2.76 TeV; CMS Collaboration;  The nuclear modification factor RAA and the azimuthal anisotropy coefficient v[2] of prompt and nonprompt (i.e. those from decays of b hadrons) J/psi mesons, measured from PbPb and pp collisions at sqrt(s[NN]) = 2.76 TeV at the LHC, are reported. The results are presented in several event centrality intervals and several kinematic regions, for transverse momenta pt > 6.5 GeV/c and rapidity abs(y) < 2.4, extending down to pt = 3 GeV/c in the 1.6 < abs(y) < 2.4 range. The v[2] of prompt J/psi is found to be nonzero, but with no strong dependence on centrality, rapidity, or pt over the full kinematic range studied. The measured v[2] of nonprompt J/psi is consistent with zero. The RAA of prompt J/psi exhibits a suppression that increases from peripheral to central collisions but does not vary as a function of either y or pt in the fiducial range. The nonprompt J/psi RAA shows a suppression which becomes stronger as rapidity or pt increase. The v[2] and nuclear suppression of open and hidden charm, and of open charm and beauty, are compared. ;"Nuclear Experiment (nucl-ex); High Energy Physics - Experiment (hep-ex)"
https://arxiv.org/abs/1610.00646;The first moment of azimuthal anisotropy in nuclear collisions from AGS  to LHC energies; Subhash Singha,  Prashanth Shanmuganathan,  Declan Keane;  We review topics related to the first moment of azimuthal anisotropy ($v_1$), commonly known as directed flow, focusing on both charged particles and identified particles from heavy-ion collisions. Beam energies from the highest available, at the CERN LHC, down to projectile kinetic energies per nucleon of a few GeV per nucleon, as studied in experiments at the Brookhaven AGS, fall within our scope. We focus on experimental measurements and on theoretical work where direct comparisons with experiment have been emphasized. The physics addressed or potentially addressed by this review topic includes the study of Quark Gluon Plasma, and more generally, investigation of the Quantum Chromodynamics phase diagram and the equation of state describing the accessible phases. ;"Nuclear Experiment (nucl-ex); High Energy Physics - Experiment (hep-ex); High Energy Physics - Phenomenology (hep-ph); Nuclear Theory (nucl-th)"
https://arxiv.org/abs/1610.00925;Direct measurement of low-energy $^{22}$Ne(p,$γ$)$^{23}$Na  resonances; R. Depalo,  F. Cavanna,  M. Aliotta,  M. Anders,  D. Bemmerer,  A. Best,  A. Boeltzig,  C. Broggini,  C.G. Bruno,  A. Caciolli,  G. F. Ciani,  P. Corvisiero,  T. Davinson,  A. Di Leva,  Z. Elekes,  F. Ferraro,  A. Formicola,  Zs. Fülöp,  G. Gervino,  A. Guglielmetti,  C. Gustavino,  Gy. Gyürky,  G. Imbriani,  M. Junker,  R. Menegazzo,  V. Mossa,  F. R. Pantaleo,  D. Piatti,  P. Prati,  O. Straniero,  T. Szücs,  M. P. Takács,  D. Trezzi;  The $^{22}$Ne(p,$\gamma$)$^{23}$Na reaction is the most uncertain process in the neon-sodium cycle of hydrogen burning. At temperatures relevant for nucleosynthesis in asymptotic giant branch stars and classical novae, its uncertainty is mainly due to a large number of predicted but hitherto unobserved resonances at low energy. Purpose: A new direct study of low energy $^{22}$Ne(p,$\gamma$)$^{23}$Na resonances has been performed at the Laboratory for Underground Nuclear Astrophysics (LUNA), in the Gran Sasso National Laboratory, Italy. Method: The proton capture on $^{22}$Ne was investigated in direct kinematics, delivering an intense proton beam to a $^{22}$Ne gas target. $\gamma$ rays were detected with two high-purity germanium detectors enclosed in a copper and lead shielding suppressing environmental radioactivity. Results: Three resonances at 156.2 keV ($\omega\gamma$ = (1.48\,$\pm$\,0.10)\,$\cdot$\,10$^{-7}$ eV), 189.5 keV ($\omega\gamma$ = (1.87\,$\pm$\,0.06)\,$\cdot$\,10$^{-6}$ eV) and 259.7 keV ($\omega\gamma$ = (6.89\,$\pm$\,0.16)\,$\cdot$\,10$^{-6}$ eV) proton beam energy, respectively, have been observed for the first time. For the levels at 8943.5, 8975.3, and 9042.4 keV excitation energy corresponding to the new resonances, the $\gamma$-decay branching ratios have been precisely measured. Three additional, tentative resonances at 71, 105 and 215 keV proton beam energy, respectively, were not observed here. For the strengths of these resonances, experimental upper limits have been derived that are significantly more stringent than the upper limits reported in the literature. Conclusions: Based on the present experimental data and also previous literature data, an updated thermonuclear reaction rate is provided in tabular and parametric form. The new reaction rate is significantly higher than previous evaluations at temperatures of 0.08-0.3 GK. ;"Nuclear Experiment (nucl-ex); Solar and Stellar Astrophysics (astro-ph.SR)"
