url;title;authors;abstract;subject
https://arxiv.org/abs/1509.08397;Centrality dependence of identified particle elliptic flow in  relativistic heavy ion collisions at sqrt(s)= 7.7--62.4 GeV;" <!-- function toggleAuthorList(whichLayer,toggleThis) {   var elem, vis, tempToggle;   tempToggle=toggleThis;   if( document.getElementById ) // standard       elem = document.getElementById( whichLayer );   else if( document.all ) // old msie versions       elem = document.all[whichLayer];   else if( document.layers ) // nn4       elem = document.layers[whichLayer];   vis = elem.style;   // if the style.display value is blank we try to figure it out here   if(vis.display==''&&elem.offsetWidth!=undefined&&elem.offsetHeight!=undefined)     vis.display = (elem.offsetWidth!=0&&elem.offsetHeight!=0)?'inline':'none';   vis.display = (vis.display==''||vis.display=='inline')?'none':'inline';    // toggle link inner text   status = vis.display;   if(status=='none'){       document.getElementById('toggle').innerHTML = tempToggle + "")"";       document.getElementById('toggle').title = ""Show Entire Author List"";   }   else if(status=='inline'){       document.getElementById('toggle').innerHTML = ""(collapse list)"";       document.getElementById('toggle').title = ""Collapse Author List"";   } }  //-->  STAR Collaboration:  L. Adamczyk,  J. K. Adkins,  G. Agakishiev,  M. M. Aggarwal,  Z. Ahammed,  I. Alekseev,  A. Aparin,  D. Arkhipkin,  E. C. Aschenauer,  G. S. Averichev,  X. Bai,  V. Bairathi,  A. Banerjee,  R. Bellwied,  A. Bhasin,  A. K. Bhati,  P. Bhattarai,  J. Bielcik,  J. Bielcikova,  L. C. Bland,  I. G. Bordyuzhin,  J. Bouchet,  D. Brandenburg,  A. V. Brandin,  I. Bunzarov,  J. Butterworth,  H. Caines,  M. Calderón de la Barca Sánchez,  J. M. Campbell,  D. Cebra,  M. C. Cervantes,  I. Chakaberia,  P. Chaloupka,  Z. Chang,  S. Chattopadhyay,  J. H. Chen,  X. Chen,  J. Cheng,  M. Cherney,  O. Chisman,  W. Christie,  G. Contin,  H. J. Crawford,  S. Das,  L. C. De Silva,  R. R. Debbe,  T. G. Dedovich,  J. Deng,  A. A. Derevschikov,  B. di Ruzza,  L. Didenko,  C. Dilks,  X. Dong,  J. L. Drachenberg,  J. E. Draper,  C. M. Du,  L. E. Dunkelberger,  J. C. Dunlop,  L. G. Efimov,  J. Engelage,  G. Eppley,  R. Esha,  O. Evdokimov,  O. Eyser,  R. Fatemi,  S. Fazio,  P. Federic,  J. Fedorisin,  Z. Feng,  P. Filip,  Y. Fisyak,  C. E. Flores,  L. Fulek,  C. A. Gagliardi,  D. Garand,  F. Geurts,  A. Gibson,  M. Girard,  L. Greiner,  D. Grosnick,  D. S. Gunarathne,  Y. Guo,  A. Gupta,  S. Gupta,  W. Guryn,  A. Hamad,  A. Hamed,  R. Haque,  J. W. Harris,  L. He,  S. Heppelmann,  S. Heppelmann,  A. Hirsch,  G. W. Hoffmann,  D. J. Hofman,  S. Horvat,  H. Z. Huang,  B. Huang,  X. Huang,  P. Huck,  T. J. Humanic,  G. Igo,  W. W. Jacobs,  H. Jang,  J. Jia,  K. Jiang,  E. G. Judd,  S. Kabana,  D. Kalinkin,  K. Kang,  K. Kauder,  H. W. Ke,  D. Keane,  A. Kechechyan,  Z. H. Khan,  D. P. Kikoła,  I. Kisel,  A. Kisiel,  L. Kochenda,  D. D. Koetke,  T. Kollegger,  L. K. Kosarzewski,  A. F. Kraishan,  P. Kravtsov,  K. Krueger,  I. Kulakov,  L. Kumar,  R. A. Kycia,  M. A. C. Lamont,  J. M. Landgraf,  K. D. Landry,  J. Lauret,  A. Lebedev,  R. Lednicky,  J. H. Lee,  X. Li,  X. Li,  W. Li,  C. Li,  Z. M. Li,  Y. Li,  M. A. Lisa,  F. Liu,  T. Ljubicic,  W. J. Llope,  M. Lomnitz,  R. S. Longacre,  X. Luo,  G. L. Ma,  R. Ma,  L. Ma,  Y. G. Ma,  N. Magdy,  R. Majka,  A. Manion,  S. Margetis,  C. Markert,  H. Masui,  H. S. Matis,  D. McDonald,  K. Meehan,  N. G. Minaev,  S. Mioduszewski,  D. Mishra,  B. Mohanty,  M. M. Mondal,  D. A. Morozov,  M. K. Mustafa,  B. K. Nandi,  Md. Nasim,  T. K. Nayak,  G. Nigmatkulov,  L. V. Nogach,  S. Y. Noh,  J. Novak,  S. B. Nurushev,  G. Odyniec,  A. Ogawa,  K. Oh,  V. Okorokov,  D. Olvitt Jr.,  B. S. Page,  R. Pak,  Y. X. Pan,  Y. Pandit,  Y. Panebratsev,  B. Pawlik,  H. Pei,  C. Perkins,  A. Peterson,  P. Pile,  M. Planinic,  J. Pluta,  N. Poljak,  K. Poniatowska,  J. Porter,  M. Posik,  A. M. Poskanzer,  N. K. Pruthi,  J. Putschke,  H. Qiu,  A. Quintero,  S. Ramachandran,  R. Raniwala,  S. Raniwala,  R. L. Ray,  H. G. Ritter,  J. B. Roberts,  O. V. Rogachevskiy,  J. L. Romero,  A. Roy,  L. Ruan,  J. Rusnak,  O. Rusnakova,  N. R. Sahoo,  P. K. Sahu,  S. Salur,  J. Sandweiss,  A. Sarkar,  J. Schambach,  R. P. Scharenberg,  A. M. Schmah,  W. B. Schmidke,  N. Schmitz,  J. Seger,  P. Seyboth,  N. Shah,  E. Shahaliev,  P. V. Shanmuganathan,  M. Shao,  B. Sharma,  M. K. Sharma,  W. Q. Shen,  S. S. Shi,  Q. Y. Shou,  E. P. Sichtermann,  R. Sikora,  M. Simko,  S. Singha,  M. J. Skoby,  N. Smirnov,  D. Smirnov,  L. Song,  P. Sorensen,  H. M. Spinka,  B. Srivastava,  T. D. S. Stanislaus,  M. Stepanov,  R. Stock,  M. Strikhanov,  B. Stringfellow,  M. Sumbera,  B. Summa,  X. Sun,  Z. Sun,  X. M. Sun,  Y. Sun,  B. Surrow,  N. Svirida,  M. A. Szelezniak,  Z. Tang,  A. H. Tang,  T. Tarnowsky,  A. Tawfik,  J. Thaeder,  J. H. Thomas,  A. R. Timmins,  D. Tlusty,  T. Todoroki,  M. Tokarev,  S. Trentalange,  R. E. Tribble,  P. Tribedy,  S. K. Tripathy,  B. A. Trzeciak,  O. D. Tsai,  T. Ullrich,  D. G. Underwood,  I. Upsal,  G. Van Buren,  G. van Nieuwenhuizen,  M. Vandenbroucke,  R. Varma,  A. N. Vasiliev,  R. Vertesi,  F. Videbæk,  Y. P. Viyogi,  S. Vokal,  S. A. Voloshin,  A. Vossen,  F. Wang,  J. S. Wang,  Y. Wang,  Y. Wang,  G. Wang,  H. Wang,  J. C. Webb,  G. Webb,  L. Wen,  G. D. Westfall,  H. Wieman,  S. W. Wissink,  R. Witt,  Y. Wu,  Y. F. Wu,  Z. G. Xiao,  W. Xie,  K. Xin,  N. Xu,  Q. H. Xu,  Z. Xu,  Y. F. Xu,  H. Xu,  C. Yang,  Y. Yang,  Y. Yang,  S. Yang,  Q. Yang,  Y. Yang,  Z. Ye,  Z. Ye,  P. Yepes,  L. Yi,  K. Yip,  I. -K. Yoo,  N. Yu,  H. Zbroszczyk,  W. Zha,  X. P. Zhang,  Z. Zhang,  S. Zhang,  J. Zhang,  Y. Zhang,  J. B. Zhang,  J. Zhang,  J. Zhao,  C. Zhong,  L. Zhou,  X. Zhu,  Y. Zoulkarneeva,  M. Zyzak  et al. (284 additional authors not shown) You must enabled JavaScript to view entire author list. ";  Elliptic flow (v_2) values for identified particles at midrapidity in Au + Au collisions measured by the STAR experiment in the Beam Energy Scan at the Relativistic Heavy Ion Collider at sqrt{s_{NN}}= 7.7--62.4 GeV are presented for three centrality classes. The centrality dependence and the data at sqrt{s_{NN}}= 14.5 GeV are new. Except at the lowest beam energies we observe a similar relative v_2 baryon-meson splitting for all centrality classes which is in agreement within 15% with the number-of-constituent quark scaling. The larger v_2 for most particles relative to antiparticles, already observed for minimum bias collisions, shows a clear centrality dependence, with the largest difference for the most central collisions. Also, the results are compared with A Multiphase Transport Model and fit with a Blast Wave model. ;Nuclear Experiment (nucl-ex)
https://arxiv.org/abs/1509.08523;Nucleon Resonance Transition Formfactors; I. G. Aznauryan,  V. D. Burkert,  V. I. Mokeev;  We discuss recent results from CLAS on electromagnetic resonance transition amplitudes and their dependence on the distance scale ($Q^2$). From the comparison of these results with most advanced theoretical calculations within QCD-based approaches there is clear evidence that meson-baryon contributions are present and important at large distances, i.e. small $Q^2$, and that quark core contributions dominate the short distance behavior. ;"Nuclear Experiment (nucl-ex); High Energy Physics - Lattice (hep-lat); High Energy Physics - Phenomenology (hep-ph); Nuclear Theory (nucl-th)"
https://arxiv.org/abs/1509.08579;A study of transverse momentum distributions of jets produced in p-p,  p-\bar p, d-Au, Au-Au, and Pb-Pb collisions at high energies; Hua-Rong Wei,  Fu-Hu Liu;  The transverse momentum distributions of jets produced in p-p, p-\bar p, d-Au, Au-Au, and Pb-Pb collisions at high energies with different selected conditions are analyzed by using a multi-source thermal model. The multi-component (mostly two-component) Erlang distribution used in our description is in good agreement with the experimental data measured by the STAR, D0, CDF II, ALICE, ATLAS, and CMS Collaborations. Related parameters are extracted from the transverse momentum distributions and some information on different interacting systems are obtained. In the two-component Erlang distribution, the first component has usually two or more sources which are contributed by strong scattering interactions between two quarks or more quarks and gluons, while the second component has mostly two sources which are contributed by harder head-on scattering between two quarks. ;"Nuclear Experiment (nucl-ex); High Energy Physics - Experiment (hep-ex); High Energy Physics - Phenomenology (hep-ph); Nuclear Theory (nucl-th)"
https://arxiv.org/abs/1509.08603;On pseudorapidity distribution and speed of sound in high energy heavy  ion collisions based on a new revised Landau hydrodynamic model; Li-Na Gao,  Fu-Hu Liu;"  We propose a new revised Landau hydrodynamic model to study systematically the pseudorapidity distributions of charged particles produced in heavy ion collisions over an energy range from a few GeV to a few TeV per nucleon pair. The interacting system is divided into three sources namely the central, target, and projectile sources respectively. The large central source is described by the Landau hydrodynamic model and further revised by the contributions of the small target/projectile sources. In the calculation, to avoid the errors caused by an unapt conversion or non-division, the rapidity and pseudorapidity distributions are obtained respectively. The modeling results are in agreement with the available experimental data at relativistic heavy ion collider (RHIC), large hadron collider (LHC), and other energies for different centralities. The value of square speed of sound parameter in different collisions has been extracted by us from the widths of rapidity distributions. Our results show that, in heavy ion collisions at RHIC and LHC energies, the central source undergoes through a phase transition from hadronic gas to quark-gluon plasma (QGP) liquid phase; meanwhile, the target/projectile sources remain in the state of hadronic gas. The present work confirms that the QGP is of liquid type rather than that of a gas. The whole region of participants undergoes through a mixed phase consisting of a large quantity of (>90%) QGP liquid and a small quantity of (<10%) hadronic gas. ";"Nuclear Experiment (nucl-ex); High Energy Physics - Experiment (hep-ex); High Energy Physics - Phenomenology (hep-ph); Nuclear Theory (nucl-th)"
https://arxiv.org/abs/1509.08734;Pseudorapidity and transverse-momentum distributions of charged  particles in proton-proton collisions at $\mathbf{\sqrt{\textit s}}$ = 13 TeV; ALICE Collaboration;  The pseudorapidity ($\eta$) and transverse-momentum ($p_{\rm T}$) distributions of charged particles produced in proton-proton collisions are measured at the centre-of-mass energy $\sqrt{s}$ = 13 TeV. The pseudorapidity distribution in $|\eta|<$ 1.8 is reported for inelastic events and for events with at least one charged particle in $|\eta|<$ 1. The pseudorapidity density of charged particles produced in the pseudorapidity region $|\eta|<$ 0.5 is 5.31 $\pm$ 0.18 and 6.46 $\pm$ 0.19 for the two event classes, respectively. The transverse-momentum distribution of charged particles is measured in the range 0.15 $<$ $p_{\rm T}$ $<$ 20 GeV/c and $|\eta|<$ 0.8 for events with at least one charged particle in $|\eta|<$ 1. The correlation between transverse momentum and particle multiplicity is also investigated by studying the evolution of the spectra with event multiplicity. The results are compared with calculations from PYTHIA and EPOS Monte Carlo generators. ;"Nuclear Experiment (nucl-ex); High Energy Physics - Experiment (hep-ex)"
https://arxiv.org/abs/1509.08802;Measurement of an excess in the yield of J/$ψ$ at very low $p_{\rm  T}$ in Pb-Pb collisions at $\sqrt{s_{\rm NN}}$ = 2.76 TeV; ALICE Collaboration;  We report on the first measurement of an excess in the yield of J/$\psi$ at very low transverse momentum ($p_{\rm T}< 0.3$ GeV/$c$) in peripheral hadronic Pb-Pb collisions at $\sqrt{s_{\rm NN}}$ = 2.76 TeV, performed by ALICE at the CERN LHC. Remarkably, the measured nuclear modification factor of J/$\psi$ in the rapidity range $2.5<y<4$ reaches about 7 (2) in the $p_{\rm T}$ range 0-0.3 GeV/$c$ in the 70-90% (50-70%) centrality class. The J/$\psi$ production cross section associated with the observed excess is obtained under the hypothesis that coherent photoproduction of J/$\psi$ is the underlying physics mechanism. If confirmed, the observation of J/$\psi$ coherent photoproduction in Pb-Pb collisions at impact parameters smaller than twice the nuclear radius opens new theoretical and experimental challenges and opportunities. In particular, coherent photoproduction accompanying hadronic collisions may provide insight into the dynamics of photoproduction and nuclear reactions, as well as become a novel probe of the Quark-Gluon Plasma. ;Nuclear Experiment (nucl-ex)
https://arxiv.org/abs/1509.08829;The $Q_{weak}$ Experiment: First Determination of the Weak Charge of the  Proton; Manolis Kargiantoulakis;  The $Q_{weak}$ Collaboration has completed a challenging measurement of the parity-violating asymmetry in elastic electron-proton ($\vec{e}$p) scattering at the Thomas Jefferson National Accelerator Facility (Jefferson Lab). The initial result reported here is extracted from the commissioning part of the experiment, constituting about 4% of the full data set. The parity-violating asymmetry at a low momentum transfer $Q^2$=0.025 GeV$^2$ is $A_{ep}$ = -279 $\pm$ 35 (stat) $\pm$ 31 (syst) ppb, which is the smallest and most precise asymmetry ever measured in $\vec{e}$p scattering. This result allowed the first determination of the weak charge of the proton $Q_W^p$ from a global fit of parity-violating elastic scattering (PVES) results from nuclear targets, where earlier data at higher $Q^2$ constrain uncertainties of hadronic structure. The value extracted from the global fit is $Q_W^p$ (PVES) = 0.064 $\pm$ 0.012, in agreement with the standard model prediction $Q_W^p$ (SM) = 0.0710 $\pm$ 0.0007. The neutral weak charges of up and down quarks are extracted from a combined fit of the PVES results with a previous atomic parity violation (APV) measurement on $^{133}$Cs. The analysis of the full $Q_{weak}$ data is ongoing and expected to yield a value for the asymmetry within 10 ppb of precision. Because of the suppression of $Q_W^p$, such a high precision measurement will place significant constraints to models of physics beyond the standard model. ;Nuclear Experiment (nucl-ex)
https://arxiv.org/abs/1509.08833;Di-Jet Imbalance Measurements in Central Au+Au Collisions at  $\sqrt{s_{NN}}=200$ GeV from STAR; Kolja Kauder for the STAR Collaboration;  The STAR collaboration reports the first measurements of the transverse momentum asymmetry $A_J$ of di-jet pairs in central gold-gold collisions and minimum bias proton-proton collisions at $\sqrt{s_{NN}}=200$ GeV at RHIC. We focus on anti-$k_T$ di-jets with a leading jet $p_T>20$ GeV/$c$ and a subleading jet $p_T>10$ GeV/$c$, with a constituent cut of 2 GeV/$c$, which reduces the effect of the underlying heavy-ion background. We examine the evolution of $A_J$ while reclustering these same di-jets with a lower constituent cut of 200 MeV/$c$. For the low $p_T$ constituent cut with a resolution parameter of $R=0.4$, the balance between the di-jets is restored to the level of p+p collisions which indicates the lost energy observed for di-jets with a constituent cut of $p_T ^{\text{Cut}}>2$ GeV/$c$ is recovered. Further variations of $R$ and the constituent \pT-cutoff indicate that the lost energy is redistributed in the form of soft particles, accompanied by a broadening of the jet structure. ;Nuclear Experiment (nucl-ex)
https://arxiv.org/abs/1509.09029;Measurement of transverse momentum relative to dijet systems in PbPb and  pp collisions at sqrt(s[NN]) = 2.76 TeV; CMS Collaboration;  An analysis of dijet events in PbPb and pp collisions is performed to explore the properties of energy loss by partons traveling in a quark-gluon plasma. Data are collected at a nucleon-nucleon center-of-mass energy of 2.76 TeV at the LHC. The distribution of transverse momentum (pT) surrounding dijet systems is measured by selecting charged particles in different ranges of pT and at different angular cones of pseudorapidity and azimuth. The measurement is performed as a function of centrality of the PbPb collisions, the pT asymmetry of the jets in the dijet pair, and the distance parameter R used in the anti-kt jet clustering algorithm. In events with unbalanced dijets, PbPb collisions show an enhanced multiplicity in the hemisphere of the subleading jet, with the pT imbalance compensated by an excess of low-pT particles at large angles from the jet axes. ;"Nuclear Experiment (nucl-ex); High Energy Physics - Experiment (hep-ex)"
https://arxiv.org/abs/1509.09083;Disentangling random thermal motion of particles and collective  expansion of source from transverse momentum spectra in high energy  collisions; Hua-Rong Wei,  Fu-Hu Liu,  Roy A. Lacey;"  In the framework of a multisource thermal model, we describe experimental results of the transverse momentum spectra of final-state light flavour particles produced in gold-gold (Au-Au), copper-copper (Cu-Cu), lead-lead (Pb-Pb), proton-lead ($p$-Pb), and proton-proton ($p$-$p$) collisions at various energies, measured by the PHENIX, STAR, ALICE, and CMS Collaborations, by using the Tsallis-standard (Tsallis form of Fermi-Dirac or Bose-Einstein), Tsallis, and two- or three-component standard distributions which can be in fact regarded as different types of ""thermometers"" or ""thermometric scales"" and ""speedometers"". A central parameter in the three distributions is the effective temperature which contains information on the kinetic freeze-out temperature of the emitting source and reflects the effects of random thermal motion of particles as well as collective expansion of the source. To disentangle both effects, we extract the kinetic freeze-out temperature from the intercept of the effective temperature ($T$) curve as a function of particle's rest mass ($m_0$) when plotting $T$ versus $m_0$, and the mean transverse flow velocity from the slope of the mean transverse momentum ($\langle p_T \rangle$) curve as a function of mean moving mass ($\overline{m}$) when plotting $\langle p_T \rangle$ versus $\overline{m}$. ";"Nuclear Experiment (nucl-ex); High Energy Physics - Experiment (hep-ex); High Energy Physics - Phenomenology (hep-ph); Nuclear Theory (nucl-th)"
https://arxiv.org/abs/1608.00040;Soft QGP probes with ALICE; Łukasz Kamil Graczykowski,  for the ALICE Collaboration;"  In heavy-ion collisions at the LHC a hot and dense medium of deconfided partons, the Quark-Gluon Plasma (QGP), is created. Its global properties can be characterized by the measurements of particles in the low transverse momentum (or ""soft"") regime, which represent the majority of created particles. In this report we outline a selection of measurements of the soft probes by the ALICE experiment in pp, p--Pb, and Pb--Pb collisions. The paper focuses on recent flow measurements via angular correlations and femtoscopic studies. The first ever preliminary analysis of $\mathrm{K}^0_{\rm S}\mathrm{K}^{\pm}$ femtoscopy is also presented. ";Nuclear Experiment (nucl-ex)
https://arxiv.org/abs/1608.00102;Determination of the neutron capture cross sections of 232Th at 14.1 MeV  and 14.8 MeV using the neutron activation method; Chang-Lin Lan,  Bao-Lin Xie,  Meng Peng,  Tao Lv,  Ze-en Yao,  Jin-Gen Chen,  Xiang-Zhong Kong;  The 232Th(n,{\gamma})233Th neutron capture reaction cross sections were measured at average neutron energies of 14.1 MeV and 14.8 MeV using the activation method. The neutron flux was determined using the monitor reaction 27Al(n,{\alpha})24Na. The induced gamma-ray activities were measured using a low background gamma ray spectrometer equipped with a high resolution HPGe detector. The experimentally determined cross sections were compared with the literatures data, evaluated data of ENDF/B-VII, JENDL-4.0, and CENDL-3.1. The Excitation functions of 232Th(n,{\gamma}) reaction were also calculated theoretically using the TALYS 1.6 computer code. ;Nuclear Experiment (nucl-ex)
https://arxiv.org/abs/1608.00487;Analysis of Neutron Stars Observations Using a Correlated Fermi Gas  Model; O. Hen,  A.W. Steiner,  E. Piasetzky,  L.B. Weinstein;  Background: The nuclear symmetry energy is a fundamental ingredient in determining the equation of state (EOS) of neutron stars (NS). Recent terrestrial experiments constrain both its value and slope at nuclear saturation density, however, its value at higher densities is unknown. Assuming a Free Fermi-gas (FFG) model for the kinetic symmetry energy, the high-density extrapolation depends on a single parameter, the density dependence of the potential symmetry energy. The Correlated Fermi-gas (CFG) model improves on the FFG model by including the effects of short-range, correlated, high-momentum, nucleons in nuclear matter. Using the CFG model for the kinetic symmetry energy along with constraints from terrestrial measurements leads to a much softer density dependence for the potential symmetry energy. Purpose: Examine the ability of the FFG and CFG models to describe NS observables that are directly sensitive to the symmetry energy at high-density. Specifically, examine the ability of the CFG model, with its softer density dependence of the potential symmetry energy, to describe a two solar-mass NS. Methods: Using a Bayesian analysis of NS observables we compare the CFG and FFG models and examine the resulting parameters in the NS EOS and the density dependence of the potential symmetry energy. Results: Despite the large difference in the density dependence of the potential part of the symmetry energy, both models can describe the NS data and support a two solar-mass NS. The different density dependences has only a small effect on the NS EOS. Conclusions: While sensitive to the high-density values of the symmetry energy, NS observables alone are not enough to distinguish between the CFG and FFG models. This indicates that the NS EOS, obtain from Bayesian analysis of NS observables, is robust and is not sensitive to the exact nuclear model used for the kinetic symmetry energy. ;"Nuclear Experiment (nucl-ex); High Energy Astrophysical Phenomena (astro-ph.HE); Solar and Stellar Astrophysics (astro-ph.SR); Nuclear Theory (nucl-th)"
https://arxiv.org/abs/1608.01428;Effects of Longitudinal Asymmetry in Heavy-Ion Collisions; Rashmi Raniwala (University of Rajasthan),  Sudhir Raniwala (University of Rajasthan),  Constantin Loizides (LBNL);  In collisions of identical nuclei at a given impact parameter, the number of nucleons participating in the overlap region of each nucleus can be unequal due to nuclear density fluctuations. The asymmetry due to the unequal number of participating nucleons, referred to as longitudinal asymmetry, causes a shift in the center of mass rapidity of the participant zone. The information of the event asymmetry allows us to isolate and study the effect of longitudinal asymmetry on rapidity distrbution of final state particles. In a Monte Carlo Glauber model the average rapidity-shift is found to be almost linearly related to the asymmetry. Using toy models, as well as Monte Carlo data for Pb-Pb collisions at 2.76 TeV generated with HIJING, two different versions of AMPT and DPMJET models, we demonstrate that the effect of asymmetry on final state rapidity distribution can be quantitatively related to the average rapidity shift via a third-order polynomial with a dominantly linear term. The coefficients of the polynomial are proportional to the rapidity shift with the dependence being sensitive to the details of the rapidity distribution. Experimental estimates of the spectator asymmetry through the measurement of spectator nucleons in a Zero Degree Calorimeter may hence be used to further constrain the initial conditions in ultra-relativistic heavy-ion collisions. ;"Nuclear Experiment (nucl-ex); Nuclear Theory (nucl-th)"
https://arxiv.org/abs/1608.01530;Study of the pd(dp) -> 3He pi pi reactions close to threshold; F. Bellemann,  A. Berg,  J. Bisplinghoff,  G. Bohlscheid,  J. Ernst,  C. Henrich,  F. Hinterberger,  R. Ibald,  R. Jahn,  R. Joosten,  K. Kilian,  A. Kozela,  H. Machner,  A. Magiera,  J. Munkel,  P. von Neumann-Cosel,  P. von Rossen,  H. Schnitker,  K. Scho,  J. Smyrski,  R. Toelle,  C. Wilkin;  New experimental data on the pd -> 3He pi+ pi- reaction obtained with the COSY-MOMO detector below the three-pion threshold are presented. The reaction was also studied in inverse kinematics with a deuteron beam and the higher counting rates achieved were especially important at low excess energies. The comparison of these data with inclusive pd -> 3He+X rates allowed estimates also to be made of pi0 pi0 production. The results confirm our earlier findings that close to threshold there is no enhancement at low excitation energies in the pi+ pi- system, where the data seem largely suppressed compared to phase space. Possible explanations for this behavior, such as strong p- waves in the pi+pi- -system or the influence of two-step processes, are explored. ;"Nuclear Experiment (nucl-ex); Nuclear Theory (nucl-th)"
