url;title;authors;abstract;subject
https://arxiv.org/abs/1605.07786;A proposed direct measurement of cross section at Gamow window for key  reaction $^{19}$F($p$,$α$)$^{16}$O in Asymptotic Giant Branch stars with  a planned accelerator in CJPL; J.J. He,  S.W. Xu,  S.B. Ma,  J. Hu,  L.Y. Zhang,  C.B. Fu,  N.T. Zhang,  G. Lian,  J. Su,  Y.J. Li,  S.Q. Yan,  Y.P. Shen,  S.Q. Hou,  B.L. Jia,  T. Zhang,  X.P. Zhang,  B. Guo,  S. Kubono,  W.P. Liu;  In 2014, the National Natural Science Foundation of China (NSFC) approved the Jinping Underground Nuclear Astrophysics laboratory (JUNA) project, which aims at direct cross-section measurements of four key stellar nuclear reactions right down to the Gamow windows. In order to solve the observed fluorine overabundances in Asymptotic Giant Branch (AGB) stars, measuring the key $^{19}$F($p$,$\alpha$)$^{16}$O reaction at effective burning energies (i.e., at Gamow window) is established as one of the scientific research sub-projects. The present paper describes this sub-project in details, including motivation, status, experimental setup, yield and background estimation, aboveground test, as well as other relevant reactions. ;Nuclear Experiment (nucl-ex)
https://arxiv.org/abs/1605.07810;Recent results in nuclear astrophysics; Alain Coc,  Fairouz Hammache,  Juergen Kiener;  In this review, we emphasize the interplay between astrophysical observations, modeling, and nuclear physics laboratory experiments. Several important nuclear cross sections for astrophysics have long been identified e.g. 12C(alpha,gamma)16O for stellar evolution, or 13C(alpha,n)16O and 22Ne(alpha,n)25Mg as neutron sources for the s-process. More recently, observations of lithium abundances in the oldest stars, or of nuclear gamma-ray lines from space, have required new laboratory experiments. New evaluation of thermonuclear reaction rates now includes the associated rate uncertainties that are used in astrophysical models to i) estimate final uncertainties on nucleosynthesis yields and ii) identify those reactions that require further experimental investigation. Sometimes direct cross section measurements are possible, but more generally the use of indirect methods is compulsory in view of the very low cross sections. Non-thermal processes are often overlooked but are also important for nuclear astrophysics, e.g. in gamma-ray emission from solar flares or in the interaction of cosmic rays with matter, and also motivate laboratory experiments. Finally, we show that beyond the historical motivations of nuclear astrophysics, understanding i) the energy sources that drive stellar evolution and ii) the origin of the elements can also be used to give new insights into physics beyond the standard model. ;"Nuclear Experiment (nucl-ex); High Energy Astrophysical Phenomena (astro-ph.HE)"
https://arxiv.org/abs/1605.07885;Radii and binding energies in oxygen isotopes: a puzzle for nuclear  forces; V. Lapoux,  V. Somà,  C. Barbieri,  H. Hergert,  J.D. Holt,  S.R. Stroberg;  We present a systematic study of both nuclear radii and binding energies in (even) oxygen isotopes from the valley of stability to the neutron drip line. Both charge and matter radii are compared to state-of-the-art {\it ab initio} calculations along with binding energy systematics. Experimental matter radii are obtained through a complete evaluation of the available elastic proton scattering data of oxygen isotopes. We show that, in spite of a good reproduction of binding energies, {\it ab initio} calculations with conventional nuclear interactions derived within chiral effective field theory fail to provide a realistic description of charge and matter radii. A novel version of two- and three-nucleon forces leads to considerable improvement of the simultaneous description of the three observables for stable isotopes, but shows deficiencies for the most neutron-rich systems. Thus, crucial challenges related to the development of nuclear interactions remain. ;"Nuclear Experiment (nucl-ex); Nuclear Theory (nucl-th)"
https://arxiv.org/abs/1605.08349;Enhancement of fusion at near and sub-barrier energies for neutron-rich  light nuclei; Varinderjit Singh,  J. Vadas,  T.K. Steinbach,  B.B. Wiggins,  S. Hudan,  R.T. deSouza Zidu Lin,  C.J. Horowitz,  L.T. Baby,  S.A. Kuvin,  Vandana Tripathi,  I. Wiedenhover;  Measurement of the fusion cross-section for neutron-rich light nuclei is crucial in ascertaining if fusion of these nuclei occurs in the outer crust of a neutron star. We have therefore measured the fusion excitation function at near-barrier energies for the 19O + 12C system and compared the experimental results with the fusion excitation function of 18O + 12C and 16O + 12C. In the experiment a beam of 19O, produced via the 18O(d,p) reaction, was incident on a 12C target at energies near the Coulomb barrier. Evaporation residues produced in fusion of 18,19O ions with 12C target nuclei were detected with good geometric efficiency and identified by measuring their energy and time-of-flight. A significant enhancement in the fusion probability of 19O ions with a 12C target as compared to 18O ions is observed. The significantly larger cross-sections observed at near barrier energies are not predicted by a static model of fusion for 19O + 12C indicating that dynamics play an important role in the fusion of neutron-rich light nuclei. ;Nuclear Experiment (nucl-ex)
https://arxiv.org/abs/1605.08769;Observation of the 2$^+$ isomer in $^{52}$Co; S.E.A. Orrigo,  B. Rubio,  W. Gelletly,  B. Blank,  Y. Fujita,  J. Giovinazzo,  J. Agramunt,  A. Algora,  P. Ascher,  B. Bilgier,  L. Cáceres,  R.B. Cakirli,  G. de France,  E. Ganioğlu,  M. Gerbaux,  S. Grévy,  O. Kamalou,  H.C. Kozer,  L. Kucuk,  T. Kurtukian-Nieto,  F. Molina,  L. Popescu,  A.M. Rogers,  G. Susoy,  C. Stodel,  T. Suzuki,  A. Tamii,  J.C. Thomas;  We report the first observation of the 2$^+$ isomer in $^{52}$Co, produced in the $\beta$ decay of the 0$^+$, $^{52}$Ni ground state. We have observed three $\gamma$-rays at 849, 1910, and 5185 keV characterizing the $\beta$ de-excitation of the isomer. We have measured a half-life of 102(6) ms for the isomeric state. The Fermi and Gamow-Teller transition strengths for the $\beta$ decay of $^{52m}$Co to $^{52}$Fe have been determined. We also add new information on the $\beta$ decay of the 6$^+$, $^{52}$Co ground state, for which we have measured a half-life of 112(3) ms. ;Nuclear Experiment (nucl-ex)
https://arxiv.org/abs/1605.09565;Low-energy Antikaon Interaction with Nuclei: The AMADEUS Challenge; Johann Marton,  Massimilliano Bazzi,  Giovanni Bellotti,  Carolina Berucci,  Dimitri Bosnar,  Mario Bragadireanu,  Catalina Curceanu,  Alberto Clozza,  Michael Cargnelli,  Aslan Butt,  Raffaele Del Grande,  Laura Fabbietti,  Carlo Fiorini,  Francesco Ghio,  Carlo Guaraldo,  Mihai Iliescu,  Paolo Levi Sandri,  Dorel Pietreanu,  Kristian Piscicchia,  Antonio Romero Vidal,  Alessandro Scordo,  Hexi Shi,  Diana Sirghi,  Florin Sirghi,  Ivana Tucakovic,  Oton Vazquez Doce,  Eberhard Widmann,  Johann Zmeskal;  The low-energy strong interaction of antikaons (K-) with nuclei has many facets and rep- resents a lively and challenging research field. It is interconnected to the peculiar role of strangeness, since the strange quark is rather light, but still much heavier than the up and down quarks. Thus, when strangeness is involved one has to deal with spontaneous and explicit symmetry breaking in QCD. It is well known that the antikaon interaction with nucleons is attractive, but how strong ? Is the interaction strong enough to bind nucleons to form kaonic nuclei and, if so, what are the properties (binding energy, decay width)? There are controversial indications for such bound states and new results are expected to come soon. The existence of antikaon mediated bound states might have important consequences since it would open the possibility for the formation of cold baryonic matter of high density which might have a severe impact in astrophysics for the understanding of the composi- tion of compact (neutron) stars. New experimental opportunities could be provided by the AMADEUS experiment at the DA?NE electron-positron collider at LNF-INFN (Frascati, Italy). Pre-AMADEUS studies on the antikaon interaction with nuclei are carried out by analysis of data collected by KLOE in till 2005 and in special data runs using a carbon target insert. Studies for the dedicated AMADEUS detector setup taking advantage of the low-energy antikaons from Phi-meson decay delivered by DAFNE are in progress. Some re- sults obtained so far and the perspectives of the AMADEUS experiment are presented and discussed. ;Nuclear Experiment (nucl-ex)
https://arxiv.org/abs/1605.09690;Total kinetic energy release in the fast neutron-induced fission of  $^{235}$U; R. Yanez,  W. Loveland,  J. King,  J.S. Barrett,  N. Fotiades,  H.Y. Lee;  We have measured the total kinetic energy (TKE) release for the $^{235}$U(n,f) reaction for $E_{n}$=2-100 MeV using the 2E method with an array of Si PIN diode detectors. The neutron energies were determined by time of flight measurements using the white spectrum neutron beam at the LANSCE facility. To benchmark the TKE measurement, the TKE release for $^{235}$U(n$_{th}$,f) was also measured using a thermal neutron beam from the Oregon State University TRIGA reactor, giving pre-neutron emission $E^*_{TKE}=170.7\pm0.4$ MeV in good agreement with known values. Our measurements are thus absolute measurements. The TKE in $^{235}$U(n,f) decreases non-linearly from 169 MeV to 161 MeV for $E_{n}$=2-100 MeV. The multi-modal fission analysis of mass distributions and TKE indicates the origin of the TKE decrease with increasing neutron energy is a consequence of the fade out of asymmetric fission, which is associated with a higher TKE compared to symmetric fission. The average TKE associated with the superlong, standard I and standard II modes for a given mass is independent of neutron energy. The widths of the TKE distributions are constant from $E_{n}$=20-100 MeV and hence show no dependence with excitation energy. ;Nuclear Experiment (nucl-ex)
https://arxiv.org/abs/1503.00495;KADoNiS-$p$: The astrophysical $p$-process database; T. Szücs,  I. Dillmann,  R. Plag,  Zs. Fülöp;  The KADoNiS-$p$ project is an online database for cross sections relevant to the $p$-process. All existing experimental data was collected and reviewed. With this contribution a user-friendly database using the KADoNiS (Karlsruhe Astrophysical Database of Nucleosynthesis in Stars) framework is launched, including all available experimental data from (p,$\gamma$), (p,n), (p,$\alpha$), ($\alpha$,$\gamma$), ($\alpha$,n) and ($\alpha$,p) reactions in or close to the respective Gamow window with cut-off date of August 2012 (www.kadonis.org/pprocess). ;Nuclear Experiment (nucl-ex)
https://arxiv.org/abs/1503.00514;Analysing powers and spin correlations in deuteron-proton charge  exchange at 726 MeV; S. Dymov,  T. Azaryan,  Z. Bagdasarian,  S. Barsov,  J. Carbonell,  D. Chiladze,  R. Engels,  R. Gebel,  K. Grigoryev,  M. Hartmann,  A. Kacharava,  A. Khoukaz,  V. Komarov,  P. Kulessa,  A. Kulikov,  V. Kurbatov,  N. Lomidze,  B. Lorentz,  G. Macharashvili,  D. Mchedlishvili,  S. Merzliakov,  M. Mielke,  M. Mikirtychyants,  S. Mikirtychyants,  M. Nioradze,  H. Ohm,  D. Prasuhn,  F. Rathmann,  V. Serdyuk,  H. Seyfarth,  V. Shmakova,  H. Ströher,  M. Tabidze,  S. Trusov,  D. Tsirkov,  Yu. Uzikov,  Yu. Valdau,  C. Weidemann,  C. Wilkin;  The charge exchange of vector polarised deuterons on a polarised hydrogen target has been studied in a high statistics experiment at the COSY-ANKE facility at a deuteron beam energy of Td = 726 MeV. By selecting two fast protons at low relative energy E_{pp}, the measured analysing powers and spin correlations are sensitive to interference terms between specific neutron-proton charge-exchange amplitudes at a neutron kinetic energy of Tn ~ 1/2 Td =363 MeV. An impulse approximation calculation, which takes into account corrections due to the angular distribution in the diproton, describes reasonably the dependence of the data on both E_{pp} and the momentum transfer. This lends broad support to the current neutron-proton partial-wave solution that was used in the estimation. ;"Nuclear Experiment (nucl-ex); Nuclear Theory (nucl-th)"
https://arxiv.org/abs/1503.00616;Strange Baryonic Resonances and Resonances Coupling to Strange Hadrons  at SIS Energies; L. Fabbietti;  The role played by baryonic resonances in the production of final states containing strangeness for proton-proton reactions at 3.5 GeV measured by HADES is discussed by means of several very different measurements. First the associate production of $\Delta$ resonances accompanying final states with strange hadrons is presented, then the role of interferences among N$^*$ resonances, as measured by HADES for the first time, is summarised. Last but not least the role played by heavy resonances, with a mass larger than $2$ GeV/c$^2$ in the production of strange and non-strange hadrons is discussed. Experimental evidence for the presence of a $\Delta(2000)^{++}$ are presented and hypotheses are discussed employing the contribution of similar objects to populate the excesses measured by HADES for the $\Xi$ in A+A and p+A collisions and in the dilepton sector for A+A collisions. This extensive set of results helps to better understand the dynamic underlaying particle production in elementary reactions and sets a more solid basis for the understanding of heavy ion collisions at the same energies and even higher as planned at the FAIR facility. ;Nuclear Experiment (nucl-ex)
https://arxiv.org/abs/1503.00619;$Λ(1405)$ observations in p+p and K$^-$-induced reactions; L. Fabbietti,  K. Pischicchia,  A. Scordo;  The $\Lambda(1405)$ production in p+p collisions at 3.5 GeV and K$^-$-induced reactions is discussed. The shift of the measured spectral function of the $\Lambda(1405)$ in p+p reactions does not match either theoretical calculations for p+p reactions or experimental observation in previous K$^-$-induced reactions. New experiments with stopped and in-flight $K^-$ are needed to study this initial state more in detail. The state of the art of the analysis is discussed. ;Nuclear Experiment (nucl-ex)
https://arxiv.org/abs/1503.00681;Measurement of charged jet production cross sections and nuclear  modification in p-Pb collisions at $\sqrt{s_\rm{NN}} = 5.02$ TeV; ALICE Collaboration;  Charged jet production cross sections in p-Pb collisions at $\sqrt{s_{\rm NN}} = 5.02$ TeV measured with the ALICE detector at the LHC are presented. Using the anti-$k_{\rm T}$ algorithm, jets have been reconstructed in the central rapidity region from charged particles with resolution parameters $R = 0.2$ and $R = 0.4$. The reconstructed jets have been corrected for detector effects and the underlying event background. To calculate the nuclear modification factor, $R_{\rm pPb}$, of charged jets in p-Pb collisions, a pp reference was constructed by scaling previously measured charged jet spectra at $\sqrt{s} = 7$ TeV. In the transverse momentum range $20 \le p_{\rm T,ch\ jet} \le 120$ GeV/$c$, $R_{\rm pPb}$ is found to be consistent with unity, indicating the absence of strong nuclear matter effects on jet production. Major modifications to the radial jet structure are probed via the ratio of jet production cross sections reconstructed with the two different resolution parameters. This ratio is found to be similar to the measurement in pp collisions at $\sqrt{s} = 7$ TeV and to the expectations from PYTHIA pp simulations and NLO pQCD calculations at $\sqrt{s_{\rm NN}} = 5.02$ TeV. ;"Nuclear Experiment (nucl-ex); High Energy Physics - Experiment (hep-ex)"
https://arxiv.org/abs/1503.00919;New developments in the experimental data for charged particle  production of medical radioisotopes; F. Ditrói,  F. Tárkányi,  S. Takács,  A. Hermanne;  The goal of the present work is to give a review of developments achieved experimentally in the field of nuclear data for medically important radioisotopes in the last three years. The availability and precision of production related nuclear data is continuously improved mainly experimentally. This review emphasizes a couple of larger fields: the Mo/Tc generator problem and the generator isotopes in general, heavy alpha-emitters and the rare-earth elements. Other results in the field of medical radioisotope production are also listed. ;Nuclear Experiment (nucl-ex)
https://arxiv.org/abs/1503.01367;Precise measurement of branching ratios in the beta decay of 38Ca; H. I. Park,  J. C. Hardy,  V. E. Iacob,  M. Bencomo,  L. Chen,  V. Horvat,  N. Nica,  B. T. Roeder,  E. McCleskey,  R. E. Tribble,  I. S. Towner;  We present the full description of a measurement of the branching ratios for the beta-decay of 38Ca. This decay includes five allowed 0+ --> 1+ branches and a superallowed 0+ --> 0+ one. With our new result for the latter, we determine its ft value to be 3062.3(68) s, a result whose precision (0.2%) is comparable to the precision of the thirteen well known 0+ --> 0+ transitions used up till now for the determination of Vud, the up-down quark-mixing element of the CKM matrix. The 38Ca superallowed transition thus becomes the first addition to this set of transitions in nearly a decade and the first for which a precise mirror comparison is possible, thus enabling an improved test of the isospin-symmetry-breaking corrections required for the extraction of Vud. ;"Nuclear Experiment (nucl-ex); High Energy Physics - Phenomenology (hep-ph); Nuclear Theory (nucl-th)"
https://arxiv.org/abs/1503.01452;The Structure of the Nucleon: Elastic Electromagnetic Form Factors; V. Punjabi,  C.F. Perdrisat,  M.K. Jones,  E.J. Brash,  C.E. Carlson;  Precise proton and neutron form factor measurements at Jefferson Lab, using spin observables, have recently made a significant contribution to the unraveling of the internal structure of the nucleon. Accurate experimental measurements of the nucleon form factors are a test-bed for understanding how the nucleon's static properties and dynamical behavior emerge from QCD, the theory of the strong interactions between quarks. There has been enormous theoretical progress, since the publication of the Jefferson Lab proton form factor ratio data, aiming at reevaluating the picture of the nucleon. We will review the experimental and theoretical developments in this field and discuss the outlook for the future. ;"Nuclear Experiment (nucl-ex); Nuclear Theory (nucl-th)"
https://arxiv.org/abs/1503.01619;Transverse momentum and multiplicity fluctuations in the Be+Be energy  scan from NA61/SHINE; Tobiasz Czopowicz,  for the NA61/SHINE Collaboration;  The NA61/SHINE experiment aims to discover the Critical Point of strongly interacting matter and study the properties of the onset of deconfinement. These goals are to be achieved by per- forming a two-dimensional phase diagram ($T-\mu_{B}$) scan by measurements of hadron production properties in proton-proton, proton-nucleus and nucleus-nucleus interactions as a function of col- lision energy and system size. Close to the Critical Point an increase of fluctuations is predicted. This contribution presents preliminary results on transverse momentum and multiplicity fluctua- tions expressed in terms of strongly intensive quantities from the Be+Be energy scan. The data are fully corrected for contributions from non-target interactions. The Be+Be results are compared with NA61/SHINE measurements from the p+p energy scan, with NA49 results from central Pb+Pb collisions as well as with model predictions. ;Nuclear Experiment (nucl-ex)
https://arxiv.org/abs/1503.01692;Evidence for transverse momentum and pseudorapidity dependent event  plane fluctuations in PbPb and pPb collisions; CMS Collaboration;  A systematic study of the factorization of long-range azimuthal two-particle correlations into a product of single-particle anisotropies is presented as a function of pt and eta of both particles, and as a function of the particle multiplicity in PbPb and pPb collisions. The data were taken with the CMS detector for PbPb collisions at sqrt(s[NN]) = 2.76 TeV and pPb collisions at sqrt(s[NN]) = 5.02 TeV, covering a very wide range of multiplicity. Factorization is observed to be broken as a function of both particle pt and eta. When measured with particles of different pt, the magnitude of the factorization breakdown for the second Fourier harmonic reaches 20% for very central PbPb collisions but decreases rapidly as the multiplicity decreases. The data are consistent with viscous hydrodynamic predictions, which suggest that the effect of factorization breaking is mainly sensitive to the initial-state conditions rather than to the transport properties (e.g., shear viscosity) of the medium. The factorization breakdown is also computed with particles of different eta. The effect is found to be weakest for mid-central PbPb events but becomes larger for more central or peripheral PbPb collisions, and also for very high-multiplicity pPb collisions. The eta-dependent factorization data provide new insights to the longitudinal evolution of the medium formed in heavy ion collisions. ;"Nuclear Experiment (nucl-ex); High Energy Physics - Experiment (hep-ex)"
https://arxiv.org/abs/1607.00157;Cluster Decay of the High-lying excited states in $^{14}$C; Z.Y. Tian,  Y.L. Ye,  Z.H. Li,  C.J. Lin,  Q.T. Li,  Y.C. Ge,  J.L. Lou,  W. Jiang,  J. Li,  Z.H. Yang,  J. Feng,  P.J. Li,  J. Chen,  Q. Liu,  H.L. Zang,  B. Yang,  Y. Zhang,  Z.Q. Chen,  Y. Liu,  X.H. Sun,  J. Ma,  H.M. Jia,  X.X. Xu,  L. Yang,  N.R. Ma,  L.J. Sun;  A cluster-transfer experiment of $^9\rm{Be}(^9\rm{Be},^{14}\rm{C}\rightarrow\alpha+^{10}\rm{Be})\alpha$ at an incident energy of 45 MeV was carried out in order to investigate the molecular structure in high-lying resonant states in $^{14}$C. This reaction is of extremely large $Q$-value, making it an excellent case to select the reaction mechanism and the final states in outgoing nuclei. The high-lying resonances in $^{14}$C are reconstructed for three sets of well discriminated final states in $^{10}$Be. The results confirm the previous decay measurements with clearly improved decay-channel selections and show also a new state at 23.5(1) MeV. The resonant states at 22.4(3) and 24.0(3) MeV decay primarily into the typical molecular states at about 6 MeV in $^{10}$Be, indicating a well developed cluster structure in these high-lying states in $^{14}$C. Further measurements of more states of this kind are suggested. ;Nuclear Experiment (nucl-ex)
https://arxiv.org/abs/1607.00352;Minimizing statistical and systematic bias in transverse momentum  correlations for relativistic heavy-ion collisions; Robert L. Ray,  Prabhat Bhattarai;  Two-particle correlation measurements and analysis are an important component of the relativistic heavy-ion physics program. In particular, particle pair-number correlations on two-dimensional transverse momentum ($p_t$) allow unique access to soft, semi-hard and hard-scattering processes in these collisions. Precise measurements of this type of correlation are essential for understanding the dynamics in heavy-ion collisions. However, transverse momentum correlation measurements are especially vulnerable to statistical and systematic biases. In this paper the origins of these large bias effects are explained and mathematical correlation forms are derived from mean-$p_t$ fluctuation quantities in the literature. Monte Carlo simulations are then used to determine the conditions, e.g. multiplicity and collision centrality bin widths, where each correlation form is minimally biased. The ranges of applicability for each correlation quantity are compared. Several are found to reproduce the assumed input correlations with reasonable fidelity over a wide range of conditions encountered in practical analysis of data. ;Nuclear Experiment (nucl-ex)
