url;title;authors;abstract;subject
https://arxiv.org/abs/1402.0256;Using quantum routers to implement quantum message authentication and  Bell-state manipulation; Karol Bartkiewicz,  Antonín Černoch,  Karel Lemr;  In this paper we investigate the capability of quantum routing (quantum state fusion) to implement two useful quantum communications protocols. The analyzed protocols include quantum authentication of quantum messages and non-destructive linear-optical Bell state manipulation. We also present the concept of quantum decoupler -- a device implementing an inverse operation to quantum routing. We demonstrate that both quantum router and decoupler can work as specialized disentangling gates. ;Quantum Physics (quant-ph)
https://arxiv.org/abs/1402.0274;What bipartite states are lazy; Jianwei Xu;  A bipartite state is called lazy if the entropy rate of one subsystem is vanishing for any coupling to the other subsystem. In this paper, we provide a necessary and sufficient condition for a finite-dimensional bipartite state to be lazy, and prove that a two-mode Gaussian state is lazy if and only if it is a direct product state. ;Quantum Physics (quant-ph)
https://arxiv.org/abs/1402.0301;Preservation of the geometric quantum discord in noisy environments; Ming-Liang Hu,  Dong-Ping Tian;  Geometric description of quantum correlations are favored for their distinct physical significance. Geometric discord based on the trace distance and the Bures distance are shown to be well-defined quantum correlation measures. Here, we examine their particular dynamical behaviors under independent as well as common structured reservoirs, and reveal their robustness against decoherence. We showed that the two well-defined geometric discord may be preserved well, or even be improved and generated by the noisy process of the common reservoir. Moreover, we also provided a strategy for long-time preservation of these two geometric discord in independent reservoirs. ;Quantum Physics (quant-ph)
https://arxiv.org/abs/1402.0307;Self-induced Spatial Dynamics to Enhance Spin-Squeezing via One-Axis  Twisting in a Two-Component Bose-Einstein Condensate; S. A. Haine,  J. Lau,  R. P. Anderson,  M. T. Johnsson;  We theoretically investigate a scheme to enhance spin squeezing in a two-component Bose-Einstein condensate (BEC) by utilizing the inherent mean-field dynamics of the condensate. Due to the asymmetry in the scattering lengths, the two components exhibit density oscillations where they spatially separate and recombine. The effective non-linearity responsible for spin squeezing is increased by up to three orders of magnitude when the two components spatially separate \cite{treutlein2010}. We perform a multi-mode simulation of the system using the truncated Wigner method, and show that this method can be used to create significant spin squeezing in systems where the effective nonlinearity would ordinarily be too small, and that strong spatial dynamics resulting from large particle numbers aren't necessarily detrimental to generating spin-squeezing. We develop a simplified semi-analytic model that gives good agreement with our multi-mode simulation, and will be useful for predicting spin-squeezing in a range of different systems. ;"Quantum Physics (quant-ph); Quantum Gases (cond-mat.quant-gas)"
https://arxiv.org/abs/1402.0335;Distributed manipulation of two-qubit entanglement with coupled  continuous variables; Li-Tuo Shen,  Rong-Xin Chen,  Huai-Zhi Wu,  Zhen-Biao Yang;  We study the dynamics of two qubits separately sent through two coupled resonators, each initially containing a coherent state field. We present analytical arguments and numerical calculations for the qubit-field system under different two-qubit initial states, photon hopping strengths, and detunings. In far off-resonant regime, the maximal entanglement of two qubits can be generated with the initial qubit state in which one qubit is in the excited state and the other is in the ground state, and the initially maximal two-qubit entanglement can be frozen and fully revived even for large mean photon number. When the qubits are both initially in their excited states or ground states, the qubit-qubit entanglement birth and death apparently appear in the regime where the photon hopping strength is close to qubit-field detuning, and its peaks do not decrease monotonically as the interaction time increases. It is interesting to observe that when there is photon hopping strength between two fields, the field-field entanglement can be larger than one and increases as the initial amplitude of the coherent state grows. By postselecting the fields both in their coherent states, the entanglement of two initially unentangled qubits can be largely improved. Our present setup is fundamental for the distributed quantum information processing and applicable to different physical qubit-resonator systems. ;Quantum Physics (quant-ph)
https://arxiv.org/abs/1402.0342;Exact steady state manifold of a boundary driven spin-1 Lai-Sutherland  chain; Enej Ilievski,  Tomaz Prosen;  We present an explicit construction of a family of steady state density matrices for an open integrable spin-1 chain with bilinear and biquadratic interactions, also known as the Lai-Sutherland model, driven far from equilibrium by means of two oppositely polarizing Markovian dissipation channels localized at the boundary. The steady state solution exhibits n+1 fold degeneracy, for a chain of length n, due to existence of (strong) Liouvillian U(1) symmetry. The latter can be exploited to introduce a chemical potential and define a grand canonical nonequilibrium steady state ensemble. The matrix product form of the solution entails an infinitely-dimensional representation of a non-trivial Lie algebra (semidirect product of sl_2 and a non-nilpotent radical) and hints to a novel Yang-Baxter integrability structure. ;"Quantum Physics (quant-ph); Statistical Mechanics (cond-mat.stat-mech); Strongly Correlated Electrons (cond-mat.str-el); Exactly Solvable and Integrable Systems (nlin.SI)"
https://arxiv.org/abs/1402.0351;The Two Bell's Theorems of John Bell; Howard M. Wiseman;"  Many of the heated arguments about the meaning of ""Bell's theorem"" arise because this phrase can refer to two different theorems that John Bell proved, the first in 1964 and the second in 1976. His 1964 theorem is the incompatibility of quantum phenomena with the dual assumptions of locality and determinism. His 1976 theorem is the incompatibility of quantum phenomena with the unitary property of local causality. This is contrary to Bell's own later assertions, that his 1964 theorem began with that single, and indivisible, assumption of local causality (even if not by that name). While there are other forms of Bell's theorems --- which I present to explain the relation between Jarrett-completeness, ""fragile locality"", and EPR-completeness --- I maintain that Bell's two versions are the essential ones. Although the two Bell's theorems are logically equivalent, their assumptions are not, and the different versions of the theorem suggest quite different conclusions, which are embraced by different communities. For realists, the notion of local causality, ruled out by Bell's 1976 theorem, is motivated implicitly by Reichenbach's Principle of common cause and explicitly by the Principle of relativistic causality, and it is the latter which must be forgone. Operationalists pay no heed to Reichenbach's Principle, but wish to keep the Principle of relativistic causality, which, bolstered by an implicit ""Principle of agent-causation"", implies their notion of locality. Thus for operationalists, Bell's theorem is the 1964 one, and implies that it is determinism that must be forgone. I discuss why the two `camps' are drawn to these different conclusions, and what can be done to increase mutual understanding. ";"Quantum Physics (quant-ph); History and Philosophy of Physics (physics.hist-ph)"
https://arxiv.org/abs/1402.0370;Losses-based test of wave-particle duality with Mach-Zehnder  interferometers; Chen Yang,  Aiai Jia,  Xue Deng,  Yuchi Zhang,  Gang Li,  Shiyao Zhu,  Tiancai Zhang;  Wave-particle duality of photons with losses in the Mach-Zehnder interferometer (MZI) is investigated experimentally and theoretically. The experiment is done with the standard MZI with the beam splitter or the beam merger being continuously varied. The losses are deliberately introduced either inside the MZI (the two arms between the beam splitter and beam mergers) or outside the MZI (after the beam merger). It is proved that the unbalanced losses have great influence on the predictability $P$ (particle nature) and visibility $V$ (wave nature). For the former case the duality inequality holds while for the later the duality inequality is ``violated''. We get $P^2+V^2>1$. This ``violation'' could be eliminated in principle by switching the two paths and detectors and then averaging the results. The observed results can be exactly explained theoretically. The experiment is done with coherent beam, instead of single photons, and we have proved that they are exactly equivalent in duality experiment with MZI. ;Quantum Physics (quant-ph)
https://arxiv.org/abs/1402.0374;Inducing Non-Classical Lasing Via Periodic Drivings in Circuit Quantum  Electrodynamics; Carlos Navarrete-Benlloch,  Juan José García-Ripoll,  Diego Porras;  We show how a pair of superconducting qubits coupled to a microwave cavity mode can be used to engineer a single-atom laser that emits light into a non-classical state. Our scheme relies on the dressing of the qubit-field coupling by periodic modulations of the qubit energy. In the dressed basis, the radiative decay of the first qubit becomes an effective incoherent pumping mechanism that injects energy into the system, hence turning dissipation to our advantage. A second, auxiliary qubit is used to shape the decay within the cavity, in such a way that lasing occurs in a squeezed basis of the cavity mode. We characterize the system both by mean-field theory and exact calculations. Our work may find applications in the generation of squeezing and entanglement in circuit QED, as well as in the study of dissipative many-body phase transitions. ;Quantum Physics (quant-ph)
https://arxiv.org/abs/1402.0375;Highly symmetric POVMs and their informational power; Wojciech Słomczyński,  Anna Szymusiak;  We discuss the dependence of the Shannon entropy of normalized finite rank-1 POVMs on the choice of the input state, looking for the states that minimize this quantity. To distinguish the class of measurements where the problem can be solved analytically, we introduce the notion of highly symmetric POVMs and classify them in dimension two (for qubits). In this case we prove that the entropy is minimal, and hence the relative entropy (informational power) is maximal, if and only if the input state is orthogonal to one of the states constituting a POVM. The method used in the proof, employing the Michel theory of critical points for group action, the Hermite interpolation and the structure of invariant polynomials for unitary-antiunitary groups, can also be applied in higher dimensions and for other entropy-like functions. The links between entropy minimization and entropic uncertainty relations, the Wehrl entropy and the quantum dynamical entropy are described. ;"Quantum Physics (quant-ph); Information Theory (cs.IT); Mathematical Physics (math-ph)"
https://arxiv.org/abs/1402.0377;Interferometry with non-classical motional states of a Bose-Einstein  condensate; Sandrine van Frank,  Antonio Negretti,  Tarik Berrada,  Robert Bücker,  Simone Montangero,  Jean-François Schaff,  Thorsten Schumm,  Tommaso Calarco,  Jörg Schmiedmayer;  We demonstrate a two-pulse Ramsey-type interferometer for non-classical motional states of a Bose-Einstein condensate in an anharmonic trap. The control pulses used to manipulate the condensate wavefunction are obtained from Optimal Control Theory and directly optimised to maximise the interferometric contrast. They permit a fast manipulation of the atomic ensemble compared to the intrinsic decay and many-body dephasing effects, and thus to reach an interferometric contrast of 92% in the experimental implementation. ;"Quantum Physics (quant-ph); Quantum Gases (cond-mat.quant-gas)"
https://arxiv.org/abs/1402.0378;Optimisation of Bell inequalities with invariant Tsirelson bound; Michael Epping,  Hermann Kampermann,  Dagmar Bruß;  We consider a subclass of bipartite CHSH-type Bell inequalities. We investigate operations, which leave their Tsirelson bound invariant, but change their classical bound. The optimal observables are unaffected except for a relative rotation of the two laboratories. We illustrate the utility of these operations by giving explicit examples: We prove that for a fixed quantum state and fixed measurement setup except for a relative rotation of the two laboratories, there is a Bell inequality that is maximally violated for this rotation, and we optimise some Bell inequalities with respect to the maximal violation. Finally we optimise the qutrit to qubit ratio of some dimension witnessing Bell inequalities. ;Quantum Physics (quant-ph)
https://arxiv.org/abs/1402.0381;Infrared-dressed entanglement of cold open-shell polar molecules for  universal matchgate quantum computing; Felipe Herrera,  Yudong Cao,  Sabre Kais,  K. Birgitta Whaley;  Implementing a scalable quantum information processor using polar molecules in optical lattices requires precise control over the long-range dipole-dipole interaction between molecules in selected lattice sites. We present here a scheme using trapped open-shell $^2\Sigma$ polar molecules that allows dipolar exchange processes between nearest and next-nearest neighbors to be controlled to construct a generalized transverse Ising spin Hamiltonian with tunable $XX$, $YY$ and $XY$ couplings in the rotating frame of the driving lasers. The scheme requires a moderately strong bias magnetic field with near-infrared light to provide local tuning of the qubit energy gap, and mid-infrared pulses to perform rotational state transfer via stimulated Raman adiabatic passage. No interaction between qubits is present in the absence of the infrared driving. We analyze the fidelity of the resulting two-qubit matchgate, and demonstrate its robustness as a function of the driving parameters. We discuss a realistic application of the system for universal matchgate quantum computing in optical lattices. ;"Quantum Physics (quant-ph); Atomic Physics (physics.atom-ph); Chemical Physics (physics.chem-ph)"
https://arxiv.org/abs/1402.0396;Quantum Mechanics from Newton's Second Law and the Canonical Commutation  Relation [X,P]=i; Mark C. Palenik;  Despite the fact that it has been known since the time of Heisenberg that quantum operators obey a quantum version of Newton's laws, students are often told that derivations of quantum mechanics must necessarily follow from the Hamiltonian or Lagrangian formulations of mechanics. Here, we first derive the existing Heisenberg equations of motion from Newton's laws and the uncertainty principle using only the equations $F=\frac{dP}{dt}$, $P=m\frac{dV}{dt}$, and $\left[X,P\right]=i$. Then, a new expression for the propagator is derived that makes a connection between time evolution in quantum mechanics and the motion of a classical particle under Newton's laws. The propagator is solved for three cases where an exact solution is possible 1) the free particle 2) the harmonic oscillator 3) a constant force, or linear potential in the standard interpretation. Such a picture may be useful for students as they make the transition from classical to quantum mechanics and help solidify the equivalence of the Hamiltonian, Lagrangian, and Newtonian formulations of physics in their minds. ;Quantum Physics (quant-ph)
https://arxiv.org/abs/1402.0404;A generalization of the Entropy Power Inequality to Bosonic Quantum  Systems; Giacomo De Palma,  Andrea Mari,  Vittorio Giovannetti;  In most communication schemes information is transmitted via travelling modes of electromagnetic radiation. These modes are unavoidably subject to environmental noise along any physical transmission medium and the quality of the communication channel strongly depends on the minimum noise achievable at the output. For classical signals such noise can be rigorously quantified in terms of the associated Shannon entropy and it is subject to a fundamental lower bound called entropy power inequality. Electromagnetic fields are however quantum mechanical systems and then, especially in low intensity signals, the quantum nature of the information carrier cannot be neglected and many important results derived within classical information theory require non-trivial extensions to the quantum regime. Here we prove one possible generalization of the Entropy Power Inequality to quantum bosonic systems. The impact of this inequality in quantum information theory is potentially large and some relevant implications are considered in this work. ;"Quantum Physics (quant-ph); Mathematical Physics (math-ph)"
https://arxiv.org/abs/1402.0428;Parity-Time Symmetry Breaking beyond One Dimension: The Role of  Degeneracy; Li Ge,  A. Douglas Stone;  We consider the role of degeneracy in Parity-Time (PT) symmetry breaking for non-hermitian wave equations beyond one dimension. We show that if the spectrum is degenerate in the absence of T-breaking, and T is broken in a generic manner (without preserving other discrete symmetries), then the standard PT-symmetry breaking transition does not occur, meaning that the spectrum is complex even for infinitesimal strength of gain and loss. However the realness of the entire spectrum can be preserved over a finite interval if additional discrete symmetries X are imposed when T is broken, if X decouple all degenerate modes. When this is true only for a subset of the degenerate spectrum, there can be a partial PT transition in which this subset remains real over a finite interval of T-breaking. If the spectrum has odd-degeneracy, a fraction of the degenerate spectrum can remain in the symmetric phase even without imposing additional discrete symmetries, and they are analogous to dark states in atomic physics. These results are illustrated by the example of different T-breaking perturbations of a uniform dielectric disk and sphere, and a group theoretical analysis is given in the disk case. Finally, we show that multimode coupling is capable of restoring the T-symmetric phase at finite T-breaking. We also analyze these questions when the parity operator is replaced by another spatial symmetry operator and find that the behavior can be qualitatively different. ;"Quantum Physics (quant-ph); Optics (physics.optics)"
https://arxiv.org/abs/1402.0439;Coordinate-space approach to vacuum polarization; Paul Indelicato,  Peter J. Mohr,  J. Sapirstein;  The vacuum-polarization correction for bound electrons or muons is examined. The objective is to formulate a framework for calculating the correction from bound-state quantum electrodynamics entirely in coordinate space, including the Uehling potential which is usually isolated and treated separately. Pauli-Villars regularization is applied to the coordinate-space calculation and the most singular terms are shown to be eliminated, leaving the physical correction after charge renormalization. The conventional derivation of the Uehling potential in momentum space is reviewed and compared to the coordinate-space derivation. ;Quantum Physics (quant-ph)
https://arxiv.org/abs/1402.0447;Estimation of quantum states by weak and projective measurements; Debmalya Das,  Arvind;"  We explore the possibility of using ""weak"" measurements to carry out quantum state tomography. Given a certain fixed number of copies of identically prepared states of a qubit, we simulate state tomography using weak as well as projective measurements. Due to the collapse of the state after measurement, we cannot re-use the state after a projective measurement. If the coupling strength between the quantum system and the measurement device is made weaker, the disturbance caused to the state can be lowered. This then allows us to re-use the same member of the ensemble for further measurements and thus extract more information from the system. However, this happens at the expense of getting imprecise information from the first measurement. We simulate this scheme for a single qubit and show that under certain circumstances, it can outperform the projective measurement-based tomography scheme. This opens up the possibility of new ways of extracting information from quantum ensembles. We study the efficacy of this scheme for different coupling strengths. ";Quantum Physics (quant-ph)
https://arxiv.org/abs/1402.0481;An integrated processor for photonic quantum states using a broadband  light-matter interface; Erhan Saglamyurek,  Neil Sinclair,  Joshua A. Slater,  Khabat Heshami,  Daniel Oblak,  Wolfgang Tittel;  Faithful storage and coherent manipulation of quantum optical pulses are key for long distance quantum communications and quantum computing. Combining these functions in a light-matter interface that can be integrated on-chip with other photonic quantum technologies, e.g. sources of entangled photons, is an important step towards these applications. To date there have only been a few demonstrations of coherent pulse manipulation utilizing optical storage devices compatible with quantum states, and that only in atomic gas media (making integration difficult) and with limited capabilities. Here we describe how a broadband waveguide quantum memory based on the Atomic Frequency Comb (AFC) protocol can be used as a programmable processor for essentially arbitrary spectral and temporal manipulations of individual quantum optical pulses. Using weak coherent optical pulses at the few photon level, we experimentally demonstrate sequencing, time-to-frequency multiplexing and demultiplexing, splitting, interfering, temporal and spectral filtering, compressing and stretching as well as selective delaying. Our integrated light-matter interface offers high-rate, robust and easily configurable manipulation of quantum optical pulses and brings fully practical optical quantum devices one step closer to reality. Furthermore, as the AFC protocol is suitable for storage of intense light pulses, our processor may also find applications in classical communications. ;Quantum Physics (quant-ph)
https://arxiv.org/abs/1402.0489;Robust protocols for securely expanding randomness and distributing keys  using untrusted quantum devices; Carl A. Miller,  Yaoyun Shi;  Randomness is a vital resource for modern day information processing, especially for cryptography. A wide range of applications critically rely on abundant, high quality random numbers generated securely. Here we show how to expand a random seed at an exponential rate without trusting the underlying quantum devices. Our approach is secure against the most general adversaries, and has the following new features: cryptographic level of security, tolerating a constant level of imprecision in the devices, requiring only a unit size quantum memory per device component for the honest implementation, and allowing a large natural class of constructions for the protocol. In conjunct with a recent work by Chung, Shi and Wu, it also leads to robust unbounded expansion using just 2 multi-part devices. When adapted for distributing cryptographic keys, our method achieves, for the first time, exponential expansion combined with cryptographic security and noise tolerance. The proof proceeds by showing that the Renyi divergence of the outputs of the protocol (for a specific bounding operator) decreases linearly as the protocol iterates. At the heart of the proof are a new uncertainty principle on quantum measurements, and a method for simulating trusted measurements with untrusted devices. ;Quantum Physics (quant-ph)
https://arxiv.org/abs/1402.0495;True Limits to Precision via Unique Quantum Probe; Sergey I. Knysh,  Edward H. Chen,  Gabriel A. Durkin;"  Quantum instruments derived from composite systems allow greater measurement precision than their classical counterparts due to coherences maintained between N components; spins, atoms or photons. Decoherence that plagues real-world devices can be particle loss, or thermal excitation and relaxation, or dephasing due to external noise sources -- and also due to prior parameter uncertainty. All these adversely affect precision estimation of time, phase or frequency. We develop a novel technique uncovering the uniquely optimal probe states of the N `qubits' alongside new tight bounds on precision under local and collective mechanisms of these noise types above. For large quantum ensembles where numerical techniques fail, the problem reduces by analogy to finding the ground state of a 1-D particle in a potential well; the shape of the well is dictated by the type and strength of decoherence. The formalism is applied to prototypical Mach-Zehnder and Ramsey interferometers to discover the ultimate performance of real-world instruments. ";"Quantum Physics (quant-ph); Mathematical Physics (math-ph)"
