url;title;authors;abstract;subject
https://arxiv.org/abs/1403.0069;Why the Quantitative Condition Fails to Reveal Quantum Adiabaticity; Dafa Li,  Man-Hong Yung;  The quantitative adiabatic condition (QAC), or quantitative condition, is a convenient (a priori) tool for estimating the adiabaticity of quantum evolutions. However, the range of the applicability of QAC is not well understood. It has been shown that QAC can become insufficient for guaranteeing the validity of the adiabatic approximation, but under what conditions the QAC would become necessary has become controversial. Furthermore, it is believed that the inability for the QAC to reveal quantum adiabaticity is due to induced resonant transitions. However, it is not clear how to quantify these transitions in general. Here we present a progress to this problem by finding an exact relation that can reveal how transition amplitudes are related to QAC directly. As a posteriori condition for quantum adiabaticity, our result is universally applicable to any (nondegenerate) quantum system and gives a clear picture on how QAC could become insufficient or unnecessary for the adiabatic approximation, which is a problem that has gained considerable interest in the literature in recent years. ;Quantum Physics (quant-ph)
https://arxiv.org/abs/1403.0073;Local quanta, unitary inequivalence, and vacuum entanglement; Matias Rodriguez-Vazquez,  Marco del Rey,  Hans Westman,  Juan Leon;  In this work we develop a formalism for describing localised quanta for a real-valued Klein-Gordon field in a one-dimensional box $[0, R]$. We quantise the field using non-stationary local modes which, at some arbitrarily chosen initial time, are completely localised within the left or the right side of the box. In this concrete set-up we directly face the problems inherent to a notion of local field excitations, usually thought of as elementary particles. Specifically, by computing the Bogoliubov coefficients relating local and standard (global) quantizations, we show that the local quantisation yields a Fock space $\mathfrak F^L$ which is unitarily inequivalent to the standard one $\mathfrak F^G$. In spite of this, we find that the local creators and annihilators remain well defined in the global Fock space $\mathfrak F^G$, and so do the local number operators associated to the left and right partitions of the box. We end up with a useful mathematical toolbox to analyse and characterise local features of quantum states in $\mathfrak F^G$. Specifically, an analysis of the global vacuum state $|0_G\rangle\in\mathfrak F^G$ in terms of local number operators shows, as expected, the existence of entanglement between the left and right regions of the box. The local vacuum $|0_L\rangle\in\mathfrak F^L$, on the contrary, has a very different character. It is neither cyclic nor separating and displays no entanglement. Further analysis shows that the global vacuum also exhibits a distribution of local excitations reminiscent, in some respects, of a thermal bath. We discuss how the mathematical tools developed herein may open new ways for the analysis of fundamental problems in local quantum field theory. ;"Quantum Physics (quant-ph); General Relativity and Quantum Cosmology (gr-qc); High Energy Physics - Theory (hep-th); Mathematical Physics (math-ph)"
https://arxiv.org/abs/1403.0082;A weak-value model for virtual particles supplying the electric current  in graphene: the minimal conductivity and the Schwinger mechanism; Kazuhiro Yokota,  Nobuyuki Imoto;  We propose a model for the electric current in graphene in which electric carriers are supplied by virtual particles allowed by the uncertainty relations. The process to make a virtual particle real is described by a weak value of a group velocity: the velocity is requisite for the electric field to give the virtual particle the appropriate changes of both energy and momentum. With the weak value, we approximately estimate the electric current, considering the ballistic transport of the electric carriers. The current shows the quasi-Ohimic with the minimal conductivity of the order of e^2/h per channel. Crossing a certain ballistic time scale, it is brought to obey the Schwinger mechanism. ;"Quantum Physics (quant-ph); Mesoscale and Nanoscale Physics (cond-mat.mes-hall)"
https://arxiv.org/abs/1403.0116;Heisenberg versus standard scaling in quantum metrology with Markov  generated states and monitored environment; Catalin Catana,  Madalin Guta;  Finding optimal and noise robust probe states is a key problem in quantum metrology. In this paper we propose Markov dynamics as a possible mechanism for generating such states, and show how the Heisenberg scaling emerges for systems with multiple `dynamical phases' (stationary states), and noiseless channels. We model noisy channels by coupling the Markov output to `environment' ancillas, and consider the scenario where the environment is monitored to increase the quantum Fisher information of the output. In this setup we find that the survival of the Heisenberg limit depends on whether the environment receives `which phase' information about the memory system. ;Quantum Physics (quant-ph)
https://arxiv.org/abs/1403.0143;Preventing detector blinding attack and other random number generator  attacks on quantum cryptography by use of an explicit random number generator; Mario Stipčević;  A particularly successful detector blinding attack has been recently demonstrated on various quantum key distribution (QKD) systems, performing for the first time an undetectable and complete recovery of the key. In this paper two original contributions are given to understanding and prevention of this attack. ;Quantum Physics (quant-ph)
https://arxiv.org/abs/1403.0145;Does Chance Hide Necessity ? A Reevaluation of the Debate 'Determinism -  Indeterminism' in the Light of Quantum Mechanics and Probability Theory; Louis Vervoort;  In this PhD thesis the ancient question of determinism ('Does every event have a cause ?') will be re-examined. In the philosophy of science and physics communities the orthodox position states that the physical world is indeterministic: quantum events would have no causes but happen by irreducible chance. Arguably the clearest theorem that leads to this conclusion is Bell's theorem. The commonly accepted 'solution' to the theorem is 'indeterminism', in agreement with the Copenhagen interpretation. Here it is recalled that indeterminism is not really a physical but rather a philosophical hypothesis, and that it has counterintuitive and far-reaching implications. At the same time another solution to Bell's theorem exists, often termed 'superdeterminism' or 'total determinism'. Superdeterminism appears to be a philosophical position that is centuries and probably millennia old: it is for instance Spinoza's determinism. If Bell's theorem has both indeterministic and deterministic solutions, choosing between determinism and indeterminism is a philosophical question, not a matter of physical experimentation, as is widely believed. If it is impossible to use physics for deciding between both positions, it is legitimate to ask which philosophical theories are of help. Here it is argued that probability theory - more precisely the interpretation of probability - is instrumental for advancing the debate. It appears that the hypothesis of determinism allows to answer a series of precise questions from probability theory, while indeterminism remains silent for these questions. From this point of view determinism appears to be the most reasonable assumption, after all. ;Quantum Physics (quant-ph)
https://arxiv.org/abs/1403.0203;Quantum delayed-choice experiment with a beam splitter in a quantum  superposition; Shi-Biao Zheng,  You-Peng Zhong,  Kai Xu,  Qi-Jue Wang,  H. Wang,  Li-Tuo Shen,  Chui-Ping Yang,  John M. Martinis,  A. N. Cleland,  Si-Yuan Han;  A quantum system can behave as a wave or as a particle, depending on the experimental arrangement. When for example measuring a photon using a Mach-Zehnder interferometer, the photon acts as a wave if the second beam-splitter is inserted, but as a particle if this beam-splitter is omitted. The decision of whether or not to insert this beam-splitter can be made after the photon has entered the interferometer, as in Wheeler's famous delayed-choice thought experiment. In recent quantum versions of this experiment, this decision is controlled by a quantum ancilla, while the beam splitter is itself still a classical object. Here we propose and realize a variant of the quantum delayed-choice experiment. We configure a superconducting quantum circuit as a Ramsey interferometer, where the element that acts as the first beam-splitter can be put in a quantum superposition of its active and inactive states, as verified by the negative values of its Wigner function. We show that this enables the wave and particle aspects of the system to be observed with a single setup, without involving an ancilla that is not itself a part of the interferometer. We also study the transition of this quantum beam-splitter from a quantum to a classical object due to decoherence, as observed by monitoring the interferometer output. ;Quantum Physics (quant-ph)
https://arxiv.org/abs/1403.0226;Characterization and Control of Quantum Spin Chains and Rings; Sophie Schirmer,  Frank Langbein;  Information flow in quantum spin networks is considered. Two types of control -- temporal bang-bang switching control and control by varying spatial degrees of freedom -- are explored and shown to be effective in speeding up information transfer and increasing transfer fidelities. The control is model-based and therefore relies on accurate knowledge of the system parameters. An efficient protocol for simultaneous identification of the coupling strength and the exact number of spins in a chain is presented. ;Quantum Physics (quant-ph)
https://arxiv.org/abs/1403.0270;Quantum Random State Generation with Predefined Entanglement Constraint; Anmer Daskin,  Ananth Grama,  Sabre Kais;  Entanglement plays an important role in quantum communication, algorithms, and error correction. Schmidt coefficients are correlated to the eigenvalues of the reduced density matrix. These eigenvalues are used in Von Neumann entropy to quantify the amount of the bipartite entanglement. In this paper, we map the Schmidt basis and the associated coefficients to quantum circuits to generate random quantum states. We also show that it is possible to adjust the entanglement between subsystems by changing the quantum gates corresponding to the Schmidt coefficients. In this manner, random quantum states with predefined bipartite entanglement amounts can be generated using random Schmidt basis. This provides a technique for generating equivalent quantum states for given weighted graph states, which are very useful in the study of entanglement, quantum computing, and quantum error correction. ;"Quantum Physics (quant-ph); Information Theory (cs.IT)"
https://arxiv.org/abs/1403.0302;Energy eigenfunctions for position-dependent mass particles in a new  class of molecular hamiltonians; H. R. Christiansen,  M. S. Cunha;  Based on recent results on quasi-exactly solvable Schrodinger equations, we review a new phenomenological potential class lately reported. In the present paper we consider the quantum differential equations resulting from position dependent mass (PDM) particles. We focus on the PDM version of the hyperbolic potential $V(x) = {a}~\text{sech}^2x + {b}~\text{sech}^4x$, which we address analytically with no restrictions on the parameters and the energies. This is the celebrated Manning potential, a double-well widely known in molecular physics, until now not investigated for PDM. We also evaluate the PDM version of the sixth power hyperbolic potential $V(x) = {a}~{\text{sech}^6x}+b~{\text{sech}^4x}$ for which we could find exact expressions under some special settings. Finally, we address a triple-well case $V(x) = {a}~{\text{sech}^6x}+b~{\text{sech}^4x}+c~\text{sech}^2x$ of particular interest for its connection to the new trends in atomtronics. The PDM Schrodinger equations studied in the present paper yield analytical eigenfunctions in terms of local Heun functions in its confluents forms. In all the cases PDM particles are more likely tunneling than ordinary ones. In addition, a merging of eigenstates has been observed when the mass becomes nonuniform. ;"Quantum Physics (quant-ph); Mathematical Physics (math-ph)"
https://arxiv.org/abs/1403.0313;Fine-grained uncertainty relation under the relativistic motion; Jun Feng,  Yao-Zhong Zhang,  Mark D. Gould,  Heng Fan;  One of the most important features of quantum theory is the uncertainty principle. Amount various uncertainty relations, the profound Fine-Grained Uncertainty Relation (FGUR) is used to distinguish the uncertainty inherent in obtaining any combination of outcomes for different measurements. In this paper, we explore this uncertainty relation in relativistic regime. For observer undergoes an uniform acceleration who immersed in an Unruh thermal bath, we show that the uncertainty bound is dependent on the acceleration parameter and choice of Unruh modes. Dramatically, we find that the measurements in Mutually Unbiased Bases (MUBs), sharing same uncertainty bound in inertial frame, could be distinguished from each other for a noninertial observer. On the other hand, once the Unruh decoherence is prevented by utilizing the cavity, the entanglement could be generated from nonuniform motion. We show that, for the observer restricted in a single rigid cavity, the uncertainty exhibits a periodic evolution with respect to the duration of the acceleration and the uncertainty bounds can be degraded by the entanglement generation during particular epoch. With properly chosen cavity parameters, the uncertainty bounds could be protected. Otherwise, the measurements in different MUBs could be distinguished due to the relativistic motion of cavity. Implications of our results for gravitation and thermodynamics are discussed. ;"Quantum Physics (quant-ph); High Energy Physics - Theory (hep-th)"
https://arxiv.org/abs/1403.0314;Casimir interaction between spherical and planar plasma sheets; L. P. Teo;  We consider the interaction between a spherical plasma sheet and a planar plasma sheet due to the vacuum fluctuations of electromagnetic fields. We use the mode summation approach to derive the Casimir interaction energy and study its asymptotic behaviors. In the small separation regime, we confirm the proximity force approximation and calculate the first correction beyond the proximity force approximation. This study has potential application to model Casimir interaction between objects made of materials that can be modeled by plasma sheets such as graphene sheets. ;Quantum Physics (quant-ph)
https://arxiv.org/abs/1403.0340;Stochastic Qubits; Abdallah Smida,  Mahmoud Hachemane,  Amel-Hiba Hamici;  A new concept of qubits is given by considering entanglement of ordinary quibits with quantum measuring devices (micro-detectors). They are called stochastic qubits since they are generalized coherent states used in the stochastic (phase space) quantum theory. Entanglement is realized through the coupling of angular momenta $l$ and $\sigma$, where the micro-detector has $l=0,1$ and the qubit spin is $\sigma=1/2$. In both cases, the stochastic qubit has total spin $J=1/2$ and is entangled only when $l=1$. In this case, Stochastic Bell states have been defined and teleportation has been studied. They resemble conventional ones. When the micro-detecors have only two states, Stochastic qudits have rather been used. Here, Stochastic Bell states have also been defined and teleportation is possible for special states only. In the last step of this teleportation, Bob will have to transform the qubit only, or the micro-detector only, to recover Alice state. ;Quantum Physics (quant-ph)
https://arxiv.org/abs/1403.0367;"Comment on ""Experimental Test of Error-Disturbance Uncertainty Relations  by Weak Measurement"""; P. Busch,  P. Lahti,  R.F. Werner;  In this comment on the paper by F. Kaneda, S.-Y. Baek, M. Ozawa and K. Edamatsu [Phys. Rev. Lett. 112, 020402, 2014, arXiv:1308.5868], we point out that the claim of having refuted Heisenberg's error-disturbance relation is unfounded since it is based on the choice of unsuitable and operationally problematical quantifications of measurement error and disturbance. As we have shown elsewhere [PRL 111, 160405, 2013], for appropriate choices of operational measures of error and disturbance, Heisenberg's heuristic relation can be turned into a precise inequality which is a rigorous consequence of quantum mechanics. ;Quantum Physics (quant-ph)
https://arxiv.org/abs/1502.00067;Quantum interpretations of AWPP and APP; Tomoyuki Morimae,  Harumichi Nishimura;"  AWPP is a complexity class introduced by Fenner, Fortnow, Kurtz, and Li, which is defined using GapP functions. Although it is an important class as the best upperbound of BQP, its definition seems to be somehow artificial, and therefore it would be better if we have some ""physical interpretation"" of AWPP. Here we provide a quantum physical interpretation of AWPP: we show that AWPP is equal to the class of problems efficiently solved by a quantum computer with the ability of postselecting an event whose probability is close to an FP function. This result is applied to also obtain a quantum physical interpretation of APP. In addition, we consider ""classical physical analogue"" of these results, and show that a restricted version of ${\rm BPP}_{\rm path}$ contains ${\rm UP}\cap{\rm coUP}$ and is contained in WAPP. ";"Quantum Physics (quant-ph); Computational Complexity (cs.CC)"
https://arxiv.org/abs/1502.00123;Comment on QBism and locality in quantum mechanics; Michael Nauenberg;"  A critique to the article by C.A. Fuchs, N.D. Mermin, and R.Schack, ""An introduction to QBism with and application to the locality of quantum mechanics"" that appeared in Am. J. Phys. 82 (8), 749-754 (2014) ";Quantum Physics (quant-ph)
https://arxiv.org/abs/1502.00132;On a possibility to combine the order effect with sequential  reproducibility for quantum measurements; Irina Basieva,  Andrei Khrennikov;  In this paper we study the problem of a possibility to use quantum observables to describe a possible combination of the order effect with sequential reproducibility for quantum measurements. By the order effect we mean a dependence of probability distributions (of measurement results) on the order of measurements. We consider two types of the sequential reproducibility: adjacent reproducibility ($A-A$) and separated reproducibility($A-B-A$). The first one is reproducibility with probability 1 of a result of measurement of some observable $A$ measured twice, one $A$ measurement after the other. The second one, $A-B-A$, is reproducibility with probability 1 of a result of $A$ measurement when another quantum observable $B$ is measured between two $A$'s. Heuristically, it is clear that the second type of reproducibility is complementary to the order effect. We show that, surprisingly, for an important class of quantum observables given by positive operator valued measures (POVMs), this may not be the case. The order effect can coexist with a separated reproducibility as well as adjacent reproducibility for both observables $A$ and $B.$ However, the additional constraint in the form of separated reproducibility of the $B-A-B$ type makes this coexistence impossible. Mathematically, this paper is about the operator algebra for effects composing POVMs. The problem under consideration was motivated by attempts to apply the quantum formalism outside of physics, especially, in cognitive psychology and psychophysics. However, it is also important for foundations of quantum physics as a part of the problem about the structure of sequential quantum measurements. ;Quantum Physics (quant-ph)
https://arxiv.org/abs/1502.00160;Single Semiconductor Quantum Dots in Microcavities: Bright sources of  indistinguishable Photons; C. Schneider,  P. Gold,  C.-Y. Lu,  S. Höfling,  J.-W. Pan,  M. Kamp;  In this chapter we will discuss the technology and experimental techniques to realize quantum dot (QD) single photon sources combining high outcoupling efficiencies and highest degrees of non-postselected photon indistinguishability. The system, which is based on ultra low density InAs QDs embedded in a quasi planar single sided microcavity with natural photonic traps is an ideal testbed to study quantum light emission from single QDs. We will discuss the influence of the excitation conditions on the purity of the single photon emission, and in particular on the degree of indistinguishability of the emitted photons. While high purity triggered emission of single photons is observed under all tested excitation conditions, single photon interference effects can be almost vanish in experiments relying on non-resonant pumping into the quantum dot wetting layer. In contrast, we can observe nearly perfect indistinguishability of single photons in resonance fluorescence excitation conditions, which underlines the superiority of this excitation scheme to create photon wave packets close to the Fourier limit. As a first step towards the realization of solid state quantum networks based on quantum dot single photon sources we test the overlap of photons emitted from remote QDs yielding non-postselected interference visibilities on the order of ~40% for quasi resonant excitation. ;"Quantum Physics (quant-ph); Mesoscale and Nanoscale Physics (cond-mat.mes-hall)"
https://arxiv.org/abs/1502.00207;Quantum game players can have advantage without discord; Zhaohui Wei,  Shengyu Zhang;"  The last two decades have witnessed a rapid development of quantum information processing, a new paradigm which studies the power and limit of ""quantum advantages"" in various information processing tasks. Problems such as when quantum advantage exists, and if existing, how much it could be, are at a central position of these studies. In a broad class of scenarios, there are, implicitly or explicitly, at least two parties involved, who share a state, and the correlation in this shared state is the key factor to the efficiency under concern. In these scenarios, the shared \emph{entanglement} or \emph{discord} is usually what accounts for quantum advantage. In this paper, we examine a fundamental problem of this nature from the perspective of game theory, a branch of applied mathematics studying selfish behaviors of two or more players. We exhibit a natural zero-sum game, in which the chance for any player to win the game depends only on the ending correlation. We show that in a certain classical equilibrium, a situation in which no player can further increase her payoff by any local classical operation, whoever first uses a quantum computer has a big advantage over its classical opponent. The equilibrium is fair to both players and, as a shared correlation, it does not contain any discord, yet a quantum advantage still exists. This indicates that at least in game theory, the previous notion of discord as a measure of non-classical correlation needs to be reexamined, when there are two players with different objectives. ";"Quantum Physics (quant-ph); Computational Complexity (cs.CC); Computer Science and Game Theory (cs.GT)"
https://arxiv.org/abs/1502.00259;Optimal quantum operations at zero energy cost; Giulio Chiribella,  Yuxiang Yang;  Quantum technologies are developing powerful tools to generate and manipulate coherent superpositions of different energy levels. Envisaging a new generation of energy-efficient quantum devices, here we explore how coherence can be manipulated without exchanging energy with the surrounding environment. We start from the task of converting a coherent superposition of energy eigenstates into another. We identify the optimal energy-preserving operations, both in the deterministic and in the probabilistic scenario. We then design a recursive protocol, wherein a branching sequence of energy-preserving filters increases the probability of success while reaching maximum fidelity at each iteration. Building on the recursive protocol, we construct efficient approximations of the optimal fidelity-probability trade-off, by taking coherent superpositions of the different branches generated by probabilistic filtering. The benefits of this construction are illustrated in applications to quantum metrology, quantum cloning, coherent state amplification, and ancilla-driven computation. Finally, we extend our results to transitions where the input state is generally mixed and we apply our findings to the task of purifying quantum coherence. ;Quantum Physics (quant-ph)
