url;title;authors;abstract;subject
https://arxiv.org/abs/1501.00316;Phenomenological modelling for Time-Resolved Electron Paramagnetic  Resonance in radical-triplet system; Wei Wu;  The spin dynamics of radical-triplet system (RTS) has been calculated by using the Lindblad formalism within the theory of open quantum system. The single-radical-triplet system (SRTS) is considered here for single-qubit quantum gate operations while double-radical-triplet system (DRTS) for two-qubit operations. The environment effects taken into account include the spin-lattice relaxation of the triplet exciton and radical spin-$\frac{1}{2}$, the inter-system crossing process that induces the transition from singlet excited state to the triplet ground state, and the rather slow relaxation process from the triplet ground state back down to the singlet ground state. These calculations shown that the line shape broadening is strongly related to the exchange interaction between triplet and exciton, which can be understood as a spontaneous magnetic field created by the triplet renormalises the original spin-$\frac{1}{2}$ electron spin resonance spectra. This work will provide key information about the spin dynamics for building optically-controlled molecular quantum gate out of radical-bearing molecules. Moreover, this has generated the further theoretical question on how the mixture of fermion and boson behaves. ;"Quantum Physics (quant-ph); Information Theory (cs.IT)"
https://arxiv.org/abs/1501.00344;An impurity-induced gap system as a quantum data bus for quantum state  transfer; Bing Chen,  Yong Li,  Z. Song,  C.-P. Sun;"  We introduce a tight-binding chain with a single impurity to act as a quantum data bus for perfect quantum state transfer. Our proposal is based on the weak coupling limit of the two outermost quantum dots to the data bus. First show that the data bus has an energy gap between the ground and first-excited states in the single-particle case induced by the impurity in the single particle case. By connecting two quantum dots to two sites of the data bus, the system can accomplish a high-fidelity and long-distance quantum state transfer. Numerical simulations were performed for a finite system; the results show that the numerical and analytical results of the effective coupling strength agree well with each other. Moreover, we study the robustness of this quantum communication protocol in the presence of disorder in the couplings between the nearest-neighbor quantum dots. We find that the gap of the system plays an important role in robust quantum state transfer. ";Quantum Physics (quant-ph)
https://arxiv.org/abs/1501.00443;Interplay between Fano resonance and $\mathcal{PT} $ symmetry in  non-Hermitian discrete systems; Baogang Zhu,  Rong Lü,  Shu Chen;  We study the effect of PT-symmetric complex potentials on the transport properties of non-Hermitian systems, which consist of an infinite linear chain and two side-coupled defect points with PT-symmetric complex on-site potentials. By analytically solving the scattering problem of two typical models, which display standard Fano resonances in the absence of non-Hermitian terms, we find that the PT-symmetric imaginary potentials can lead to some pronounced effects on transport properties of our systems, including changes from the perfect reflection to perfect transmission, and rich behaviors for the absence or existence of the prefect reflection at one and two resonant frequencies. Our study can help us to understand the interplay between the Fano resonance and PT symmetry in non-Hermitian discrete systems, which may be realizable in optical waveguide experiments. ;Quantum Physics (quant-ph)
https://arxiv.org/abs/1501.00458;Quantum voting and violation of Arrow's Impossibility Theorem; Ning Bao,  Nicole Yunger Halpern;  We propose a quantum voting system, in the spirit of quantum games such as the quantum Prisoner's Dilemma. Our scheme enables a constitution to violate a quantum analog of Arrow's Impossibility Theorem. Arrow's Theorem is a claim proved deductively in economics: Every (classical) constitution endowed with three innocuous-seeming properties is a dictatorship. We construct quantum analogs of constitutions, of the properties, and of Arrow's Theorem. A quantum version of majority rule, we show, violates this Quantum Arrow Conjecture. Our voting system allows for tactical-voting strategies reliant on entanglement, interference, and superpositions. This contribution to quantum game theory helps elucidate how quantum phenomena can be harnessed for strategic advantage. ;Quantum Physics (quant-ph)
https://arxiv.org/abs/1501.00558;Five-Partite Entanglement Generation in A High-Q Microresonator; Yutian Wen,  Xufei Wu,  Rongyu Li,  Qiang Lin,  Guangqiang He;  We propose to produce five-partite entanglement via cascaded four-wave mixing in a high-Q microresonator that may become a key to future one-way quantum computation on chip. A theoretical model is presented for the underlying continuous-variable entanglement among the generated comb modes that is expansible to more complicated scenarios. We analyze the entanglement condition when the van Loock and Furusawa criteria are violated, and discuss the device parameters for potential experimental realization that may be utilized to build an integrated compact five-partite entanglement generator. The proposed approach exhibits great potential for future large-scale integrated full optical quantum computation on chip. ;"Quantum Physics (quant-ph); Optics (physics.optics)"
https://arxiv.org/abs/1501.00559;The Learnability of Unknown Quantum Measurements; Hao-Chung Cheng,  Min-Hsiu Hsieh,  Ping-Cheng Yeh;  Quantum machine learning has received significant attention in recent years, and promising progress has been made in the development of quantum algorithms to speed up traditional machine learning tasks. In this work, however, we focus on investigating the information-theoretic upper bounds of sample complexity - how many training samples are sufficient to predict the future behaviour of an unknown target function. This kind of problem is, arguably, one of the most fundamental problems in statistical learning theory and the bounds for practical settings can be completely characterised by a simple measure of complexity. Our main result in the paper is that, for learning an unknown quantum measurement, the upper bound, given by the fat-shattering dimension, is linearly proportional to the dimension of the underlying Hilbert space. Learning an unknown quantum state becomes a dual problem to ours, and as a byproduct, we can recover Aaronson's famous result [Proc. R. Soc. A 463:3089-3144 (2007)] solely using a classical machine learning technique. In addition, other famous complexity measures like covering numbers and Rademacher complexities are derived explicitly. We are able to connect measures of sample complexity with various areas in quantum information science, e.g. quantum state/measurement tomography, quantum state discrimination and quantum random access codes, which may be of independent interest. Lastly, with the assistance of general Bloch-sphere representation, we show that learning quantum measurements/states can be mathematically formulated as a neural network. Consequently, classical ML algorithms can be applied to efficiently accomplish the two quantum learning tasks. ;"Quantum Physics (quant-ph); Learning (cs.LG); Machine Learning (stat.ML)"
https://arxiv.org/abs/1501.00636;Hybrid opto-mechanical systems with nitrogen-vacancy centers; Zhang-qi Yin,  Nan Zhao,  Tongcang Li;  In this review, we briefly overview recent works on hybrid (nano) opto-mechanical systems that contain both mechanical oscillators and diamond nitrogen-vacancy (NV) centers. We review two different types of mechanical oscillators. The first one is a clamped mechanical oscillator, such as a cantilever, with a fixed frequency. The second one is an optically trapped nano-diamond with a build-in nitrogen-vacancy center. By coupling mechanical resonators with electron spins, we can use the spins to control the motion of mechanical oscillators. For the first setup, we discuss two different coupling mechanisms which are magnetic coupling and strain induced coupling. We summarize their applications such as cooling the mechanical oscillator, generating entanglements between NV centers, squeezing spin ensembles and et al. For the second setup, we discuss how to generate quantum superposition states with magnetic coupling, and realize matter wave interferometer. We will also review its applications as ultra-sensitive mass spectrometer. Finally, we discuss new coupling mechanisms and applications of the field. ;"Quantum Physics (quant-ph); Mesoscale and Nanoscale Physics (cond-mat.mes-hall)"
https://arxiv.org/abs/1501.00693;Do Spins Have Directions?; Diederik Aerts,  Massimiliano Sassoli de Bianchi;  The standard Bloch sphere representation was recently generalized to the 'extended Bloch representation' describing not only systems of arbitrary dimension, but also their measurements. This model solves the measurement problem and is based on the 'hidden-measurement interpretation', according to which the Born rule results from our lack of knowledge about the interaction between measuring apparatus and the measured entity. We present here the extended Bloch model and use it to investigate the nature of quantum spin and its relation to our Euclidean space. We show that spin eigenstates cannot generally be associated with directions in the Euclidean space, but only with generalized directions in the Blochean space, which generally is a space of higher dimension. Hence, spin entities have to be considered as genuine non-spatial entities. We also show, however, that specific vectors can be identified in the Blochean theater that are isomorphic to the Euclidean space directions, and therefore representative of them, and that spin eigenstates always have a predetermined orientation with respect to them. We use the details of our results to put forward a new view of realism, that we call 'multiplex realism', providing a specific framework with which to interpret the human observations and understanding of the component parts of the world. Elements of reality can be represented in different theaters, one being our customary Euclidean space, and another one the quantum realm, revealed to us through our sophisticated experiments, whose elements of reality, in the quantum jargon, are the eigenvalues and eigenstates. Our understanding of the component parts of the world can then be guided by looking for the possible connections, in the form of partial morphisms, between the different representations, which is precisely what we do in this article with regard to spin entities. ;Quantum Physics (quant-ph)
https://arxiv.org/abs/1501.00742;LEQA: Latency Estimation for a Quantum Algorithm Mapped to a Quantum  Circuit Fabric; Mohammad Javad Dousti,  Massoud Pedram;  This paper presents LEQA, a fast latency estimation tool for evaluating the performance of a quantum algorithm mapped to a quantum fabric. The actual quantum algorithm latency can be computed by performing detailed scheduling, placement and routing of the quantum instructions and qubits in a quantum operation dependency graph on a quantum circuit fabric. This is, however, a very expensive proposition that requires large amounts of processing time. Instead, LEQA, which is based on computing the neighborhood population counts of qubits, can produce estimates of the circuit latency with good accuracy (i.e., an average of less than 3% error) with up to two orders of magnitude speedup for mid-size benchmarks. This speedup is expected to increase superlinearly as a function of circuit size (operation count). ;"Quantum Physics (quant-ph); Emerging Technologies (cs.ET)"
https://arxiv.org/abs/1501.00745;Dimension formula for induced maximal faces of separable states and  genuine entanglement; Lin Chen,  Dragomir Z. Djokovic;  The normalized separable states of a finite-dimensional multipartite quantum system, represented by its Hilbert space ${\cal H}$, form a closed convex set ${\cal S}_1$. The set ${\cal S}_1$ has two kinds of faces, induced and non-induced. An induced face, $F$, has the form $F=\Gamma(F_V)$, where $V$ is a subspace of ${\cal H}$, $F_V$ is the set of $\rho\in{\cal S}_1$ whose range is contained in $V$, and $\Gamma$ is a partial transposition operator. Such $F$ is a maximal face if and only if $V$ is a hyperplane. We give a simple formula for the dimension of any induced maximal face. We also prove that the maximum dimension of induced maximal faces is equal to $d(d-2)$ where $d$ is the dimension of ${\cal H}$. The equality $\dim\Gamma(F_V)=d(d-2)$ holds if and only if $V^\perp$ is spanned by a genuinely entangled vector. ;Quantum Physics (quant-ph)
https://arxiv.org/abs/1501.00768;Three-qubit entanglement witnesses with the full spanning properties; Seung-Hyeok Kye;  We construct three-qubit entanglement witnesses with the properties that all the partial transposes have the spanning properties. These witnesses determine faces for separable states whose interior lies in the interior of PPT states, and so they detect sets of PPT entangled states with nonempty interiors. These witnesses also detect all kinds of bi-separable pure product states. Our construction depends on the observation that multi-partite entanglement witnesses correspond to multi-linear maps which are positive. ;Quantum Physics (quant-ph)
https://arxiv.org/abs/1501.00807;Bell inequality tests using asymmetric entangled coherent states in  asymmetric lossy environments; Chae-Yeun Park,  Hyunseok Jeong;  We study an asymmetric form of two-mode entangled coherent state (ECS), where the two local amplitudes have different values, for testing the Bell-Clauser-Horne-Shimony-Holt (Bell-CHSH) inequality. We find that the asymmetric ECSs have obvious advantages over the symmetric form of ECSs in testing the Bell-CHSH inequality. We further study an asymmetric strategy in distributing an ECS over a lossy environment and find that such a scheme can significantly increase violation of the inequality. ;Quantum Physics (quant-ph)
https://arxiv.org/abs/1501.00817;Phase Selective Quantum Eraser; A. Heuer,  G. Pieplow,  R. Menzel;  A quantum-eraser experiment is reported with photon pairs generated by two synchronously pumped parametric down converters coupled via induced coherence. The complementarity between which-source information and two-photon interference fringe visibility has been investigated by two coupled interferometers. ;Quantum Physics (quant-ph)
https://arxiv.org/abs/1501.00840;Dependence of the time-reading process of the Salecker--Wigner quantum  clock on the size of the clock; Andor Frenkel;  It is shown in the present note that the degree of the complexity of the time-reading process of the Salecker--Wigner clock depends on the size of the clock. This dependence leads to a relation between the size and the accuracy of the clock, and suggests a precise optimal value for the size in agreement with the order of magnitude value established by Salecker and Wigner. ;Quantum Physics (quant-ph)
https://arxiv.org/abs/1501.00850;Tight bound on trace distance between a realistic device with partially  indistinguishable bosons and the ideal Boson Sampling; V. S. Shchesnovich;  We study the closeness of an experimental unitary bosonic network with only partially indistinguishable bosons in an arbitrary mixed input state, in particular an experimental realization of the Boson Sampling, to the ideal bosonic network, where the measure of closeness of two networks is the trace distance between the output probability distributions. An upper bound on the trace distance to the ideal bosonic network is proven and also a bound on the difference between probabilities of an output configuration. Moreover, the upper bound on the trace distance is tight, provided that a physically transparent distinguishability conjecture is true. For a small distinguishability error it is shown that a realistic device with $N$ bosons is at a constant trace distance to the ideal Boson Sampling under the $O(N^{-1})$-scaling of the mismatch of internal states of bosons. ;"Quantum Physics (quant-ph); Statistical Mechanics (cond-mat.stat-mech); Computational Complexity (cs.CC)"
https://arxiv.org/abs/1501.00898;Two-Color Photon Correlations of the Light Scattered by a Quantum Dot; M. Peiris,  B. Petrak,  K. Konthasinghe,  Y. Yu,  Z. C. Niu,  A. Muller;"  Two-color second-order correlations of the light scattered near-resonantly by a quantum dot were measured by means of spectrally-filtered coincidence detection. The effects of filter frequency and bandwidth were studied under monochromatic laser excitation, and a complete two-photon spectrum was reconstructed. In contrast to the ordinary one-photon spectrum, the two-photon spectrum is asymmetric with laser detuning and exhibits a rich structure associated with both real and virtual two-photon transitions down the ""dressed states"" ladder. Photon pairs generated via virtual transitions are found to violate the Cauchy-Schwartz inequality by a factor of 60. Our experiments are well described by the theoretical expressions obtained by del Valle et al. via time-and normally-ordered correlation functions. ";"Quantum Physics (quant-ph); Atomic Physics (physics.atom-ph); Optics (physics.optics)"
https://arxiv.org/abs/1501.00942;Dzyaloshinskii-Moriya interaction as an agent to free the bound  entangled states; Kapil K. Sharma,  S. N. Pandey;  In the present article we investigate the efficacy of Dzyaloshisnhkii-Moriya (DM) interaction to convert the bound entangled states into free entangled states. Here we consider the tripartite hybrid system as a pair of non interacting two qutrits initially prepared in bound entangled states and one auxiliary qubit. The auxiliary qubit interacts with any one of the qutrit of the pair through DM interaction. It has been found that the DM interaction free the bound entangled states as time advances. In the present work we consider two types of bound entangled states investigated by Horodecki. Further we find that the frequency of free entanglement conversion is same in both the states. We also investigate the phenomenon of entanglement and distillability sudden death and their possibilities. Here the realignment criteria and negativity have been used for detection and quantification of entanglement. ;Quantum Physics (quant-ph)
https://arxiv.org/abs/1501.00944;Toward a thermo-hydrodynamic like description of Schrodinger equation  via the Madelung formulation and Fisher information; Eyal Heifetz,  Eliahu Cohen;  We revisit the analogy suggested by Madelung between a non-relativistic time-dependent quantum particle, to a fluid system which is pseudo-barotropic, irrotational and inviscid. We first discuss the hydrodynamical properties of the Madelung description in general, and extract a pressure like term from the Bohm potential. We show that the existence of a pressure gradient force in the fluid description does not violate Ehrenfest's theorem since its expectation value is zero. We also point out that incompressibility of the fluid implies conservation of density along a fluid parcel trajectory and in 1D this immediately results in the non-spreading property of wave packets, as the sum of Bohm potential and an exterior potential must be either constant or linear in space. Next we relate to the hydrodynamic description a thermodynamic counterpart, taking the classical behavior of an adiabatic barotopric flow as a reference. We show that while the Bohm potential is not a positive definite quantity, as is expected from internal energy, its expectation value is proportional to the Fisher information whose integrand is positive definite. Moreover, this integrand is exactly equal to half of the square of the imaginary part of the momentum, as the integrand of the kinetic energy is equal to half of the square of the real part of the momentum. This suggests a relation between the Fisher information and the thermodynamic like internal energy of the Madelung fluid. Furthermore, it provides a physical linkage between the inverse of the Fisher information and the measure of disorder in quantum systems - in spontaneous adiabatic gas expansion the amount of disorder increases while the internal energy decreases. ;"Quantum Physics (quant-ph); Other Condensed Matter (cond-mat.other)"
https://arxiv.org/abs/1501.00952;Heat Bath Algorithmic Cooling with Spins: Review and Prospects; Daniel K. Park,  Nayeli A. Rodriguez-Briones,  Guanru Feng,  Robabeh R. Darabad,  Jonathan Baugh,  Raymond Laflamme;  Application of multiple rounds of Quantum Error Correction (QEC) is an essential milestone towards the construction of scalable quantum information processing devices. However, experimental realizations of it are still in their infancy. The requirements for multiple round QEC are high control fidelity and the ability to extract entropy from ancilla qubits. Nuclear Magnetic Resonance (NMR) based quantum devices have demonstrated high control fidelity with up to 12 qubits. On the other hand, the major challenge in the NMR QEC experiment is to efficiently supply ancilla qubits in highly pure states at the beginning of each round of QEC. Purification of qubits in NMR, or in other ensemble based quantum systems can be accomplished through Heat Bath Algorithmic Cooling (HBAC). It is an efficient method for extracting entropy from qubits that interact with a heat bath, allowing cooling below the bath temperature. For practical HBAC, coupled electron-nuclear spin systems are more promising than conventional NMR quantum processors, since electron spin polarization is about $10^3$ times greater than that of a proton under the same experimental conditions. We provide an overview on both theoretical and experimental aspects of HBAC focusing on spin and magnetic resonance based systems, and discuss the prospects of exploiting electron-nuclear coupled systems for the realization of HBAC and multiple round QEC. ;Quantum Physics (quant-ph)
https://arxiv.org/abs/1501.00956;Heralded quantum gates with integrated error detection in optical  cavities; J. Borregaard,  P. Kómár,  E. M. Kessler,  A. S. Sørensen,  M. D. Lukin;  We propose and analyze heralded quantum gates between qubits in optical cavities. They employ an auxiliary qubit to report if a successful gate occurred. In this manner, the errors, which would have corrupted a deterministic gate, are converted into a non-unity probability of success: once successful the gate has a much higher fidelity than a similar deterministic gate. Specifically, we describe that a heralded , near-deterministic controlled phase gate (CZ-gate) with the conditional error arbitrarily close to zero and the success probability that approaches unity as the cooperativity of the system, C, becomes large. Furthermore, we describe an extension to near-deterministic N- qubit Toffoli gate with a favorable error scaling. These gates can be directly employed in quantum repeater networks to facilitate near-ideal entanglement swapping, thus greatly speeding up the entanglement distribution. ;Quantum Physics (quant-ph)
https://arxiv.org/abs/1501.00970;A delayed choice quantum eraser explained by the transactional  interpretation of quantum mechanics; H. Fearn;"  This paper explains the delayed choice quantum eraser of Kim et al. in terms of the transactional interpretation of quantum mechanics by John Cramer. It is kept deliberately mathematically simple to help explain the transactional technique. The emphasis is on a clear understanding of how the instantaneous ""collapse"" of the wave function due to a measurement at a specific time and place may be reinterpreted as a gradual collapse over the entire path of the photon and over the entire transit time from slit to detector. This is made possible by the use of a retarded offer wave, which is thought to travel from the slits (or rather the small region within the parametric crystal where down-conversion takes place) to the detector and an advanced counter wave traveling backward in time from the detector to the slits. The point here is to make clear how simple the Cramer transactional picture is and how much more intuitive the collapse of the wave function becomes if viewed in this way. Also any confusion about possible retro-causal signaling is put to rest. A delayed choice quantum eraser does not require any sort of backward in time communication. This paper makes the point that it is preferable to use the Transactional Interpretation (TI) over the usual Copenhagen Interpretation (CI) for a more intuitive understanding of the quantum eraser delayed choice experiment. Both methods give exactly the same end results and can be used interchangeably. ";Quantum Physics (quant-ph)
https://arxiv.org/abs/1501.00975;Group theoretical analysis of a quantum-mechanical three-dimensional  quartic anharmonic oscillator; Francisco M. Fernández;  This paper illustrates the application of group theory to a quantum-mechanical three-dimensional quartic anharmonic oscillator with $O_{h}$ symmetry. It is shown that group theory predicts the degeneracy of the energy levels and facilitates the application of perturbation theory and the Rayleigh-Ritz variational method as well as the interpretation of the results in terms of the symmetry of the solutions . We show how to obtain suitable symmetry-adapted basis sets. ;Quantum Physics (quant-ph)
