url;title;authors;abstract;subject
https://arxiv.org/abs/1401.0026;Simpler proof of the theorem by Pusey, Barrett, and Rudolph on the  reality of the quantum state; C. Moseley;  The theorem of Pusey, Barrett, and Rudolph proves that different quantum states describe different physical realities. Their proof is based on the construction of entanglement measurement bases of two, and more than two qbits. In this note, I show that a two-qubit entanglement base is sufficient for a general proof. ;Quantum Physics (quant-ph)
https://arxiv.org/abs/1401.0028;Emergence of stationary many-body entanglement in driven-dissipative  Rydberg lattice gases; S. K. Lee,  J. Cho,  K. S. Choi;"  Non-equilibrium quantum dynamics represents an emerging paradigm for condensed matter physics, quantum information science, and statistical mechanics. Strongly interacting Rydberg atoms offer an attractive platform to study driven-dissipative dynamics of quantum spin models with long-range order. Here, we explore the conditions under which stationary many-body entanglement persists with near-unit fidelity and high scalability. In our approach, coherent many-body dynamics is driven by Rydberg-mediated laser transitions, while atoms at the lattice boundary reduce the entropy of the many-body state. Surprisingly, the many-body entanglement is established by continuously evolving a locally dissipative Rydberg system towards the steady-state, as with optical pumping. We characterize the dynamics of multipartite entanglement in a 1D lattice by way of quantum uncertainty relations, and demonstrate the long-range behavior of the stationary entanglement with finite-size scaling, reaching ""hectapartite"" entanglement under experimental conditions. Our work opens a route towards dissipative preparation of many-body entanglement with unprecedented scaling behavior. ";Quantum Physics (quant-ph)
https://arxiv.org/abs/1401.0057;High fidelity state mapping performed in a V-type level structure via  stimulated Raman transition; Grzegorz Chimczak;  It is proved that a qubit encoded in excited states of a V-type quantum system cannot be perfectly transferred to the state of the cavity field mode using a single rectangular laser pulse. This obstacle can be overcome by using a two-stage protocol, in which the fidelity of a state-mapping operation can be increased to nearly one. ;Quantum Physics (quant-ph)
https://arxiv.org/abs/1401.0058;Secure quantum weak oblivious transfer against individual measurements; Guang Ping He;  In quantum weak oblivious transfer, Alice sends Bob two bits and Bob can learn one of the bits at his choice. It was found that the security of such a protocol is bounded by $2P_{Alice}^{\ast }+P_{Bob}^{\ast }\geq 2$, where $P_{Alice}^{\ast }$ is the probability with which Alice can guess Bob's choice, and $P_{Bob}^{\ast }$ is the probability with which Bob can guess both of Alice's bits\ given that he learns one of the bits with certainty. Here we propose a protocol and show that as long as Alice is restricted to individual measurements, then both $P_{Alice}^{\ast }$ and $P_{Bob}^{\ast }$ can be made arbitrarily close to 1/2, so that maximal violation of the security bound can be reached. Even with some limited collective attacks, the security bound can still be violated. Therefore, although our protocol still cannot break the bound in principle when Alice has unlimited cheating power, it is sufficient for achieving secure quantum weak oblivious transfer in practice. ;Quantum Physics (quant-ph)
https://arxiv.org/abs/1401.0064;Linearity of quantum probability measure and Hardy's model; Kazuo Fujikawa,  C.H. Oh,  Chengjie Zhang;"  We re-examine d=4 hidden-variables-models for a system of two spin-$1/2$ particles in view of the concrete model of Hardy, who analyzed the criterion of entanglement without referring to inequality. The basis of our analysis is the linearity of the probability measure related to the Born probability interpretation, which excludes non-contextual hidden-variables models in $d\geq 3$. To be specific, we note the inconsistency of the non-contextual hidden-variables model in $d=4$ with the linearity of the quantum mechanical probability measure in the sense $\langle\psi|{\bf a}\cdot {\bf \sigma}\otimes{\bf b}\cdot {\bf \sigma}|\psi\rangle+\langle\psi|{\bf a}\cdot {\bf \sigma}\otimes{\bf b}^{\prime}\cdot {\bf \sigma}|\psi\rangle=\langle\psi|{\bf a}\cdot {\bf \sigma}\otimes ({\bf b}+{\bf b}^{\prime})\cdot {\bf \sigma}|\psi\rangle$ for non-collinear ${\bf b}$ and ${\bf b}^{\prime}$. It is then shown that Hardy's model in $d=4$ does not lead to a unique mathematical expression in the demonstration of the discrepancy of local realism (hidden-variables model) with entanglement and thus his proof is incomplete. We identify the origin of this non-uniqueness with the non-uniqueness of translating quantum mechanical expressions into expressions in hidden-variables models, which results from the failure of the above linearity of the probability measure. In contrast, if the linearity of the probability measure is strictly imposed, which is tantamount to asking that the non-contextual hidden-variables model in $d=4$ gives the CHSH inequality $|\langle B\rangle|\leq 2$ uniquely, it is shown that the hidden-variables model can describe only separable quantum mechanical states; this conclusion is in perfect agreement with the so-called Gisin's theorem which states that $|\langle B\rangle|\leq 2$ implies separable states. ";Quantum Physics (quant-ph)
https://arxiv.org/abs/1401.0099;Invariants for maximally entangled vectors and unitary bases; Sibasish Ghosh,  Ajit Iqbal Singh;  The purpose of this paper is to study the equivalence relation on unitary bases defined by R. F. Werner [{\it J. Phys. A: Math. Gen.} {\bf 34} (2001) 7081], relate it to local operations on maximally entangled vectors bases, find an invariant for equivalence classes in terms of certain commuting systems, and, relate it to mutually unbiased bases and Hadamard matrices. Illustrations are given in the context of latin squares and projective representations as well. Applications to quantum tomography are indicated. ;"Quantum Physics (quant-ph); Mathematical Physics (math-ph)"
https://arxiv.org/abs/1401.0129;Twin paradox with macroscopic clocks in superconducting circuits; Joel Lindkvist,  Carlos Sabín,  Ivette Fuentes,  Andrzej Dragan,  Ida-Maria Svensson,  Per Delsing,  Göran Johansson;  We propose an implementation of a twin paradox scenario in superconducting circuits, with velocities as large as a few percent of the speed of light. Ultrafast modulation of the boundary conditions for the electromagnetic field in a microwave cavity simulates a clock moving at relativistic speeds. Since our cavity has a finite length, the setup allows us to investigate the role of clock size as well as interesting quantum effects on time dilation. In particular, our theoretical results show that the time dilation increases for larger cavity lengths and is shifted due to quantum particle creation. ;"Quantum Physics (quant-ph); Mesoscale and Nanoscale Physics (cond-mat.mes-hall); General Relativity and Quantum Cosmology (gr-qc)"
https://arxiv.org/abs/1401.0147;Spatial distribution of Spontaneous Parametric Down-Converted Photons  for higher order Optical Vortices; Shashi Prabhakar,  Salla Gangi Reddy,  A Aadhi,  Ashok Kumar,  Chithrabhanu P,  G. K. Samanta,  R. P. Singh;  We make a source of entangled photons (SEP) using spontaneous parametric down-conversion (SPDC) in a non-linear crystal and study the spatial distribution of photon pairs obtained through the down-conversion of different modes of light including higher order vortices. We observe that for the Gaussian pump, the thickness of the SPDC ring varies linearly with the radius of pump beam. However, in case of vortex carrying beams, two concentric SPDC rings are formed for beams above a critical radius. The full width at half maximum (FWHM) of SPDC rings increase with increase in the order of optical vortex beams. The presence of a critical beam width for the vortices as well as the observed FWHM of the SPDC rings are supported with our numerical results. ;"Quantum Physics (quant-ph); Optics (physics.optics)"
https://arxiv.org/abs/1401.0148;About transmission of thermal light through the surface of a body into  the vacuum; M. V. Lebedev;  The problem of the change of photon distribution of thermal light passing through the body surface into the vacuum is discussed. It is shown that the usual assumption that each photon passes through the boundary totally independent of others contradicts the expression for the fluctuation of thermal light found by A. Einstein. ;Quantum Physics (quant-ph)
https://arxiv.org/abs/1401.0167;Causality Violation and Nonlinear Quantum Mechanics; Jacques Pienaar;  It is currently unknown whether the laws of physics permit time travel into the past. While general relativity indicates the theoretical possibility of causality violation, it is now widely accepted that a theory of quantum gravity must play an essential role in such cases. As a striking example, the logical paradoxes usually associated with causality violation can be resolved by quantum effects. We ask whether the explicit construction of a theory that allows causality violation might in turn teach us something about quantum gravity. Taking the toy model of Deutsch as a starting point, in Part I we argue that, despite being a nonlinear modification of quantum mechanics, the model does not imply superluminal signalling and its predictions can be operationally verified by experimenters within an appropriate ontological setting. In Part II we show that the model can be directly applied to scalar quantum fields, provided the fields are sent back in time by an amount much larger than the coherence time of the wavepackets. We propose a generalisation of the model that lifts this constraint and recovers the predictions of standard quantum field theory when the size of the temporal jump is much smaller than the coherence time of the wavepackets. Finally, we discuss an extension of the model to ordinary gravitational time dilation. The resulting model generalises and extends earlier work on the topic and can be tested experimentally using current technology. ;Quantum Physics (quant-ph)
https://arxiv.org/abs/1401.0175;Multiple photon detection and the localization of light energy; M. V. Lebedev;  It is shown that probabilities of photon detection can be found on the basis of consideration of the phase space sells filling for an ideal photon gas, which led Bose to the derivation of the Planks law. These probabilities are directly connected to photon localization properties consistent with the entropy of a dilute photon gas found by Einstein. ;Quantum Physics (quant-ph)
https://arxiv.org/abs/1401.0176;"A clock containing a massive object in a superposition of states; what  makes Penrosian wavefunction collapse tick?"; Tjerk H. Oosterkamp,  Jan Zaanen;  Penrose has been advocating the view that the collapse of the wave function is rooted in the incompatibility between general relativity and quantum mechanics. On the basis of conceptual analysis, he arrived at an estimate for the collapse time. To better understand his estimate, in this paper we present a thought experiment, which singles out the role of time-dilations in massive superpositions. First we investigate the behavior of a hypothetical clock containing a component which can be in a superposition of states. The clock contains a massive object, whose only purpose is to introduce a curvature of space time into the problem. We find that a state of this massive object with a smaller radius, but with the same mass, experiences a larger time dilation. Considering a coherent superposition of the large and small object, introduces an ambiguity in the definition of a common time for both states. We assert that this time ambiguity can be thought to affect the time evolution of a state in different ways and that the relative phase difference between these different interpretations can be calculated. We postulate that the wave function collapse will occur when this phase difference becomes of order unity. An absolute energy scale enters this equation and we recover Penrose's estimate for the collapse time by equating the absolute energy scale to the rest mass of the object. ;Quantum Physics (quant-ph)
https://arxiv.org/abs/1401.0196;Unitary Equivalence of Quantum Walks; Sandeep K Goyal,  Thomas Konrad,  Lajos Diósi;  A simple coined quantum walk in one dimension can be characterized by a $SU(2)$ operator with three parameters which represents the coin toss. However, different such coin toss operators lead to equivalent dynamics of the quantum walker. In this manuscript we present the unitary equivalence classes of quantum walks and show that all the nonequivalent quantum walks can be distinguished by a single parameter. Moreover, we argue that the electric quantum walks are equivalent to quantum walks with time dependent coin toss operator. ;Quantum Physics (quant-ph)
https://arxiv.org/abs/1401.0257;Fast Scalable State Measurement with Superconducting Qubits; Daniel Sank,  Evan Jeffrey,  J.Y. Mutus,  T.C. White,  J. Kelly,  R. Barends,  Y. Chen,  Z. Chen,  B. Chiaro,  A. Dunsworth,  A. Megrant,  P.J.J. O'Malley,  C. Neill,  P. Roushan,  A. Vainsencher,  J. Wenner,  A.N. Cleland,  J.M. Martinis;  Progress in superconducting qubit experiments with greater numbers of qubits or advanced techniques such as feedback requires faster and more accurate state measurement. We have designed a multiplexed measurement system with a bandpass filter that allows fast measurement without increasing environmental damping of the qubits. We use this to demonstrate simultaneous measurement of four qubits on a single superconducting integrated circuit, the fastest of which can be measured to 99.8% accuracy in 140ns. This accuracy and speed is suitable for advanced multi-qubit experiments including surface code error correction. ;Quantum Physics (quant-ph)
https://arxiv.org/abs/1401.0286;Testing Superdeterministic Conspiracy; Sabine Hossenfelder;  Tests of Bell's theorem rule out local hidden variables theories. But any theorem is only as good as the assumptions that go into it, and one of these assumptions is that the experimenter can freely chose the detector settings. Without this assumption, one enters the realm of superdeterministic hidden variables theories and can no longer use Bell's theorem as a criterion. One can like or not like such superdeterministic hidden variables theories and their inevitable nonlocality, the real question is how one can test them. Here, we propose a possible experiment that could reveal superdeterminism. ;Quantum Physics (quant-ph)
https://arxiv.org/abs/1401.0419;A possible definition of a {\it Realistic} Physics Theory; Nicolas Gisin;  A definition of a {\it Realistic} Physics Theory is proposed based on the idea that, at all time, the set of physical properties possessed (at that time) by a system should unequivocally determine the probabilities of outcomes of all possible measurements. ;Quantum Physics (quant-ph)
https://arxiv.org/abs/1401.0436;Optical interference in view of the probability distribution of photon  detection; Toru Kawakubo,  Katsuji Yamamoto;  We investigate interference of optical fields by examining the probability distribution of photon detection. The usual description of interference patterns in terms of superposition of classical mean fields with definite phases is elucidated in quantum fashion. Especially, for interference of two independent mixtures of number states with Poissonian or sub-Poissonian statistics, despite lack of intrinsic phases, it is found that the joint probability has a distinct peak manifold in the multi-dimensional space of the detector outcomes, which is along the trajectory of the mean-field values as the relative phase varies on the unit circle. Then, an interference pattern should mostly appear in each shot of measurement as a point in the peak manifold with a randomly chosen relative phase. On the other hand, for super-Poissonian sources the mean-field description is likely invalidated with rather broad probability distributions. ;Quantum Physics (quant-ph)
https://arxiv.org/abs/1401.0439;Single- and coupled-channel radial inverse scattering with  supersymmetric transformations; Daniel Baye,  Jean-Marc Sparenberg,  Andrey M Pupasov-Maksimov,  Boris F Samsonov;  The present status of the coupled-channel inverse-scattering method with supersymmetric transformations is reviewed. We first revisit in a pedagogical way the single-channel case, where the supersymmetric approach is shown to provide a complete solution to the inverse-scattering problem. A special emphasis is put on the differences between conservative and non-conservative transformations. In particular, we show that for the zero initial potential, a non-conservative transformation is always equivalent to a pair of conservative transformations. These single-channel results are illustrated on the inversion of the neutron-proton triplet eigenphase shifts for the S and D waves. We then summarize and extend our previous works on the coupled-channel case and stress remaining difficulties and open questions. We mostly concentrate on two-channel examples to illustrate general principles while keeping mathematics as simple as possible. In particular, we discuss the difference between the equal-threshold and different-threshold problems. For equal thresholds, conservative transformations can provide non-diagonal Jost and scattering matrices. Iterations of such transformations are shown to lead to practical algorithms for inversion. A convenient technique where the mixing parameter is fitted independently of the eigenphases is developed with iterations of pairs of conjugate transformations and applied to the neutron-proton triplet S-D scattering matrix, for which exactly-solvable matrix potential models are constructed. For different thresholds, conservative transformations do not seem to be able to provide a non-trivial coupling between channels. In contrast, a single non-conservative transformation can generate coupled-channel potentials starting from the zero potential and is a promising first step towards a full solution to the coupled-channel inverse problem with threshold differences. ;"Quantum Physics (quant-ph); Mathematical Physics (math-ph); Nuclear Theory (nucl-th)"
https://arxiv.org/abs/1401.0456;New Approach to Quantum Error Correction; Ri Qu,  Bing-jian Shang,  Yan-ru Bao,  Yi-ping Ma;  Operator quantum error correction provides a unified framework for the known techniques of quantum error correction such as the standard error correction model, the method of decoherence-free subspaces, and the noiseless subsystem method. We first show an example of a new quantum error correction scheme which can not be described by operation quantum error correction. Then we introduce a different notion of noiseless subsystems according to the example. Base on this notion, we present a more unified approach which incorporates operator quantum error correction as a special case. Moreover, we also give a sufficient and necessary condition of quantum error correction using this approach. We show that this approach provides more recovery operations than operator quantum error correction, which possibly leads to simpler decoding procedures. ;Quantum Physics (quant-ph)
https://arxiv.org/abs/1401.0476;Hybrid Quantum-Classical Master Equations; Lajos Diósi;  We discuss hybrid master equations of composite systems which are hybrids of classical and quantum subsystems. A fairly general form of hybrid master equations is suggested, its consistency is derived from the consistency of Lindblad quantum master equations. We emphasize that quantum measurement is a natural example of exact hybrid systems. We derive a heuristic hybrid master equation of time-continuous position measurement ;"Quantum Physics (quant-ph); Mesoscale and Nanoscale Physics (cond-mat.mes-hall); Mathematical Physics (math-ph)"
https://arxiv.org/abs/1401.0566;Detecting the work statistics through Ramsey-like interferometry; Laura Mazzola,  Gabriele De Chiara,  Mauro Paternostro;  Out-of-equilibrium statistical mechanics is attracting considerable interest due to the recent advances in the control and manipulations of systems at the quantum level. Recently, an interferometric scheme for the detection of the characteristic function of the work distribution following a time-dependent process has been proposed [L. Mazzola {\it et al}, Phys. Rev. Lett. {\bf 110} 230602 (2013)]. There, it was demonstrated that the work statistics of a quantum system undergoing a process can be reconstructed by effectively mapping the characteristic function of work on the state of an ancillary qubit. Here, we expand that work in two important directions. We first apply the protocol to an interesting specific physical example consisting of a superconducting qubit dispersively coupled to the field of a microwave resonator, thus enlarging the class of situations for which our scheme would be key in the task highlighted above. We then account for the interaction of the system with an additional one (which might embody an environment), and generalise the protocol accordingly. ;"Quantum Physics (quant-ph); Statistical Mechanics (cond-mat.stat-mech)"
https://arxiv.org/abs/1401.0596;Quantum fisher information in noninertial frames; Yao Yao,  Xing Xiao,  Li Ge,  Xiao-guang Wang,  Chang-pu Sun;  We investigate the performance of quantum fisher information under the Unruh-Hawking effect, where one of the observers (eg, Rob) is uniformly accelerated with respect to other partners. In the context of relativistic quantum information theory, we demonstrate that quantum fisher information, as an important measure of the information content of quantum states, has a rich and subtle physical structure comparing with entanglement or Bell nonlocality. In this work, we mainly focus on the parameterized (and arbitrary) pure two-qubit states, where the weight parameter $\theta$ and phase parameter $\phi$ are naturally introduced. Intriguingly, we prove that $\mathcal{F}_\theta$ keeps unchanged for both scalar and Dirac fields. Meanwhile, we observe that $\mathcal{F}_\phi$ decreases with the increase of acceleration $r$ but remains finite in the limit of infinite acceleration. More importantly, our results show that the symmetry of $\mathcal{F}_\phi$ (with respect to $\theta=\pi/4$) has been broken by the influence of Unruh effect for both cases. ;Quantum Physics (quant-ph)
https://arxiv.org/abs/1401.0622;Lower Bound of Concurrence for Qubit Systems; Xue-Na Zhu,  Shao-Ming Fei;  We study the concurrence of four-qubit quantum states and provide analytical lower bounds of concurrence in terms of the monogamy inequality of concurrence for qubit systems. It is shown that these lower bounds are able to improve the existing bounds and detect entanglement better. The approach is generalized to arbitrary qubit systems. ;Quantum Physics (quant-ph)
https://arxiv.org/abs/1401.0633;Intensity-Intensity Correlations of Classically Entangled Light; Partha Ghose,  Anirban Mukherjee;  An experiment is proposed to show that after initial frequency and polarization selection, classical thermal light from two independent sources can be made path-polarization entangled. Such light will show new intensity-intensity correlations involving both path and polarization phases, formally similar to those for four-particle GHZ states. For fixed polarization phases, the correlations reduce to the Hanbury Brown-Twiss phase correlations. It is also shown that these classical correlations violate noncontextuality. ;Quantum Physics (quant-ph)
https://arxiv.org/abs/1401.0657;Tunneling-induced angular momentum for single cold atoms; Ricard Menchon-Enrich,  Suzanne McEndoo,  Jordi Mompart,  Veronica Ahufinger,  Thomas Busch;"  We study the generation of angular momentum carrying states for a single cold particle by breaking the symmetry of a spatial adiabatic passage process in a two-dimensional system consisting of three harmonic potential wells. By following a superposition of two eigenstates of the system, a single cold particle is completely transferred to the degenerate first excited states of the final trap, which are resonantly coupled via tunneling to the ground states of the initial and middle traps. Depending on the total time of the process, angular momentum is generated in the final trap, with values that oscillate between $\pm\hbar$. This process is discussed in terms of the asymptotic eigenstates of the individual wells and the results have been checked by simulations of the full two-dimensional Schr\""odinger equation. ";"Quantum Physics (quant-ph); Quantum Gases (cond-mat.quant-gas); Atomic Physics (physics.atom-ph)"
